{"article_title": "Grassley Lists Trump as a Democrat, Forgets Cruz", "article_keywords": ["used", "grassley", "trump", "democrat", "lists", "ranging", "cruz", "letter", "typical", "iowa", "weekly", "forgets", "issues", "fundraising"], "article_url": "http://www.weeklystandard.com/grassley-lists-trump-as-a-democrat-forgets-cruz/article/1014006", "article_text": "\"It was an error by a graphic artist looking at design not content. The artist moved a name to make evenly spaced columns and didn't replace a name listed twice with a missing name. The result was inaccurate listings. We deeply regret it and have apologized to the campaigns involved, and we're working to correct it.\"\n\nIn the past few days, a Grassley fundraising letter has appeared in Iowans\u2019 mail boxes. It\u2019s the typical fundraising letter we are used to seeing in Iowa. It\u2019s as much about the presidential race as it is about Grassley\u2019s re-election bid. The reply device is called the \u201c2015 Iowa Issues Survey.\u201d It asks you to answer 20 simple questions on issues ranging from the Second Amendment to Obamacare and return it with a check ranging from $250 to $1,250 \u2013 at least that\u2019s what my letter asked me to give.\n\nThe Weekly Standard http://assets.weeklystandard.com.s3.amazonaws.com/tws15/images/logo-large.png\n\nThe Weekly Standard\n\n2015\n\nWashington, DC\n\nPolitics\n\nhttp://www.weeklystandard.com/grassley-lists-trump-as-a-democrat-forgets-cruz/article/1014006\n\n2015-08-18T13:32\n\n2015-08-18T17:58\n\nGrassley Lists Trump as a Democrat, Forgets Cruz\n\nChuck Grassley, the dean of the Iowa congressional delegation, recently sent out a fundraising letter/poll to Iowa voters. (He's running for his seventh six-year term in the Senate in 2016.) Craig Robinson at The Iowa Republican writes: In the past few days, a Grassley fundraising letter has appeared in Iowans\u2019 mail boxes. It\u2019s the typical fundraising letter we are used to seeing in Iowa. It\u2019s as much about the presidential race as it is about Grassley\u2019s re-election bid. The reply device is called the \u201c2015 Iowa Issues Survey.\u201d It asks you to answer 20 simple questions on issues ranging from the Second Amendment to Obamacare and return it with a check ranging from $250 to $1,250 \u2013 at least that\u2019s what my letter asked me to give.\n\nDemocrats, Donald Trump, Iowa, Republicans, Ted Cruz, Jim Swift\n\nhttp://cdn.weeklystandard.biz/cache/280x280-a0485e9cde8435ede3c8632615728b91.jpg", "article_metadata": {"news_keywords": "Democrats,Donald Trump,Iowa,Republicans,Ted Cruz,Jim Swift", "og": {"site_name": "Weekly Standard", "description": "Chuck Grassley, the dean of the Iowa congressional delegation, recently sent out a fundraising letter/poll to Iowa voters. (He's running for his seventh six-year term in the Senate in 2016.)\nCraig Robinson at The Iowa Republican&nbsp;writes:\n\nIn the past few days, a Grassley fundraising letter has appeared in Iowans\u2019 mail boxes. It\u2019s the typical fundraising letter we are used to seeing in Iowa. It\u2019s as much about the presidential race as it is about Grassley\u2019s re-election bid. The reply device is called the \u201c2015 Iowa Issues Survey.\u201d It asks you to answer 20 simple questions on issues ranging from the Second Amendment to Obamacare and return it with a check ranging from $250 to $1,250 \u2013 at least that\u2019s what my letter asked me to give.", "title": "Grassley Lists Trump as a Democrat, Forgets Cruz", "url": "http://www.weeklystandard.com/grassley-lists-trump-as-a-democrat-forgets-cruz/article/1014006", "image": "http://cdn.weeklystandard.biz/cache/r960-a0485e9cde8435ede3c8632615728b91.jpg", "type": "article"}, "twitter": {"description": "Chuck Grassley, the dean of the Iowa congressional delegation, recently sent out a fundraising letter/poll to Iowa voters. (He's running for his seventh six-year term in the Senate in 2016.)\nCraig Robinson at The Iowa Republican&nbsp;writes:\n\nIn the past few days, a Grassley fundraising letter has appeared in Iowans\u2019 mail boxes. It\u2019s the typical fundraising letter we are used to seeing in Iowa. It\u2019s as much about the presidential race as it is about Grassley\u2019s re-election bid. The reply device is called the \u201c2015 Iowa Issues Survey.\u201d It asks you to answer 20 simple questions on issues ranging from the Second Amendment to Obamacare and return it with a check ranging from $250 to $1,250 \u2013 at least that\u2019s what my letter asked me to give.", "creator": "@jswifttws", "image": "http://cdn.weeklystandard.biz/cache/r960-a0485e9cde8435ede3c8632615728b91.jpg", "title": "Grassley Lists Trump as a Democrat, Forgets Cruz", "site": "@weeklystandard", "widgets": {"csp": "on"}, "card": "summary"}, "fb": {"admins": 1285945407}, "google-site-verification": "QxcYUvYDy42iu46zPMF2vwdQlMXsJP74MqOgujGnpaQ", "keywords": "Democrats,Donald Trump,Iowa,Republicans,Ted Cruz,Jim Swift", "article": {"author": "Jim Swift", "published_time": "2015-08-18 13:32", "title": "Grassley Lists Trump as a Democrat, Forgets Cruz"}, "viewport": "width=device-width,user-scalable=0"}, "_id": "\"57477af36914bd0286fd181c\"", "article_summary": "In the past few days, a Grassley fundraising letter has appeared in Iowans\u2019 mail boxes.\nDemocrats, Donald Trump, Iowa, Republicans, Ted Cruz, Jim Swifthttp://cdn.weeklystandard.biz/cache/280x280-a0485e9cde8435ede3c8632615728b91.jpg\nCraig Robinson at The Iowa Republican writes: In the past few days, a Grassley fundraising letter has appeared in Iowans\u2019 mail boxes.\nThe Weekly Standard http://assets.weeklystandard.com.s3.amazonaws.com/tws15/images/logo-large.pngThe Weekly Standard2015Washington, DCPoliticshttp://www.weeklystandard.com/grassley-lists-trump-as-a-democrat-forgets-cruz/article/10140062015-08-18T13:322015-08-18T17:58Grassley Lists Trump as a Democrat, Forgets CruzChuck Grassley, the dean of the Iowa congressional delegation, recently sent out a fundraising letter/poll to Iowa voters.\nIt\u2019s the typical fundraising letter we are used to seeing in Iowa."}