{"article_title": "TAVR Gives Patients New Chance at Life in Later Years", "article_keywords": ["md", "life", "yearswhile", "help", "later", "chance", "lifesaving", "patients", "clinic", "tavr", "cleveland", "kapadia", "procedure", "gives"], "article_url": "http://www.hcplive.com/medical-news/qanda-with-samir-kapadia-from-cleveland-clinic-tavr-gives-patients-new-chance-at-life-in-later-years", "article_text": "Q&A With Samir Kapadia From Cleveland Clinic: TAVR Gives Patients New Chance at Life in Later Years\n\nA whole new segment of the population, particularly elderly patients are now eligible for a lifesaving cardiac procedure with the development of Transcatheter Aortic Valve Replacement or TAVR.Samir Kapadia, MD, from Cleveland Clinic discussed how this procedure was developed and implemented at the Ohio institution during an interview with MD Magazine.Now that TAVR is a surgical option patients who might otherwise have survived can now see their lives extended many years.While TAVR may not be available at all hospitals across the country there are many institutions performing this lifesaving procedure.While many patients can benefit from undergoing the TAVR procedure, their ability to afford the procedure and whether their insurance will cover it is another issue. As the procedure becomes more common that could help more patients get the financial help they need.", "article_metadata": {"description": "A whole new segment of the population, particularly elderly patients are now eligible for a lifesaving cardiac procedure with the development of Transcatheter Aortic Valve Replacement or TAVR.", "og": {"site_name": "MD Magazine", "description": "A whole new segment of the population, particularly elderly patients are now eligible for a lifesaving cardiac procedure with the development of Transcatheter Aortic Valve Replacement or TAVR.", "title": "Q&A With Samir Kapadia From Cleveland Clinic: TAVR Gives Patients New Chance at Life in Later Years", "url": "http://www.hcplive.com/medical-news/qanda-with-samir-kapadia-from-cleveland-clinic-tavr-gives-patients-new-chance-at-life-in-later-years", "image": "https://s3.amazonaws.com/hcplive/v1_media/_upload_image/_thumbnails/Screen Shot 2015-08-17 at 4.18.08 PM.png", "type": "Article"}, "msapplication-TileColor": "#ffffff", "msapplication-TileImage": "https://s3.amazonaws.com/hcplive/v2_media/_core/favi/ms-icon-144x144.png", "keywords": "cardiology, TAVR, hospital medicine, surgery", "theme-color": "#ffffff"}, "_id": "\"57477af46914bd0286fdb54f\"", "article_summary": "As the procedure becomes more common that could help more patients get the financial help they need.\nQ&A With Samir Kapadia From Cleveland Clinic: TAVR Gives Patients New Chance at Life in Later YearsA whole new segment of the population, particularly elderly patients are now eligible for a lifesaving cardiac procedure with the development of Transcatheter Aortic Valve Replacement or TAVR.Samir Kapadia, MD, from Cleveland Clinic discussed how this procedure was developed and implemented at the Ohio institution during an interview with MD Magazine.Now that TAVR is a surgical option patients who might otherwise have survived can now see their lives extended many years.While TAVR may not be available at all hospitals across the country there are many institutions performing this lifesaving procedure.While many patients can benefit from undergoing the TAVR procedure, their ability to afford the procedure and whether their insurance will cover it is another issue."}