{"article_title": "Anthony Trollope on governing lightly: a lesson for Obamacare architects", "article_keywords": ["free", "member", "parliament", "lightly", "thinking", "country", "object", "obamacare", "architects", "anthony", "servant", "feel", "governing", "members", "need", "lesson", "trollope"], "article_url": "http://www.washingtonexaminer.com/anthony-trollope-on-governing-lightly-a-lesson-for-obamacare-architects/article/2543380", "article_text": "And I would have you always remember the purport for which there is a Parliament elected in this happy and free country. It is not that some men may shine there, that some may acquire power, or that all may plume themselves on being the elect of the nation. It often appears to me that some members of Parliament so regard their success in life \u2014 as the fellows of our colleges do too often, thinking that their fellowships were awarded for their comfort and not for the furtherance of any object as education or religion. I have known gentlemen who have felt that in becoming members of Parliament that they had achieved an object for themselves instead of thinking that they had put themselves in the way of achieving something for others. A member of Parliament should feel himself to be the servant of his country \u2014 and like every other servant, he should serve. If this be distasteful to a man he need not go into Parliament. If the harness gall him he need not wear it. But if he takes the trappings he should draw the coach. You are there as the guardian of your fellow-countrymen \u2014 that they may be safe, that they may be prosperous, that they may be well governed and lightly burdened--above all that they may be free. If you cannot feel this to be your duty, you should not be there at all.\n\nThe Washington Examiner http://www.washingtonexaminer.com/s3/wex15/img/wex_eagle_large.png\n\nThe Washington Examiner\n\n2014\n\nWashington, DC\n\nPolitics\n\nhttp://www.washingtonexaminer.com/anthony-trollope-on-governing-lightly-a-lesson-for-obamacare-architects/article/2543380\n\n2014-02-03T00:00\n\n2014-02-03T16:37\n\nAnthony Trollope on governing lightly: a lesson for Obamacare architects\n\nMyron Gananian, M.D., of Menlo Park, California, emails me in response to my Wall Street Journal opinion article \u201cHow Obamacare misreads America.\u201d Dr. Gananian quotes from Anthony Trollope's The Duke's Children, the sixth and last in his series of political novels, the advice given in a letter by the former Liberal party Prime Minister Plantagenet Palliser, the Duke of Omnium, to his son Lord Silverbridge, recently elected as a Conservative member of Parliament* from a constituency whose voters are accustomed to give the Duke deference. And I would have you always remember the purport for which there is a Parliament elected in this happy and free country. It is not that some men may shine there, that some may acquire power, or that all may plume themselves on being the elect of the nation. It often appears to me that some members of Parliament so regard their success in life \u2014 as the fellows of our colleges do too often, thinking that their fellowships were awarded for their comfort and not for the furtherance of any object as education or religion. I have known gentlemen who have felt that in becoming members of Parliament that they had achieved an object for themselves instead of thinking that they had put themselves in the way of achieving something for others. A member of Parliament should feel himself to be the servant of his country \u2014 and like every other servant, he should serve. If this be distasteful to a man he need not go into Parliament. If the harness gall him he need not wear it. But if he takes the trappings he should draw the coach. You are there as the guardian of your fellow-countrymen \u2014 that they may be safe, that they may be prosperous, that they may be well governed and lightly burdened--above all that they may be free. If you cannot feel this to be your duty, you should not be there at all.\n\nBeltway Confidential,Opinion,Michael Barone\n\nhttp://cdn.washingtonexaminer.biz/cache/360x205-593e34aa5970fe316ebefb4824ecabc0.jpg", "article_metadata": {"description": "Myron Gananian, M.D., of Menlo Park, California, emails me in response to my Wall Street Journal opinion article \u201cHow Obamacare misreads America.\u201d Dr. Gananian quotes from Anthony Trollope's The Duke's Children, the sixth and last in his series of political novels, the advice given in a letter by the former Liberal party Prime Minister Plantagenet Palliser, the Duke of Omnium, to his son Lord Silverbridge, recently elected as a Conservative member of Parliament* from a constituency whose voters are accustomed to give the Duke deference.\n\nAnd I would have you always remember the purport for which there is a Parliament elected in this happy and free country. It is not that some men may shine there, that some may acquire power, or that all may plume themselves on being the elect of the nation. It often appears to me that some members of Parliament so regard their success in life \u2014 as the fellows of our colleges do too often, thinking that their fellowships were awarded for their comfort and not for the furtherance of any object as education or religion. I have known gentlemen who have felt that in becoming members of Parliament that they had achieved an object for themselves instead of thinking that they had put themselves in the way of achieving something for others. A member of Parliament should feel himself to be the servant of his country \u2014 and like every other servant, he should serve. If this be distasteful to a man he need not go into Parliament. If the harness gall him he need not wear it. But if he takes the trappings he should draw the coach. You are there as the guardian of your fellow-countrymen \u2014 that they may be safe, that they may be prosperous, that they may be well governed and lightly burdened--above all that they may be free. If you cannot feel this to be your duty, you should not be there at all.", "copyright": "Copyright (c) 2016 The Washington Examiner. All Rights Reserved", "og": {"site_name": "Washington Examiner", "description": "Myron Gananian, M.D., of Menlo Park, California, emails me in response to my Wall Street Journal opinion article \u201cHow Obamacare misreads America.\u201d Dr. Gananian quotes from Anthony Trollope's The Duke's Children, the sixth and last in his series of political novels, the advice given in a letter by the former Liberal party Prime Minister Plantagenet Palliser, the Duke of Omnium, to his son Lord Silverbridge, recently elected as a Conservative member of Parliament* from a constituency whose voters are accustomed to give the Duke deference.\n\nAnd I would have you always remember the purport for which there is a Parliament elected in this happy and free country. It is not that some men may shine there, that some may acquire power, or that all may plume themselves on being the elect of the nation. It often appears to me that some members of Parliament so regard their success in life \u2014 as the fellows of our colleges do too often, thinking that their fellowships were awarded for their comfort and not for the furtherance of any object as education or religion. I have known gentlemen who have felt that in becoming members of Parliament that they had achieved an object for themselves instead of thinking that they had put themselves in the way of achieving something for others. A member of Parliament should feel himself to be the servant of his country \u2014 and like every other servant, he should serve. If this be distasteful to a man he need not go into Parliament. If the harness gall him he need not wear it. But if he takes the trappings he should draw the coach. You are there as the guardian of your fellow-countrymen \u2014 that they may be safe, that they may be prosperous, that they may be well governed and lightly burdened--above all that they may be free. If you cannot feel this to be your duty, you should not be there at all.", "title": "Anthony Trollope on governing lightly: a lesson for Obamacare architects", "url": "http://www.washingtonexaminer.com/anthony-trollope-on-governing-lightly-a-lesson-for-obamacare-architects/article/2543380", "image": "http://cdn.washingtonexaminer.biz/cache/r960-593e34aa5970fe316ebefb4824ecabc0.jpg?v=2016.05.19.02", "type": "article"}, "twitter": {"description": "Myron Gananian, M.D., of Menlo Park, California, emails me in response to my Wall Street Journal opinion article \u201cHow Obamacare misreads America.\u201d Dr. Gananian quotes from Anthony Trollope's The Duke's Children, the sixth and last in his series of political novels, the advice given in a letter by the former Liberal party Prime Minister Plantagenet Palliser, the Duke of Omnium, to his son Lord Silverbridge, recently elected as a Conservative member of Parliament* from a constituency whose voters are accustomed to give the Duke deference.\n\nAnd I would have you always remember the purport for which there is a Parliament elected in this happy and free country. It is not that some men may shine there, that some may acquire power, or that all may plume themselves on being the elect of the nation. It often appears to me that some members of Parliament so regard their success in life \u2014 as the fellows of our colleges do too often, thinking that their fellowships were awarded for their comfort and not for the furtherance of any object as education or religion. I have known gentlemen who have felt that in becoming members of Parliament that they had achieved an object for themselves instead of thinking that they had put themselves in the way of achieving something for others. A member of Parliament should feel himself to be the servant of his country \u2014 and like every other servant, he should serve. If this be distasteful to a man he need not go into Parliament. If the harness gall him he need not wear it. But if he takes the trappings he should draw the coach. You are there as the guardian of your fellow-countrymen \u2014 that they may be safe, that they may be prosperous, that they may be well governed and lightly burdened--above all that they may be free. If you cannot feel this to be your duty, you should not be there at all.", "creator": "@michaelbarone", "image": "http://cdn.washingtonexaminer.biz/cache/r960-593e34aa5970fe316ebefb4824ecabc0.jpg?v=2016.05.19.02", "title": "Anthony Trollope on governing lightly: a lesson for Obamacare architects", "site": "@dcexaminer", "widgets": {"csp": "on"}, "card": "summary"}, "msvalidate.01": "0F003B4674EABE0F24651B476B61A43C", "apple-itunes-app": "app-id=890150273", "fb": {"admins": 1285945407, "app_id": 190451957673826}, "bitly-verification": "88ee0b053562", "keywords": "Beltway Confidential,Michael Barone", "google-site-verification": "iTBgtjzAMj1dVqCjWtRgv_w48ChpH4iOr-APbOgw3Ak", "viewport": "width=device-width,user-scalable=0", "news_keywords": "Beltway Confidential,Michael Barone"}, "_id": "\"57477af36914bd0286fd1f32\"", "article_summary": "And I would have you always remember the purport for which there is a Parliament elected in this happy and free country.\nA member of Parliament should feel himself to be the servant of his country \u2014 and like every other servant, he should serve.\nIf you cannot feel this to be your duty, you should not be there at all.\nIf this be distasteful to a man he need not go into Parliament.\nYou are there as the guardian of your fellow-countrymen \u2014 that they may be safe, that they may be prosperous, that they may be well governed and lightly burdened--above all that they may be free."}