{"article_title": "CVS Caremark to provide transitional or \"bridge\" supply of medication", "article_keywords": ["bridge", "medication", "caremark", "help", "transitional", "supply", "provide", "cvs", "disruption", "patients", "coverage", "president", "insurance", "care"], "article_url": "http://www.upi.com/Health_News/2014/01/02/CVS-Caremark-will-work-with-those-who-lost-insurance/58971388646320/", "article_text": "WOONSOCKET, R.I., Jan. 2 (UPI) -- As Affordable Care Act coverage gets under way for millions of U.S. adults, CVS Caremark will work with patients to avoid medication disruption, officials say.\n\n\"CVS/pharmacy is committed to assisting our patients who may encounter disruptions in their prescription insurance coverage beginning Jan, 1,\" Helena B. Foulkes, president, CVS/pharmacy and executive vice president, CVS Caremark, said in a statement.\n\n\"Our pharmacy teams will provide information to help patients contact the appropriate health plan or insurance exchange, and we are actively communicating with insurance plans and government agencies to help minimize disruption to care whenever possible.\"\n\nFoulkes said CVS Caremark is ready to help patients who might experience coverage issues or have questions as they access care and prescription medications under new plans for the first time.\n\n\"Our pharmacy teams will provide information to help patients contact the appropriate health plan or insurance exchange, and we are actively communicating with insurance plans and government agencies to help minimize disruption to care whenever possible,\" Foulkes said.\n\nIn some circumstances and based on clinical considerations, CVS/pharmacy will assist patients who are experiencing a temporary disruption in insurance coverage with a transitional or \"bridge\" supply of medication to support their continuity of care. A bridge supply is a prescription of 15 or 30 days.\n\nFor patients who express financial hardship, a bridge supply may be provided as a courtesy to help them remain adherent to their medication therapy while they resolve their coverage issues.\n\n\"We want to play our part in the medical community to support our patients' healthcare needs during this time because some plan details are still being determined,\" said Dr. Andrew Sussman, president of MinuteClinic and senior vice president/associate chief medical officer, CVS Caremark.", "article_metadata": {"description": "As Affordable Care Act coverage gets under way for millions of U.S. adults, CVS Caremark will work with patients to avoid medication disruption, officials say.", "og": {"site_name": "UPI", "description": "As Affordable Care Act coverage gets under way for millions of U.S. adults, CVS Caremark will work with patients to avoid medication disruption, officials say.", "title": "CVS Caremark will work with those who lost insurance", "url": "http://www.upi.com/Health_News/2014/01/02/CVS-Caremark-will-work-with-those-who-lost-insurance/58971388646320/", "image": "http://cdnph.upi.com/sv/ph/og/upi/58971388646320/2014/1/520d6126d453a586c462b820b3cd3f35/v2.1/CVS-Caremark-will-work-with-those-who-lost-insurance.jpg", "type": "article"}, "fb": {"app_id": 130795020312660}, "keywords": "Health", "google-site-verification": "vnkcuJA1Q89cLmy4OZpuQKOf5Jf6ny_RVh7BpxZ11a0", "viewport": "initial-scale=1, maximum-scale=1", "news_keywords": "Health"}, "_id": "\"57477af46914bd0286fe0fad\"", "article_summary": "WOONSOCKET, R.I., Jan. 2 (UPI) -- As Affordable Care Act coverage gets under way for millions of U.S. adults, CVS Caremark will work with patients to avoid medication disruption, officials say.\n\"CVS/pharmacy is committed to assisting our patients who may encounter disruptions in their prescription insurance coverage beginning Jan, 1,\" Helena B. Foulkes, president, CVS/pharmacy and executive vice president, CVS Caremark, said in a statement.\nIn some circumstances and based on clinical considerations, CVS/pharmacy will assist patients who are experiencing a temporary disruption in insurance coverage with a transitional or \"bridge\" supply of medication to support their continuity of care.\nFoulkes said CVS Caremark is ready to help patients who might experience coverage issues or have questions as they access care and prescription medications under new plans for the first time.\nFor patients who express financial hardship, a bridge supply may be provided as a courtesy to help them remain adherent to their medication therapy while they resolve their coverage issues."}