{"article_title": "Jos\u00e9 Bustos, Mural Artist from Chile to Speak at Monmouth U", "article_keywords": ["jos", "bustos", "artist", "students", "university", "monmouth", "mural", "chile", "lecture", "open", "hall", "speak"], "article_url": "http://www.ahherald.com/newsbrief/arts-news/18926-jos%C3%A9-bustos,-mural-artist-from-chile-to-speak-at-monmouth-u", "article_text": "Jos\u00e9 Bustos, Mural Artist from Chile to Speak at Monmouth U\n\nJos\u00e9 Bustos, mural artist from Chile and founder of the Open Air Museum, to Speak at Monmouth University on December 9\n\nBustos and students will paint a mural on campus, December 1 to 2.\n\nWhat: Jos\u00e9 Bustos, mural artist from Santiago, Chile, and founder of the Open Air Museum, will speak at Monmouth University on December 9. In addition, Bustos and students will paint a mural on campus, December 1 and 2.\n\nTopic: Murals for human rights and memory\n\nWhen: Lecture will be held on December 9 at 5 p.m. (Mural painting will be held in McAllen Hall, 3nd floor, December 1 and 2, from 11 a.m. to 4 p.m.)\u200b\n\nWhere: Monmouth University's Wilson Hall, 400 Cedar Avenue, West Long Branch, N.J.\n\nCost: Lecture is free and open to the public.\n\nJos\u00e9 Bustos, mural artist from Santiago, Chile, will visit Monmouth University, December 1 to 9. During his visit, Bustos will be a guest lecturer in art and social work classes and paint a mural with students to commemorate the 40th anniversary of Monmouth University\u2019s social work program. The mural painting will be held in McAllen Hall on December 1 and 2, from 11 a.m. to 4 p.m. On December 9 at 5 p.m. in Wilson Hall, Bustos will give a lecture titled, \u201cMurals for human rights and memory.\u201d The lecture is free and open to the public.", "article_metadata": {"description": "Jos\u00e9 Bustos, Mural Artist from Chile to Speak at Monmouth U", "generator": "Joomla! - Open Source Content Management", "rights": "All Rights Reserved", "og": {"site_name": "Atlantic Highlands Herald", "description": "Jos\u00e9 Bustos, Mural Artist from Chile to Speak at Monmouth U", "title": "Jos\u00e9 Bustos, Mural Artist from Chile to Speak at Monmouth U", "url": "http://www.ahherald.com/newsbrief/arts-news/18926-jos%C3%A9-bustos,-mural-artist-from-chile-to-speak-at-monmouth-u", "image": "http://www.ahherald.com/images/assets/ahh_logo.jpg", "type": "article"}, "author": "Monmouth University", "keywords": "Jos\u00e9 Bustos, Mural Artist", "article": {"published_time": "2014-11-29 13:55:32", "author": "Allan Dean"}, "viewport": "width=device-width, initial-scale=1.0"}, "article_summary": "Jos\u00e9 Bustos, Mural Artist from Chile to Speak at Monmouth UJos\u00e9 Bustos, mural artist from Chile and founder of the Open Air Museum, to Speak at Monmouth University on December 9Bustos and students will paint a mural on campus, December 1 to 2.\nWhat: Jos\u00e9 Bustos, mural artist from Santiago, Chile, and founder of the Open Air Museum, will speak at Monmouth University on December 9.\nJos\u00e9 Bustos, mural artist from Santiago, Chile, will visit Monmouth University, December 1 to 9.\nIn addition, Bustos and students will paint a mural on campus, December 1 and 2.\nDuring his visit, Bustos will be a guest lecturer in art and social work classes and paint a mural with students to commemorate the 40th anniversary of Monmouth University\u2019s social work program."}