{"article_title": "Pol deletes 'Snowbamacare' tweet", "article_keywords": ["13", "staff", "snow", "virginia", "markwarner", "tweets", "pol", "account", "fail", "snowbamacare", "deleting", "day", "deletes"], "article_url": "http://www.politico.com/story/2014/02/mark-warner-deleted-tweet-103496", "article_text": "After deleting the tweet, the Virginia Democrat\u2019s account tweets a mea culpa. Pol deletes 'Snowbamacare' tweet\n\nCall it a snow-pas.\n\nSen. Mark Warner\u2019s office blamed a staff snow day \u201c#fail\u201d for a deleted tweet Thursday morning that made a joke about the Virginia GOP and the winter storm that shut down Washington.\n\nStory Continued Below\n\n\u201cJust a matter of time: waiting for the @VA_GOP to claim this winter storm was caused by The Affordable Care Act. #Snowbamacare,\u201d the account tweeted, deleting it 26 seconds later, according to an archive of deleted tweets kept by the Sunlight Foundation.\n\nThough the tweet existed less than half a minute, it was enough time for Republicans to pounce.\n\nIs our \u201cradical centrist\u201d Senator @MarkWarner tweeting partisan political attacks from his official account? https://t.co/7ZLgGEFbpY #vasen \u2014 Michael C. Short (@michaelcshort) February 13, 2014\n\nAfter deleting the tweet, the Virginia Democrat\u2019s account tweeted a mea culpa, calling it a staff \u201c#fail\u201d on a snowy day.\n\nOops. Staff #fail on a snow day. Removed as quickly as possible. Enjoy the rest of your snow day.\u2014 Mark Warner (@MarkWarner) February 13, 2014\n\nWarner\u2019s Senate account bio says tweets come from both the senator and staff.\n\nWarner\u2019s communications director took responsibility for the errant tweet.\n\n\u201cIt was my mistake. I acknowledged it as quickly as possible, and I apologize,\u201d Kevin Hall said in an email to POLITICO.\n\nUp for reelection in 2014, Warner recently picked up a challenge for his seat from former RNC Chairman Ed Gillespie, with Republicans looking to put pressure on what before Gillespie\u2019s entry looked like an easy seat for the Democrat to retain.\n\nThe National Republican Senatorial Committee sought to capitalize on the mistake Thursday afternoon.\n\nHey Sen. @MarkWarner, less tweeting offensive jokes & a little more shoveling would be appreciated by your neighbors pic.twitter.com/Iq6LOkdy4r \u2014 NRSC (@NRSC) February 13, 2014\n\nNRSC spokesman Brad Dayspring confirmed the tweet was a picture of Warner\u2019s home sidewalk.\n\nAuthors:", "article_metadata": {"og": {"site_name": "POLITICO", "description": "Though the tweet existed less than half a minute, it was enough time for Republicans to pounce.", "title": "Pol deletes 'Snowbamacare' tweet", "url": "http://www.politico.com/story/2014/02/mark-warner-deleted-tweet-103496.html", "image": "http://s3-origin-images.politico.com/news/111031_mark_warner_605_ap.jpg", "fb_appid": 114037015331397, "type": "article"}, "keywords": "Obamacare,Mark Warner,Snowstorms", "twitter": {"site": "@politico", "card": "summary_large_image", "creator": "@politico"}, "description": "Though the tweet existed less than half a minute, it was enough time for Republicans to pounce.", "viewport": "width=device-width, initial-scale=1"}, "article_summary": "Pol deletes 'Snowbamacare' tweetCall it a snow-pas.\n#Snowbamacare,\u201d the account tweeted, deleting it 26 seconds later, according to an archive of deleted tweets kept by the Sunlight Foundation.\nStaff #fail on a snow day.\nAfter deleting the tweet, the Virginia Democrat\u2019s account tweets a mea culpa.\nSen. Mark Warner\u2019s office blamed a staff snow day \u201c#fail\u201d for a deleted tweet Thursday morning that made a joke about the Virginia GOP and the winter storm that shut down Washington."}