{"article_title": "7 quotable quotes from State Auditor candidate Jim Zeigler: Today's Alabama political update", "article_keywords": ["website", "quotable", "todays", "candidate", "song", "jim", "political", "update", "page", "county", "quotes", "state", "auditor", "zeigler", "lord", "breakfast", "alabama"], "article_url": "http://www.al.com/news/index.ssf/2014/09/7_quotable_quotes_from_state_a.html", "article_text": "Jim Zeigler has been a colorful fixture around Alabama's political scene for decades. Nowhere is that more obvious than on his website, www.zeiglerstory.com, and his Facebook page.\n\nThe Republican nominee for state auditor's website appears to be a copy of a Wikipedia page but a little exploration reveals the user-contributed encyclopedia site deleted Zeigler's actual bio page in May, saying \"it seems to be nothing more than a promotional page.\"\n\nOn Facebook, Zeigler - a former Public Service Commissioner who made unsuccessful attempts for the state supreme court, state treasurer, civil appeals court, and state auditor - covers such topics as football, terrorism, breakfast and prayer. Here are a few of his more quotable quotes:\n\n\"It's the 40th anniversary of the state song \"Sweet Home Alabama.\" I will use this at my inauguration if you elect me State Auditor...\"In Birmingham they love the Auditor.\"\n\n\"I woke in the night and had composed a song in my dreams. I am not 100 percent sure it is original. Is this an original work of art, or have I just forgotten hearing it?\n\nI fought the Lord and the --- Lord won.\n\nI fought the Lord and the -- Lord won.\n\nCopyright 2014 by Jim \"Zig\" Zeigler.\n\nWho should I dedicate this song to? The Islamic Terrorists? Who?\"\n\n\"Game of the year. Bama v. Texas A&M Oct. 18 in Tuscaloosa. #1 Alabama v. #2 Texas A&M. Mark it down now.\"\n\n\"How about this Saturday breakfast from all leftovers at the Zeigler estate? Gulf Shrimp brown-egg omelet with Belle Chevre goat cheese from Elkmont, Alabama. Rib-eye steak from Moseley's. Hashbrowns of Baldwin County sweet potatoes. Red Diamond Coffee. If I am going to be a fat-cat Republican, I want to eat like one.\"\n\n\"ISIS terrorists waited until Bama game kicked off and then beheaded another. British this time.\"\n\n\"Old fashion Southern breakfast. They don't call this Coffee County for nothing.\"\n\n(On the Monte Sano Arts Festival) \"I got to play a guitar made from pinewood and a cigar box. I played \"Just a Bowl of Butterbeans.\" I have had several requests about playing, but I played anyway.\"\n\nIt's another Monday and it's sure to be a busy week in Alabama politics. Let's catch up on the weekend's news:\n\nWhich Alabama ZIP codes had the most Obamacare sign-ups? Search our database\n\nAlbert Brewer knew he couldn't beat George Wallace on race issue: Days that changed Alabama politics\n\nState senator slams Gov. Bentley for 'uncalled for' comments in wake of Hiawayi Robinson's death\n\nAttorney General Luther Strange places deputy AG on leave; move related to Lee County investigation\n\nJoe Hubbard on attorney general's internal office feuding: 'Luther Strange has lost control'\n\nRetiring Congressman Spencer Bachus says unveiling of committee chair portrait is 'truly humbling' honor\n\nRepublican State Auditor nominee Jim Zeigler playing at the Monte Sano Arts Festival in Huntsville. He said he used the pinewood and cigar box guitar to pick \u201cJust a Bowl of Butterbeans.\u201d\n\nTop 7 quotable quotes from State Auditor candidate Jim Zeigler: Today\u2019s Alabama political update\n\nhttp://en.wikipedia.org/wiki/Wikipedia:Articles_for_deletion/Jim_Zeigler\n\nJim Zeigler has been a colorful fixture around Alabama\u2019s political scene for decades. Nowhere is that more obvious than on website, www.zeiglerstory.com, and his Facebook page. The Republican nominee for state auditor\u2019s website appears to be a copy of a Wikipedia page but a little exploration reveals the user-contributed encyclopedia site deleted Zeigler\u2019s bio page in May, saying \u201cit seems to be nothing more than a promotional page.\u201d\n\nOn Facebook, Zeigler, a former Public Service Commissioner who made unsuccessful attempts for the state supreme court, state treasurer, civil appeals court, and state auditor, covers such topics as football, terrorism, breakfast and prayer. Here are a few of his more quotable quotes:\n\n\u201cIt's the 40th anniversary of the state song \"Sweet Home Alabama.\" I will use this at my inauguration if you elect me State Auditor\u2026\"In Birmingham they love the Auditor.\u201d\n\n\u201cI woke in the night and had composed a song in my dreams. I am not 100% sure it is original. Is this an original work of art, or have I just forgotten hearing it?\n\nI fought the Lord and the --- Lord won.\n\nI fought the Lord and the -- Lord won.\n\nCopyright 2014 by Jim \"Zig\" Zeigler.\n\nWho should I dedicate this song to? The Islamic Terrorists? Who?\u201d\n\n\u201cGame of the year. Bama v. Texas A&M Oct. 18 in Tuscaloosa. #1 Alabama v. #2 Texas A&M. Mark it down now.\u201d\n\n\u201cHow about this Saturday breakfast from all leftovers at the Zeigler estate? Gulf Shrimp brown-egg omelet with Belle Chevre goat cheese from Elkmont, Alabama. Rib-eye steak from Moseley's. Hashbrowns of Baldwin County sweet potatoes. Red Diamond Coffee. If I am going to be a fat-cat Republican, I want to eat like one.\u201d\n\n\u201cISIS terrorists waited until Bama game kicked off and then beheaded another. British this time.\u201d\n\n\u201cOld fashion Southern breakfast. They don't call this Coffee County for nothing.\u201d\n\n(On the Monte Sano Arts Festival) \u201cI got to play a guitar made from pinewood and a cigar box. I played \"Just a Bowl of Butterbeans.\" I have had several requests about playing, but I played anyway.\u201d\n\nIt\u2019s another Monday and it\u2019s sure to be a busy week in Alabama politics. Let\u2019s catch up on the weekend\u2019s news:\n\nWhich Alabama ZIP codes had the most Obamacare sign-ups? Search our database\n\nhttp://www.al.com/news/index.ssf/2014/09/which_alabama_zip_codes_had_th.html#incart_river\n\nAlbert Brewer knew he couldn't beat George Wallace on race issue: Days that changed Alabama politics\n\nwww.al.com/news/index.ssf/2014/09/albert_brewer_knew_he_couldnt.html#incart_river\n\nState senator slams Gov. Bentley for 'uncalled for' comments in wake of Hiawayi Robinson's death\n\nhttp://www.al.com/news/mobile/index.ssf/2014/09/state_senator_slams_gov_bentle.html#incart_river\n\nAttorney General Luther Strange places deputy AG on leave; move related to Lee County investigation\n\nhttp://www.al.com/news/index.ssf/2014/09/attorney_general_luther_strang_2.html#incart_river\n\nJoe Hubbard on attorney general's internal office feuding: 'Luther Strange has lost control'\n\nhttp://www.al.com/news/index.ssf/2014/09/joe_hubbard_on_attorney_genera.html#incart_river\n\nRetiring Congressman Spencer Bachus says unveiling of committee chair portrait is \u2018truly humbling\u2019 honor\n\nhttp://www.al.com/news/index.ssf/2014/09/retiring_congressman_spencer_b.html#incart_river", "article_metadata": {"medium": "news", "viewport": "width=device-width,initial-scale=1", "news_keywords": "news", "title": "7 quotable quotes from State Auditor candidate Jim Zeigler: Today's Alabama political update", "og": {"site_name": "AL.com", "description": "Jim Zeigler has been a colorful fixture around Alabama's political scene for decades", "title": "7 quotable quotes from State Auditor candidate Jim Zeigler: Today's Alabama political update", "url": "http://www.al.com/news/index.ssf/2014/09/7_quotable_quotes_from_state_a.html", "image": "http://image.al.com/home/bama-media/width620/img/news_impact/photo/jim-zeiglerjpg-850e0ed61dd2f30d.jpg", "type": "article"}, "twitter": {"description": "Jim Zeigler has been a colorful fixture around Alabama's political scene for decades", "creator": "@LeadaGore", "image": "http://image.al.com/home/bama-media/width620/img/news_impact/photo/jim-zeiglerjpg-850e0ed61dd2f30d.jpg", "title": "7 quotable quotes from State Auditor candidate Jim Zeigler: Today's Alabama political update", "site": "@aldotcom", "card": "summary"}, "article_date_updated": "Monday, September 22, 2014,  7:13 AM", "fb": {"admins": 100000302287435}, "article_publication_name": "AL.com", "article": {"author": "https://www.facebook.com/leada.gore"}, "article_comments": 0, "article_date_original": "Monday, September 22, 2014,  7:13 AM", "article_author": "Leada Gore | lgore@al.com", "Description": "Jim Zeigler has been a colorful fixture around Alabama's political scene for decades"}, "_id": "\"57477af46914bd0286fe1af0\"", "article_summary": "Here are a few of his more quotable quotes:\"It's the 40th anniversary of the state song \"Sweet Home Alabama.\"\nJim Zeigler has been a colorful fixture around Alabama's political scene for decades.\nHe said he used the pinewood and cigar box guitar to pick \u201cJust a Bowl of Butterbeans.\u201dTop 7 quotable quotes from State Auditor candidate Jim Zeigler: Today\u2019s Alabama political updatehttp://en.wikipedia.org/wiki/Wikipedia:Articles_for_deletion/Jim_ZeiglerJim Zeigler has been a colorful fixture around Alabama\u2019s political scene for decades.\nHere are a few of his more quotable quotes:\u201cIt's the 40th anniversary of the state song \"Sweet Home Alabama.\"\nI will use this at my inauguration if you elect me State Auditor...\"In Birmingham they love the Auditor.\""}