{"article_title": "Drew Bledsoe Is Scoring Touchdowns (In The Vineyards)", "article_keywords": ["scoring", "walla", "bledsoe", "touchdowns", "state", "drew", "vineyard", "vineyards", "doubleback", "know", "winery", "famed", "wine"], "article_url": "http://onpoint.wbur.org/2014/08/28/drew-bledsoe-wine", "article_text": "Drew Bledsoe Is Scoring Touchdowns (In The Vineyards)\n\nOur Boston-area listeners might know Drew Bledsoe as a onetime quarterback for the New England Patriots. (Among many other NFL teams, of course). But the famed football great has lately turned his attention to his home state of Washington for a different kind of game: the vineyard battle.\n\nBledsoe is owner of the Doubleback Winery in Walla, Walla, WA, and he joined us during our August 28 show on the state of the American wine industry. His vineyard is successful \u2014 they\u2019ve received favorable notices in many major wine publications \u2014 and Bledsoe told host Tom Ashbrook it all has something to do with the climate and soil of the Walla Walla region, which is usually known for their famed sweet onions.\n\nHave you ever tried a bottle of Bledsoe\u2019s Doubleback Winery vintage? Was it good? Where do you turn for excellent American wines these days?\n\nLet us know in the comments below, or on Facebook, Tumblr and @OnPointRadio.", "article_metadata": {"description": "Football great -- and vineyard owner -- Drew Bledsoe talks wine, onions and the weird way they intersect sometimes in Walla Walla, Washington.", "og": {"site_name": "onpoint", "description": "Football great -- and vineyard owner -- Drew Bledsoe talks wine, onions and the weird way they intersect sometimes in Walla Walla, Washington.", "title": "Drew Bledsoe Is Scoring Touchdowns (In The Vineyards)", "url": "http://onpoint.wbur.org/2014/08/28/drew-bledsoe-wine", "image": "http://s3.amazonaws.com/media.wbur.org/wordpress/12/files/2014/08/bledsoe-500x333.jpg", "type": "article"}, "twitter": {"url": "http://onpoint.wbur.org/2014/08/28/drew-bledsoe-wine", "image": "//s3.amazonaws.com/media.wbur.org/wordpress/12/files/2014/08/bledsoe-500x333.jpg", "site": "@OnPointRadio", "card": "summary", "title": "Drew Bledsoe Is Scoring Touchdowns (In The Vineyards)"}, "DC.date.issued": "2014-08-28", "fb": {"admins": 1549080028, "app_id": 134067973330252}, "msvalidate.01": "D02D46BAEDB3F81FC1B1DE2A8CB69551"}, "article_summary": "Drew Bledsoe Is Scoring Touchdowns (In The Vineyards)Our Boston-area listeners might know Drew Bledsoe as a onetime quarterback for the New England Patriots.\nHave you ever tried a bottle of Bledsoe\u2019s Doubleback Winery vintage?\nBledsoe is owner of the Doubleback Winery in Walla, Walla, WA, and he joined us during our August 28 show on the state of the American wine industry.\nBut the famed football great has lately turned his attention to his home state of Washington for a different kind of game: the vineyard battle.\nLet us know in the comments below, or on Facebook, Tumblr and @OnPointRadio."}