{"article_title": "MTS Picks Up Fellow Sensor Maker PCB Group to Grow Product Line", "article_keywords": ["product", "group", "sensors", "mts", "universal", "technologies", "picks", "nasdaq", "grow", "pcb", "sensata", "line", "fellow", "sensor", "maker", "nyse"], "article_url": "http://www.themiddlemarket.com/news/tech_telecom/mts-picks-up-fellow-sensor-maker-pcb-group-to-grow-product-line-260285-1.html", "article_text": "MTS Picks Up Fellow Sensor Maker PCB Group to Grow Product Line\n\nIn 2015, Sensata purchased Custom Sensors and Universal Electronics agreed to buy Ecolink\n\nMTS Systems Corp. (Nasdaq: MTSC) has agreed to purchase PCB Group Inc. for $580 million, as both companies look to expand their product and customer reach. MTS will fund the acquisition with equity and debt.\n\nPCB, based in Depew , New York, and founded in 1967, makes sensors that are used to measure force, pressure and vibration for the automotive, aerospace and energy industries. PCB will combine with MTS\u2019 sensor division that will be led by PCB president David Hore. The combined company will have 2016 pro-forma revenue of about $785 million.\n\n\u201cThe combination significantly strengthens and broadens our sensor product offerings and is highly synergistic with both our test and sensor business units, making it a unique fit with MTS,\u201d says MTS CEO Jeffrey Graves. MTS, headquarted in Eden Prairie, Minnesota, produces sensor and testing equipment for the material handling, biotechnology, manufacturing and industrials sectors.\n\nIn other sensor deals, Sensata Technologies Holding NV (NYSE: ST) acquired Custom Sensors & Technologies in 2015 and Universal Electronics Inc. (Nasdaq: UEIC) said it will buy Ecolink Intelligent Technology Inc.\n\nJ.P. Morgan Securities LLC (NYSE: JPM) and Simpson Thacher & Bartlett LLP are advising MTS. Blackarch Partners is advising PCB.\n\nFor more information on related topics, visit the following:", "article_metadata": {"status": "open", "domain": "Mergers & Acquisitions", "sailthru.author": "Demitri Diakantonis", "sailthru.expire_date": "2016-05-06 12:02:00", "og": {"url": "http://www.themiddlemarket.com/news/tech_telecom/mts-picks-up-fellow-sensor-maker-pcb-group-to-grow-product-line-260285-1.html", "image": "http://cdn.themiddlemarket.com/media/newspics/autosensor.jpeg", "site_name": "Mergers & Acquisitions, Latest News", "title": "MTS Picks Up Fellow Sensor Maker PCB Group to Grow Product Line"}, "type": "Article", "brand": "Mergers & Acquisitions, Latest News", "sailthru.date": "2016-04-06 12:02:00", "wordcount": 190, "sailthru.title": "MTS Picks Up Fellow Sensor Maker PCB Group to Grow Product Line", "featured": 0, "sailthru.tags": "News, Strategic Buyers, Tech, Media & Telecom, Tech, Media & Telecom, MTS Picks Up Fellow Sensor Maker PCB Group to Grow Product Line, Sensata, Custom Sensors, Universal Electronics, Ecolink, M&A, technology, sensors, electronics, JP Morgan, Simpson Thacher, Blackarch Partners, automotive, aerospace, manufacturing, Article", "sailthru.description": "In 2015, Sensata purchased Custom Sensors and Universal Electronics agreed to buy Ecolink", "sailthru.image.full": "http://cdn.themiddlemarket.com/media/newspics/autosensor.jpeg"}, "article_summary": "PCB will combine with MTS\u2019 sensor division that will be led by PCB president David Hore.\n\u201cThe combination significantly strengthens and broadens our sensor product offerings and is highly synergistic with both our test and sensor business units, making it a unique fit with MTS,\u201d says MTS CEO Jeffrey Graves.\nMTS Picks Up Fellow Sensor Maker PCB Group to Grow Product LineIn 2015, Sensata purchased Custom Sensors and Universal Electronics agreed to buy EcolinkMTS Systems Corp. (Nasdaq: MTSC) has agreed to purchase PCB Group Inc. for $580 million, as both companies look to expand their product and customer reach.\nMTS, headquarted in Eden Prairie, Minnesota, produces sensor and testing equipment for the material handling, biotechnology, manufacturing and industrials sectors.\nPCB, based in Depew , New York, and founded in 1967, makes sensors that are used to measure force, pressure and vibration for the automotive, aerospace and energy industries."}