{"article_title": "Baker to help launch informational campaign on charter schools", "article_keywords": ["charter", "help", "campaign", "launch", "students", "baker", "school", "massachusetts", "schools", "informational", "public", "fact"], "article_url": "http://newbostonpost.com/2016/02/12/baker-to-help-launch-informational-campaign-on-charter-schools/", "article_text": "Baker to help launch informational campaign on charter schools\n\nPrinted from: http://newbostonpost.com/2016/02/12/baker-to-help-launch-informational-campaign-on-charter-schools/\n\n(Screenshot via SHNS)\n\nDays after his critics alleged that he\u2019s overly focused on charter schools, Gov. Charlie Baker on Friday plans to join others who favor more charters to launch a \u201cfact check\u201d campaign.\n\nCharter proponents and opponents in Massachusetts have engaged in a bitter debate for years, looking at the same education landscape and drawing vastly different opinions and facts to make their cases for an against additional charters, which operate independently from local school committee oversight.\n\nAccording to Great Schools Massachusetts, which is leading a ballot question push on the issue, Baker will help launch \u201cFact Check: Public Charter Schools in Massachusetts,\u201d a public information campaign that the organization says will \u201cdeliver the wealth of data about Massachusetts\u2019 public charter schools to policymakers as they craft legislation related to charter schools.\u201d\n\nBaker will be joined by representatives from the Massachusetts Charter Public School Association, the Boston Charter Alliance, Race to the Top Coalition, and the Mass High Tech Council. They will discuss www.charterfactsma.org.\n\n\u201cThis effort is about setting the record straight about public charter schools in Massachusetts,\u201d Beth Anderson, president of the Massachusetts Charter Public School Association, said in a statement. \u201cCharter schools serve high-need kids incredibly well, close the achievement gap for low-income students of color, and have lower student attrition rates than district schools.\u201d\n\nThe event is set for 2 p.m. in Nurses Hall, which is located just above the third floor Senate offices that are home to some of the Legislature\u2019s chief critics of charter schools.\n\nAt a meeting on Tuesday, King Phillip Regional School Committee member Patrick Francomano told the governor: \u201cThe administration\u2019s public focus is overwhelmingly on charter schools, and while our excellent vocational schools have also received your attention, the majority of public school students are not significantly helped by this budget.\u201d\n\n\u2014 Written by Michael Norton\n\nCopyright State House News Service\n\nPlease enable JavaScript to view the comments powered by Disqus.", "article_metadata": {"shareaholic": {"site_name": "NewBostonPost", "language": "en-US", "url": "http://newbostonpost.com/2016/02/12/baker-to-help-launch-informational-campaign-on-charter-schools/", "article_author_name": "State House News Service", "image": "http://newbostonpost.com/wp-content/uploads/2016/02/Baker.jpg", "site_id": "ab905d8abdbd23a369259b08e0927728", "shareable_page": "true", "keywords": "boston, Charlie Baker, charter schools, debate, education, fact check, information, learning, Massachusetts"}, "description": "Days after his critics alleged that he's overly focused on charter schools, Gov. Charlie Baker on Friday plans to join others who favor more charters to launch", "generator": "WordPress 4.5.2", "og": {"image": "http://newbostonpost.com/wp-content/uploads/2016/02/Baker.jpg"}, "keywords": "charlie baker,boston,massachusetts,charter schools,debate,information,education,learning,fact check", "viewport": "width=device-width, initial-scale=1.0"}, "article_summary": "Baker to help launch informational campaign on charter schoolsPrinted from: http://newbostonpost.com/2016/02/12/baker-to-help-launch-informational-campaign-on-charter-schools/(Screenshot via SHNS)Days after his critics alleged that he\u2019s overly focused on charter schools, Gov.\n\u201cThis effort is about setting the record straight about public charter schools in Massachusetts,\u201d Beth Anderson, president of the Massachusetts Charter Public School Association, said in a statement.\nCharlie Baker on Friday plans to join others who favor more charters to launch a \u201cfact check\u201d campaign.\nAccording to Great Schools Massachusetts, which is leading a ballot question push on the issue, Baker will help launch \u201cFact Check: Public Charter Schools in Massachusetts,\u201d a public information campaign that the organization says will \u201cdeliver the wealth of data about Massachusetts\u2019 public charter schools to policymakers as they craft legislation related to charter schools.\u201dBaker will be joined by representatives from the Massachusetts Charter Public School Association, the Boston Charter Alliance, Race to the Top Coalition, and the Mass High Tech Council.\n\u201cCharter schools serve high-need kids incredibly well, close the achievement gap for low-income students of color, and have lower student attrition rates than district schools.\u201dThe event is set for 2 p.m. in Nurses Hall, which is located just above the third floor Senate offices that are home to some of the Legislature\u2019s chief critics of charter schools."}