{"article_title": "Obamatrade: 100 pounds, 5,554-pages, 2 million words -- and NO Amendments", "article_keywords": ["rights", "amendments", "material", "copyrighted", "copyright", "pounds", "million", "site", "purposes", "obamatrade", "words", "worthy", "owner", "100", "5554pages"], "article_url": "http://www.worthynews.com/22124-obamatrade-100-pounds-5554-pages-2-million-words-and-no-amendments", "article_text": "Worthy Christian News \u00bb US News \u00bb Obamatrade: 100 pounds, 5,554-pages, 2 million words -- and NO Amendments\n\nWorthy News / US News Monday, November 9, 2015 |\n\n(Worthy News) - The administration's Trans-Pacific Partnership treaty legislation is 5,554 pages long, twice that of Obamacare and nearly 3 feet high, a legislative nightmare highlighted in a tweet from Sen. Jeff Sessions Monday.\n\nThe Alabama Republican used his photo to alert critics that because the bill is fast-tracked, it cannot be filibustered or amended. Not only is the legislation filled with 2 million words, it measures exactly 2 feet high and weighs an amazing 100 pounds. The TPP is a trade agreement among 12 Pacific Rim countries. [ Source ]\n\nNo related posts.\n\nCopyright 1999-2016 Worthy News. All rights reserved.\n\nFair Use Notice:This site contains copyrighted material the use of which has not always been specifically authorized by the copyright owner. We are making such material available in our efforts to advance understanding of environmental, political, human rights, economic, democracy, scientific, and social justice issues, etc. We believe this constitutes a 'fair use' of any such copyrighted material as provided for in section 107 of the US Copyright Law. In accordance with Title 17 U.S.C. Section 107, the material on this site is distributed without profit to those who have expressed a prior interest in receiving the included information for research and educational purposes. For more information go to: http://www.law.cornell.edu/uscode/17/107.shtml. If you wish to use copyrighted material from this site for purposes of your own that go beyond 'fair use', you must obtain permission from the copyright owner.", "article_metadata": {"description": "The administration's Trans-Pacific Partnership treaty legislation is 5,554 pages long, twice that of Obamacare and nearly 3 feet high, a legislative nightmare highlighted in a tweet from Sen. Jeff Sessions Monday.", "generator": "WordPress 4.5.2", "og": {"site_name": "Worthy News", "description": "The administration's Trans-Pacific Partnership treaty legislation is 5,554 pages long, twice that of Obamacare and nearly 3 feet high, a legislative nightmare highlighted in a tweet from Sen. Jeff Sessions Monday.", "title": "Obamatrade: 100 pounds, 5,554-pages, 2 million words -- and NO Amendments", "locale": "en_US", "image": {"width": 1206, "identifier": "http://www.worthynews.com/wordpressimages/trans-pacific-partnership.jpg", "height": 605}, "url": "http://www.worthynews.com/22124-obamatrade-100-pounds-5554-pages-2-million-words-and-no-amendments", "type": "article"}, "robots": "noodp", "article": {"section": "US News", "published_time": "2015-11-09T20:33:59+00:00"}, "viewport": "width=device-width, initial-scale=1"}, "article_summary": "Not only is the legislation filled with 2 million words, it measures exactly 2 feet high and weighs an amazing 100 pounds.\nFair Use Notice:This site contains copyrighted material the use of which has not always been specifically authorized by the copyright owner.\nWe believe this constitutes a 'fair use' of any such copyrighted material as provided for in section 107 of the US Copyright Law.\nIf you wish to use copyrighted material from this site for purposes of your own that go beyond 'fair use', you must obtain permission from the copyright owner.\nThe Alabama Republican used his photo to alert critics that because the bill is fast-tracked, it cannot be filibustered or amended."}