{"article_title": "Telemedicine Services Through A Third Party Administrator", "article_keywords": ["administrator", "employees", "telemedicine", "access", "benefit", "treatment", "members", "services", "party", "cypress", "medical", "care"], "article_url": "http://www.healthitoutcomes.com/doc/telemedicine-services-through-a-third-party-administrator-0001", "article_text": "Telemedicine Services Through A Third Party Administrator\n\nBy Karla Paris\n\nRound-the-clock access to board-certified physicians is now a reality for third party administrator participants.\n\nAs an employee benefit option available to its employer-clients, Cypress Benefit Administrators has worked toward cost containment in self-funded health benefits. With the new offering of telehealth and telemedicine services that provide 24/7 access to a doctor, the Midwest-based third party administrator (TPA) is furthering its endeavor to cut unnecessary costs.\n\nCypress is now partnered with Teladoc to provide an innovative solution that allows employees to get round-the-clock medical advice, diagnosis information, treatment plans, and certain prescriptions, as needed.\n\nCypress is the country\u2019s first to bring claims administration, consumer driven health plans, and proven cost control measures together into one package for companies ranging from 50 employees to thousands of employees. It serves employer-clients across the U.S. with additional locations in Portland and Salem, OR, Omaha, NE, and Colorado Springs, CO.\n\nWith its growing popularity in the last few years, telemedicine service is proving to be an efficient and cost-effective way for Cypress members to seek non-emergency medical treatment instead of waiting for an appointment to open up or visiting an urgent care or ER facility.\n\nTeladoc offers members 24/7/365 access to telehealth consults via phone or online video \u2013 whenever they need it, from wherever they are. Its U.S. board-certified physicians can diagnose, recommend treatment, and write short-term, non DEA prescriptions, when appropriate.\n\nThrough the transition to this Teladoc partnership, Cypress members will benefit from several enhancements and conveniences of the telemedicine service, including:\n\nThe only physician network in the industry with NCQA Certification of Credentialing to ensure the highest level of care for members.\n\nPhone or face-to-face video consultations that can be scheduled in 15-minute increments, making it much easier to plan around work and personal schedules.\n\nA member mobile app available for both Apple and Android devices.\n\nTom Doney, president and CEO of Cypress, explains how \u201cpeople\u2019s needs for anytime medical care are expanding as their lives get busier, and so too are the conveniences offered through today\u2019s telemedicine model. The overwhelming theme of the feedback we receive is that this non-traditional approach to patient-doctor visits offers more convenience and flexibility than ever.\u201d", "article_metadata": {"twitter": {"description": "<p>Round-the-clock access to board-certified physicians is now a reality for third party administrator participants. <em>By Karla Paris, contributing writer</em></p>", "title": "Telemedicine Services Through A Third Party Administrator", "image": {"src": "http://vertassets.blob.core.windows.net/image/ed81b0fa/ed81b0fa-012c-48b3-b334-04d2075774d3/virtual_doc.jpg"}, "creator": "Karla Paris", "site": "HITOutcomes", "card": "summary_large_image"}, "description": "Round-the-clock access to board-certified physicians is now a reality for third party administrator participants. By Karla Paris, contributing writer\r...", "viewport": "width=device-width, initial-scale=1, maximum-scale=1, user-scalable=no", "Title": "Telemedicine Services Through A Third Party Administrator"}, "_id": "\"57477af46914bd0286fdd33e\"", "article_summary": "Telemedicine Services Through A Third Party AdministratorBy Karla ParisRound-the-clock access to board-certified physicians is now a reality for third party administrator participants.\nWith the new offering of telehealth and telemedicine services that provide 24/7 access to a doctor, the Midwest-based third party administrator (TPA) is furthering its endeavor to cut unnecessary costs.\nAs an employee benefit option available to its employer-clients, Cypress Benefit Administrators has worked toward cost containment in self-funded health benefits.\nTom Doney, president and CEO of Cypress, explains how \u201cpeople\u2019s needs for anytime medical care are expanding as their lives get busier, and so too are the conveniences offered through today\u2019s telemedicine model.\nTeladoc offers members 24/7/365 access to telehealth consults via phone or online video \u2013 whenever they need it, from wherever they are."}