{"article_title": "PartnerTech Inc. poised for growth in medtech", "article_keywords": ["medtech", "excise", "manufacturers", "partnertech", "industry", "tax", "growth", "poised", "repeal", "medical", "additional"], "article_url": "http://evertiq.com/news/35870", "article_text": "\u00a9 evertiq\n\nPartnerTech Inc. poised for growth in medtech\n\nAs the MedTech industry anticipates a repeal of the excise tax, PartnerTech Inc. ramps up capabilities for anticipated growth with additional certifications.\n\nAll signs point to growth in the MedTech industry with an uptick in employment and the likelihood of a repeal of the excise tax originally levied to fund the Affordable Care Act. The industry is anticipating annual growth of 9.3% and PartnerTech Inc. is prepared to answer the call for additional manufacturing resources with the recent addition of ISO 13485 certification.\n\n\n\nMedical device manufacturers in the U.S. are cautiously hopeful that the 2.3% excise tax on revenues will be repealed due to new GOP gains and bi-partisan support from Democrats. The tax, projected to bring in USD 29 billion over 10 years, was considered a financial pillar of the Affordable Care Act but has been blamed for stifling medical innovation as R&D budgets were cut in response to the tax. A repeal of the tax is favourable to both the U.S. and the global MedTech industry with regard to optimized distribution channels.\n\n\n\nGary Bruce, President and Managing Director of PartnerTech, NA stated \u201cPartnerTech has a long history of partnering with medical device manufacturers and we\u2019re looking forward to growing our business even further with this additional certification.\u201d", "article_metadata": {"description": "As the MedTech industry anticipates a repeal of the excise tax, PartnerTech Inc. ramps up capabilities for anticipated growth with additional certifications.", "og": {"url": "http://evertiq.com/news/35870", "image": "http://evertiq.com/Text_Images/Fun-General/evertiq_ok-stamp.jpg", "description": "As the MedTech industry anticipates a repeal of the excise tax, PartnerTech Inc. ramps up capabilities for anticipated growth with additional certifications.", "title": "PartnerTech Inc. poised for growth in medtech"}, "fb": {"admins": 533848821, "app_id": 198770426819812}, "verify-v1": "X9WBAIH4sVEadG1LVDsKyaRRJPCjHvQo709WcJXX1Do=", "viewport": "width=device-width", "DC.title": "PartnerTech Inc. poised for growth in medtech"}, "article_summary": "\u00a9 evertiqPartnerTech Inc. poised for growth in medtechAs the MedTech industry anticipates a repeal of the excise tax, PartnerTech Inc. ramps up capabilities for anticipated growth with additional certifications.\nAll signs point to growth in the MedTech industry with an uptick in employment and the likelihood of a repeal of the excise tax originally levied to fund the Affordable Care Act.\nA repeal of the tax is favourable to both the U.S. and the global MedTech industry with regard to optimized distribution channels.\nThe industry is anticipating annual growth of 9.3% and PartnerTech Inc. is prepared to answer the call for additional manufacturing resources with the recent addition of ISO 13485 certification.\nGary Bruce, President and Managing Director of PartnerTech, NA stated \u201cPartnerTech has a long history of partnering with medical device manufacturers and we\u2019re looking forward to growing our business even further with this additional certification.\u201d"}