{"article_title": "8th Annual Grills Gone Wild", "article_keywords": ["grown", "gone", "prize", "city", "personal", "money", "panama", "annual", "rotary", "wild", "grills", "beach", "event", "8th"], "article_url": "http://www.wjhg.com/home/headlines/8th-Annual-Grills-Gone-Wild-352974661.html", "article_text": "Gulf Coast State College was filled with BBQ smoke Saturday evening for the 8th annual Grills Gone Wild competition.\n\nDozens of amateur and competition grill masters fired up their grills and cooked up their best barbecue; from chicken to ribs and even a barbecue sundae.\n\nGeneral admission and VIP tickets were sold, and proceeds from Saturday's event will go to 35 local charities.\n\n\"It has grown tremendously, we use to be just a small organization, now we have grown it to where we are actually giving out prize money and grillers are coming in to compete for prize money from all over the southeast region, explained Don Cooley, a member of the Panama City Beach Rotary Club.\n\n\"There's so many people here who are personal friends and have personal stories that we have heard, so this is a cool way to help people like that and also hear more stories that haven't been shared,\" said Olivia Kholstaedt, a Marketing Manager with event sponsor Panama City Toyota.\n\nEvent organizers with the Panama City Beach Rotary club say the goal for the event was to raise $100,000.", "article_metadata": {"description": "Gulf Coast State College was filled with BBQ smoke Saturday evening for the 8th annual Grills Gone Wild competition.", "language": "english", "author": "WJHG", "og": {"url": "http://www.wjhg.com/home/headlines/8th-Annual-Grills-Gone-Wild-352974661.html", "image": "http://media.graytvinc.com/images/grills2.jpg", "type": "article", "description": "Gulf Coast State College was filled with BBQ smoke Saturday evening for the 8th annual Grills Gone Wild competition.", "title": "8th Annual Grills Gone Wild"}, "twitter": {"description": "Gulf Coast State College was filled with BBQ smoke Saturday evening for the 8th annual Grills Gone Wild competition.", "title": "8th Annual Grills Gone Wild", "url": "http://www.wjhg.com/home/headlines/8th-Annual-Grills-Gone-Wild-352974661.html", "image": "http://media.graytvinc.com/images/grills2.jpg", "creator": "@WJHG_TV", "site": "@WJHG_TV", "card": "summary_large_image"}, "keywords": "8th Annual Grills Gone Wild", "msvalidate.01": "9CD4A96D8A076527F07FD24CFCDE5489", "google-site-verification": "orfdzs_E4bRXom1qluA34zerrmjsg4QfrlLSkrR3ZAQ", "viewport": "width=device-width, initial-scale=1", "news_keywords": "8th Annual Grills Gone Wild"}, "article_summary": "Gulf Coast State College was filled with BBQ smoke Saturday evening for the 8th annual Grills Gone Wild competition.\nEvent organizers with the Panama City Beach Rotary club say the goal for the event was to raise $100,000.\nDozens of amateur and competition grill masters fired up their grills and cooked up their best barbecue; from chicken to ribs and even a barbecue sundae.\nGeneral admission and VIP tickets were sold, and proceeds from Saturday's event will go to 35 local charities.\n\"It has grown tremendously, we use to be just a small organization, now we have grown it to where we are actually giving out prize money and grillers are coming in to compete for prize money from all over the southeast region, explained Don Cooley, a member of the Panama City Beach Rotary Club."}