{"article_title": "Report: Smoking may cause diabetes, arthritis, macular degeneration", "article_keywords": ["lushniak", "macular", "diseases", "cancer", "arthritis", "smoked", "cigarette", "lung", "americans", "report", "smoking", "surgeon", "diabetes", "cause", "degeneration"], "article_url": "http://www.upi.com/Health_News/2014/01/17/US-surgeon-general-adds-diseases-to-smoking-danger-list/26951389940972/", "article_text": "ATLANTA, Jan. 17 (UPI) -- Diseases caused by smoking can include diabetes, arthritis, erectile dysfunction and macular degeneration as well as cancer, the U.S. surgeon general says.\n\nFifty years after a 1964 report concluded cigarette smoking causes lung cancer, Dr. Boris Lushniak, acting surgeon general, released a new report titled, The Health Consequences of Smoking -- 50 Years of Progress, which says smoking was identified as a cause of serious diseases of nearly all the body's organs.\n\nRheumatoid arthritis and colorectal and liver cancer are among the smoking-caused diseases listed in the report.\n\nIn addition, the report concludes secondhand smoke exposure is known to cause strokes in non-smokers.\n\n\"Smokers today have a greater risk of developing lung cancer than they did when the first Surgeon General's report was released in 1964, even though they smoke fewer cigarettes,\" Lushniak said in a statement.\n\n\"How cigarettes are made and the chemicals they contain have changed over the years, and some of those changes may be a factor in higher lung cancer risks.\"\n\nOver the last five decades, more than 20 million Americans died from smoking, and cigarette smoking kills nearly a half-million Americans a year, with an additional 16 million suffering from smoking-related conditions, the report says.\n\nCigarette smoking costs more than $289 billion a year in direct medical care and other economic costs, Lushniak said.\n\nOne-of-13 children and teens who are under 18 will die prematurely from smoking-related diseases unless current smoking rates drop, the report says.\n\nA half-century ago, about half of the U.S. population smoked tobacco, but the Centers for Disease Control and Prevention found cigarette smoking among U.S. adults declined from 20.9 percent in 2005 to 18.1 percent in 2012.\n\nThe prevalence of smoking tobacco in 2011 was significantly higher among males at 20.5 percent than females at 15.8 percent.\n\nMore than 17 percent of Americans ages 18 to 24 smoked, 21.6 percent ages 25 to 44 smoked, 19.5 percent ages 45 to 64 smoked and 8.9 percent of those age 65 and older smoked, the CDC said.", "article_metadata": {"description": "Diseases caused by smoking can include diabetes,    arthritis, erectile dysfunction and macular degeneration as well as cancer, the U.S. surgeon general says.", "og": {"site_name": "UPI", "description": "Diseases caused by smoking can include diabetes,    arthritis, erectile dysfunction and macular degeneration as well as cancer, the U.S. surgeon general says.", "title": "U.S. surgeon general adds diseases to smoking-danger list", "url": "http://www.upi.com/Health_News/2014/01/17/US-surgeon-general-adds-diseases-to-smoking-danger-list/26951389940972/", "image": "http://cdnph.upi.com/sv/ph/og/upi/26951389940972/2014/1/b5df8724400e20cb610bba05ea1da658/v2.1/US-surgeon-general-adds-diseases-to-smoking-danger-list.jpg", "type": "article"}, "fb": {"app_id": 130795020312660}, "keywords": "Health", "google-site-verification": "vnkcuJA1Q89cLmy4OZpuQKOf5Jf6ny_RVh7BpxZ11a0", "viewport": "initial-scale=1, maximum-scale=1", "news_keywords": "Health"}, "_id": "\"57477af46914bd0286fda722\"", "article_summary": "ATLANTA, Jan. 17 (UPI) -- Diseases caused by smoking can include diabetes, arthritis, erectile dysfunction and macular degeneration as well as cancer, the U.S. surgeon general says.\nCigarette smoking costs more than $289 billion a year in direct medical care and other economic costs, Lushniak said.\nFifty years after a 1964 report concluded cigarette smoking causes lung cancer, Dr. Boris Lushniak, acting surgeon general, released a new report titled, The Health Consequences of Smoking -- 50 Years of Progress, which says smoking was identified as a cause of serious diseases of nearly all the body's organs.\nRheumatoid arthritis and colorectal and liver cancer are among the smoking-caused diseases listed in the report.\nOver the last five decades, more than 20 million Americans died from smoking, and cigarette smoking kills nearly a half-million Americans a year, with an additional 16 million suffering from smoking-related conditions, the report says."}