{"article_title": "Missouri School District Hit With $150,000 Bill for Obamacare", "article_keywords": ["150000", "school", "hit", "district", "federal", "didnt", "dollars", "bill", "obamacare", "cost", "health", "missouri", "told", "coming", "care"], "article_url": "http://www.weeklystandard.com/missouri-school-district-hit-with-150000-bill-for-obamacare/article/770739", "article_text": "\"They knew it was coming, they just didn't exactly know how they were going to handle it. As small business around the nation have seen it coming, and they've been wondering how they will accommodate the Affordable Care Act. Just like them, the district is also asking that question. The district could limit subtitutes to 28 hours per week, or face paying six thousand dollars per person for health benefits for at least 25 individuals who are on the rolls and qualify. If they don't comply with the new federal law, the district would be fined millions of dollars by the federal government. While district officials didn't go as far as saying the federal government is hurting more than helping, I was told the $150,000 dollar cost is about the same cost as three teachers in the district, to put it into perspective,\" the reporter explains.\n\nThe Weekly Standard http://assets.weeklystandard.com.s3.amazonaws.com/tws15/images/logo-large.png\n\nThe Weekly Standard\n\n2013\n\nWashington, DC\n\nPolitics\n\nhttp://www.weeklystandard.com/missouri-school-district-hit-with-150000-bill-for-obamacare/article/770739\n\n2013-12-11T09:01\n\n2013-12-11T08:05\n\nMissouri School District Hit With $150,000 Bill for Obamacare\n\nA Missouri school district faces a $150,000 bill for Obamacare, according to a report on KMIZ-MO: The Affordable Care Act could cost the Jefferson City public schools more than a $150,000, said the news anchor. This came to light at last night's board meeting when district officials told board members they would have to pay health insurance for substitute teachers, says the other anchor. They knew it was coming, they just didn't exactly know how they were going to handle it. As small business around the nation have seen it coming, and they've been wondering how they will accommodate the Affordable Care Act. Just like them, the district is also asking that question. The district could limit subtitutes to 28 hours per week, or face paying six thousand dollars per person for health benefits for at least 25 individuals who are on the rolls and qualify. If they don't comply with the new federal law, the district would be fined millions of dollars by the federal government. While district officials didn't go as far as saying the federal government is hurting more than helping, I was told the $150,000 dollar cost is about the same cost as three teachers in the district, to put it into perspective, the reporter explains.\n\nBarack Obama, Daniel Halper, Education, Health Care, Missouri, Obamacare, Schools\n\nhttp://cdn.weeklystandard.biz/cache/280x280-.jpg", "article_metadata": {"news_keywords": "Barack Obama,Daniel Halper,Education,Health Care,Missouri,Obamacare,Schools", "og": {"url": "http://www.weeklystandard.com/missouri-school-district-hit-with-150000-bill-for-obamacare/article/770739", "type": "article", "site_name": "Weekly Standard", "description": "A Missouri school district faces a $150,000 bill for Obamacare, according to a report on KMIZ-MO:\n\nThe Affordable Care Act could cost the Jefferson City public schools more than a $150,000, said the news anchor.\nThis came to light at last night's board meeting when district officials told board members they would have to pay health insurance for substitute teachers, says the other anchor.\nThey knew it was coming, they just didn't exactly&nbsp;know&nbsp;how they were going to handle it. As small business around the nation have seen it coming, and they've been wondering how they will accommodate the Affordable Care Act. Just like them, the district is also asking that question. The district could limit subtitutes to 28 hours per week, or face paying six thousand dollars per person for health benefits for at least 25 individuals who are on the rolls and qualify. If they don't comply with the new federal law, the district would be fined millions of dollars by the federal government. While district officials didn't go as far as saying the federal government is hurting more than helping, I was told the $150,000 dollar cost is about the same cost as three teachers in the district, to put it into perspective, the reporter explains.", "title": "Missouri School District Hit With $150,000 Bill for Obamacare"}, "twitter": {"description": "A Missouri school district faces a $150,000 bill for Obamacare, according to a report on KMIZ-MO:\n\nThe Affordable Care Act could cost the Jefferson City public schools more than a $150,000, said the news anchor.\nThis came to light at last night's board meeting when district officials told board members they would have to pay health insurance for substitute teachers, says the other anchor.\nThey knew it was coming, they just didn't exactly&nbsp;know&nbsp;how they were going to handle it. As small business around the nation have seen it coming, and they've been wondering how they will accommodate the Affordable Care Act. Just like them, the district is also asking that question. The district could limit subtitutes to 28 hours per week, or face paying six thousand dollars per person for health benefits for at least 25 individuals who are on the rolls and qualify. If they don't comply with the new federal law, the district would be fined millions of dollars by the federal government. While district officials didn't go as far as saying the federal government is hurting more than helping, I was told the $150,000 dollar cost is about the same cost as three teachers in the district, to put it into perspective, the reporter explains.", "creator": "@danielhalper", "title": "Missouri School District Hit With $150,000 Bill for Obamacare", "site": "@weeklystandard", "widgets": {"csp": "on"}, "card": "summary"}, "fb": {"admins": 1285945407}, "google-site-verification": "QxcYUvYDy42iu46zPMF2vwdQlMXsJP74MqOgujGnpaQ", "keywords": "Barack Obama,Daniel Halper,Education,Health Care,Missouri,Obamacare,Schools", "article": {"author": "Daniel Halper", "published_time": "2013-12-11 09:01", "title": "Missouri School District Hit With $150,000 Bill for Obamacare"}, "viewport": "width=device-width,user-scalable=0"}, "_id": "\"57477af46914bd0286fd877c\"", "article_summary": "The Weekly Standard http://assets.weeklystandard.com.s3.amazonaws.com/tws15/images/logo-large.pngThe Weekly Standard2013Washington, DCPoliticshttp://www.weeklystandard.com/missouri-school-district-hit-with-150000-bill-for-obamacare/article/7707392013-12-11T09:012013-12-11T08:05Missouri School District Hit With $150,000 Bill for ObamacareA Missouri school district faces a $150,000 bill for Obamacare, according to a report on KMIZ-MO: The Affordable Care Act could cost the Jefferson City public schools more than a $150,000, said the news anchor.\nBarack Obama, Daniel Halper, Education, Health Care, Missouri, Obamacare, Schoolshttp://cdn.weeklystandard.biz/cache/280x280-.jpg\nIf they don't comply with the new federal law, the district would be fined millions of dollars by the federal government.\n\"They knew it was coming, they just didn't exactly know how they were going to handle it.\nThey knew it was coming, they just didn't exactly know how they were going to handle it."}