{"article_title": "Exxon Canceled Quality Climate Research, Carson Superpac $ Vanished, High Price of Cheap Toys: Nov 30, 2015", "article_keywords": ["climate", "exxon", "newsletter", "turkish", "paris", "price", "took", "daily", "research", "high", "turn", "change", "toys", "vanished", "superpac", "quality", "nov", "warming"], "article_url": "http://whowhatwhy.org/2015/11/30/exxon-canceled-quality-climate-research-carson-superpac-vanished-high-price-of-cheap-toys-nov-30-2015/", "article_text": "Exxon Canceled Quality Climate Research, Carson Superpac $ Vanished, High Price of Cheap Toys: Nov 30, 2015\n\nDISCOVER OUR BLOG\n\n\n\nDid you know that in addition to everything else we offer, we now have a Blog? It is dedicated to providing you with a mix of short, timely items you might well not see elsewhere. From \u201cDeep Politics\u201d Eyebrow-raisers to updates to \u201crants,\u201d it\u2019s an entertaining and informative addition to your daily reads. Follow along by clicking on Blog Posts on our menu bar.\n\nNow Live on WhoWhatWhy\n\nDistillation towers and flare in dawn light\n\nPhoto credit: Roy Luck / Flickr (CC BY 2.0)\n\nExxon Feeling the Heat Ahead of Paris Climate Conference\n\nBy Klaus Marre\n\nAs all eyes turn to the Paris climate talks, ExxonMobil finds itself in hot water. A series of disclosures reveal that the oil giant not only knew about the risk of climate change in the 1970s but slashed funding for further research when it became clear that there was not going to be any regulation on the issue for a long time.\n\nPICKS\n\nPICKS are stories from many sources, selected by our editors or recommended by our readers because they are important, surprising, troubling, enlightening, inspiring, or amusing. They appear on our site and in our daily newsletter. Please send suggested articles, videos, podcasts, etc. to picks@whowhatwhy.org.\n\nParis Climate Change Conference will take place from November 30 to December 11, 2015, in Paris, France. About this photo: Hoover Dam. Hydroelectricity is getting less reliable due to global warming. And the world is doubling down on it.\n\nPhoto Credit: Kuczora / Wikimedia (CC BY-SA 3.0)\n\nGlobal Warming \u201cHiatus\u201d Never Happened (Russ)\n\nReview of 40 studies debunks claim that global warming stalled 15 years back.\n\nThe High Price of Cheap Toys (Russ)\n\nThe other side of that Black Friday orgy: the horrendous conditions of the workers who make the stuff.\n\nMathematician Apologizes for Causing Bush 2000 Victory (Reader Pat)\n\nAn op-ed he wrote was misinterpreted, then cited by a judge, then became a partial basis for decision not to continue recount.\n\nHow to Turn $6 Million into $140,000 (Gerry)\n\nWith Ben Carson as its public face, a Super PAC founded by Newt Gingrich and his wife took money from small donors who wanted to fight Obamacare \u2013 and made most of it (the money, not Obamacare) disappear.\n\nFor Their Second Act, Keystone Killers Tackle Exxon (Trevin)\n\nThe goal is to force Exxon to face similar consequences for allegedly covering up climate change risks \u201cas Big Tobacco did for lying about cancer.\u201d\n\nEx-US Intelligence Chief on Islamic State\u2019s Rise: \u2018We Were Too Dumb\u2019 (Trevin)\n\n\u201cI just don\u2019t think people took them seriously. When I first heard about the recent attacks in Paris, I was like, \u2018Oh, my God, these guys are at it again, and we\u2019re not paying attention.\u2019\u201d\n\nThird Turkish Journalist Arrested Amid Fears of Ankara Censorship: Reports (Trevin)\n\nThe reporter for Hurriyet, a Turkish newspaper, was arrested after penning an \u201callegedly slanderous article criticizing the country\u2019s president, local media and German news agency.\u201d\n\nBeauty Contest for Holocaust Survivors (Russ)\n\nWhat a beautiful thing\u201313 women took part in the third annual pageant.\n\nSIGN UP\n\nLike what you see? Sign up here to subscribe to this newsletter \u2014 our daily roundup of stories from around the web that our editors or other readers thought worth reading. You can also sign up for our weekly newsletter, which recaps all of the exclusive WhoWhatWhy pieces of the past seven days.\n\nRelated\n\nSpeak Truth to Power We are 100% reader funded. Your tax-deductible contribution enables our next investigation. Make an impact now. Our Comment Policy Keep it civilized, keep it relevant, keep it clear, keep it short. Please do not post links or promotional material. We reserve the right to edit and to delete comments where necessary.", "article_metadata": {"description": "DISCOVER OUR BLOG\u00a0 Did you know that in addition to everything else we offer, we now have a\u00a0Blog? It is dedicated to providing you with a mix of short, tim", "og": {"site_name": "WhoWhatWhy", "description": "DISCOVER OUR BLOG\u00a0 Did you know that in addition to everything else we offer, we now have a\u00a0Blog? It is dedicated to providing you with a mix of short, tim", "title": "Exxon Canceled Quality Climate Research, Carson Superpac $ Vanished, High Price of Cheap Toys: Nov 30, 2015 - WhoWhatWhy", "locale": "en_US", "image": "http://whowhatwhy.org/wp-content/uploads/2015/11/128-300x200.jpg", "updated_time": "2015-11-30T12:46:18-04:00", "url": "http://whowhatwhy.org/2015/11/30/exxon-canceled-quality-climate-research-carson-superpac-vanished-high-price-of-cheap-toys-nov-30-2015/", "type": "article"}, "twitter": {"description": "DISCOVER OUR BLOG\u00a0 Did you know that in addition to everything else we offer, we now have a\u00a0Blog? It is dedicated to providing you with a mix of short, tim", "creator": "@whowhatwhy", "image": "http://whowhatwhy.org/wp-content/uploads/2015/11/317-300x200.jpg", "title": "Exxon Canceled Quality Climate Research, Carson Superpac $ Vanished, High Price of Cheap Toys: Nov 30, 2015 - WhoWhatWhy", "site": "@whowhatwhy", "card": "summary"}, "alexaVerifyID": "0dkArDs076G-ThtHae5KZsj3kZI", "robots": "noodp", "p": {"domain_verify": "19c7772d461a1d0b3b0d91c946f86bd3"}, "article": {"publisher": "https://www.facebook.com/WhoWhatWhy/", "section": "Daily Roundup", "published_time": "2015-11-30T19:00:09-04:00", "modified_time": "2015-11-30T12:46:18-04:00"}, "msvalidate.01": "594A42ABD53B5554752C462C6EEB8004", "google-site-verification": "h3qI9sBXff45iWNMqfeicv16KLAi5tIp0B82HWyRiIc", "viewport": "width=device-width, initial-scale=1"}, "article_summary": "Paris Climate Change Conference will take place from November 30 to December 11, 2015, in Paris, France.\nExxon Canceled Quality Climate Research, Carson Superpac $ Vanished, High Price of Cheap Toys: Nov 30, 2015DISCOVER OUR BLOGDid you know that in addition to everything else we offer, we now have a Blog?\nThey appear on our site and in our daily newsletter.\nNow Live on WhoWhatWhyDistillation towers and flare in dawn lightPhoto credit: Roy Luck / Flickr (CC BY 2.0)Exxon Feeling the Heat Ahead of Paris Climate ConferenceBy Klaus MarreAs all eyes turn to the Paris climate talks, ExxonMobil finds itself in hot water.\nThe High Price of Cheap Toys (Russ)The other side of that Black Friday orgy: the horrendous conditions of the workers who make the stuff."}