{"article_title": "Iggy Azalea Disses Lorde, The Beatles In New Interview", "article_keywords": ["comment", "beatles", "iggy", "disses", "receive", "billboard", "fancy", "peer", "magazine", "lorde", "interview", "think", "azalea", "latest"], "article_url": "http://www.fashionnstyle.com/articles/20666/20140607/iggy-azalea-disses-lorde-the-beatles-in-new-interview.htm", "article_text": "The Eye\n\nIggy Azalea Disses Lorde, The Beatles In New Interview\n\nSIGN UP TO RECEIVE THE LATEST NEWS FROM FASHION&STYLE\n\n(Photo : Billboard Magazine)\n\nThe \"Fancy\" rapper got jeweled-up and struck a fierce pose for her new Billboard magazine interview, all while throwing some shade at fellow musicians Lorde and even, The Beatles?\n\n\n\nWhen 17-year-old Lorde collaborated with the surviving members of Nirvana at the Rock and Roll Hall of Fame Induction Ceremony on April 10 in Brooklyn, Iggy felt the whole setup was inappropriate.\n\n\n\n\"Nothing against her, but I think when you're doing a tribute to someone that's dead, generally it should be the person's peer,\" Azalea told the magazine. \"Lorde is not Kurt Cobain's peer. No matter if she killed the performance or not, I just don't think it's appropriate.\"\n\n\n\nLorde, who has come to Iggy's defense over \"spineless critics\" in the past, has yet responded to the comment made by the rapper.\n\n\n\nAs for The Beatles comment, the Aussie star is the first act since the iconic 1960s band to have her debut Hot 100 hits (\"Fancy\" and \"Problem\") reach No. 1 and 2 on the chart simultaneously. Her response to the groundbreaking achievement?\n\n\n\n\"It doesn't mean anything,\" she said. \"I'd rather be The Rolling Stones.\"\n\n\n\n(MORE: See Iggy Flaunt Her Curves In New Instagram Pics)\n\n\n\nSIGN UP TO RECEIVE THE LATEST NEWS FROM FASHION&STYLE\n\n\u00a9 2015 Fashion & Style.com All rights reserved. Do not reproduce without permission.", "article_metadata": {"Description": "The \"Fancy\" rapper got jeweled-up and struck a fierce pose for her new Billboard magazine interview, all while throwing some shade at fellow musicians Lorde and even, The Beatles?", "Copyright": "2014 Fashion&Style", "Author": "Fashion&Style", "og": {"site_name": "Fashion & Style", "description": "The \"Fancy\" rapper got jeweled-up and struck a fierce pose for her new Billboard magazine interview, all while throwing some shade at fellow musicians Lorde and even, The Beatles?", "title": "Iggy Azalea Disses Lorde, The Beatles In New Interview", "url": "http://www.fashionnstyle.com/articles/20666/20140607/iggy-azalea-disses-lorde-the-beatles-in-new-interview.htm", "image": "http://images.fashionnstyle.com/data/images/full/31772/iggy-azalea-billboard-magazine-cover.jpg", "type": "article"}, "twitter": {"domain": "fashionnstyle.com", "description": "The \"Fancy\" rapper got jeweled-up and struck a fierce pose for her new Billboard magazine interview, all while throwing some shade at fellow musicians Lorde and even, The Beatles?", "title": "Iggy Azalea Disses Lorde, The Beatles In New Interview", "url": "http://www.fashionnstyle.com/articles/20666/20140607/iggy-azalea-disses-lorde-the-beatles-in-new-interview.htm", "image": "http://images.fashionnstyle.com/data/images/full/31772/iggy-azalea-billboard-magazine-cover.jpg", "creator": "@FNStylecom", "site": "@FNStylecom", "card": "summary_large_image"}, "syndication-source": "http://www.fashionnstyle.com/articles/20666/20140607/iggy-azalea-disses-lorde-the-beatles-in-new-interview.htm", "robots": "index, follow", "Title": "Fashion&Style offers online coverage of latest fashion news, hottest trends and celebrity style from around the world, unveiling fashion and style from street corners to runways and red carpets.", "Googlebot-news": "index, follow", "Keywords": "Fashion&Style", "article": {"published_time": "2014-06-07"}, "news_keywords": "iggy, azalea, disses, lorde, the, beatles, in, new, interview", "viewport": "width=device-width", "Subject": "fashionnstyle.com"}, "article_summary": "The EyeIggy Azalea Disses Lorde, The Beatles In New InterviewSIGN UP TO RECEIVE THE LATEST NEWS FROM FASHION&STYLE(Photo : Billboard Magazine)The \"Fancy\" rapper got jeweled-up and struck a fierce pose for her new Billboard magazine interview, all while throwing some shade at fellow musicians Lorde and even, The Beatles?\n(MORE: See Iggy Flaunt Her Curves In New Instagram Pics)SIGN UP TO RECEIVE THE LATEST NEWS FROM FASHION&STYLE\u00a9 2015 Fashion & Style.com All rights reserved.\nLorde, who has come to Iggy's defense over \"spineless critics\" in the past, has yet responded to the comment made by the rapper.\n\"Nothing against her, but I think when you're doing a tribute to someone that's dead, generally it should be the person's peer,\" Azalea told the magazine.\nWhen 17-year-old Lorde collaborated with the surviving members of Nirvana at the Rock and Roll Hall of Fame Induction Ceremony on April 10 in Brooklyn, Iggy felt the whole setup was inappropriate."}