{"article_title": "Health Care Deals Thrive, but Dealmakers Predict Significant Slowdown in Future Activity", "article_keywords": ["sector", "impact", "dealmakers", "score", "predict", "mmp", "related", "slowdown", "deals", "future", "health", "significant", "activity", "gave", "3month", "thrive", "care"], "article_url": "http://www.themiddlemarket.com/news/healthcare/health-care-deals-thrive-but-dealmakers-predict-significant-slowdown-260278-1.html", "article_text": "Health Care Deals Thrive, but Dealmakers Predict Significant Slowdown in Future Activity\n\nThe Affordable Care Act has been driving health care deals, but its impact is lessening over time, and its future is uncertain in this election year\n\nExpectations for M&A in the health care industry have plummeted over the last year, according to Mergers & Acquisitions\u2019 Mid-Market Pulse (MMP). Dealmakers polled in March gave the sector a 3-month composite score of 53.2 and a slightly higher 12-month composite score of 59.8. (See related chart).\n\nA year ago, they gave health care a 3-month score of 91.2, the highest ranking ever received on the MMP for any sector. As recently as August, transaction pros gave health care a 3-month score of 78.1. In recent years, consolidation in the sector has been driven by the Affordable Care Act, as providers have been under pressure to achieve cost efficiencies. Over time, the impact of ACA is expected to lessen. Some poll respondents expressed uncertainty about the future of the ACA, due to the upcoming presidential election.\n\nThe MMP is a forward-looking sentiment indicator, derived from monthly surveys of approximately 250 executives and published in partnership with RSM LLP (formerly McGladrey). Other sectors covered by the MMP include: Consumer goods and retail; energy; technology, media & telecommunications (TMT); financial services, insurance and real estate (FIRE); and manufacturing.\n\nFor more information on related topics, visit the following:", "article_metadata": {"status": "open", "domain": "Mergers & Acquisitions", "sailthru.author": "Mary Kathleen Flynn", "sailthru.expire_date": "2016-05-11 06:00:00", "og": {"url": "http://www.themiddlemarket.com/news/healthcare/health-care-deals-thrive-but-dealmakers-predict-significant-slowdown-260278-1.html", "image": "http://cdn.themiddlemarket.com/media/newspics/mmpstockchart.jpeg", "site_name": "Mergers & Acquisitions, Latest News", "title": "Health Care Deals Thrive, but Dealmakers Predict Significant Slowdown in Future Activity"}, "sailthru.description": "The Affordable Care Act has been driving health care deals, but its impact is lessening over time, and its future is uncertain in this election year", "brand": "Mergers & Acquisitions, Latest News", "sailthru.date": "2016-04-11 06:00:00", "wordcount": 180, "sailthru.title": "Health Care Deals Thrive, but Dealmakers Predict Significant Slowdown in Future Activity", "featured": 0, "sailthru.tags": "News, Financial Services, Business Services, Health Care, Data, Health Care, Health Care Deals Thrive, but Dealmakers Predict Significant Slowdown in Future Activity , MMP, M&A, middle market, deal flow, retail, energy, manufacturing, financial services, technology, affordable care act, Article", "type": "Article", "sailthru.image.full": "http://cdn.themiddlemarket.com/media/newspics/mmpstockchart.jpeg"}, "article_summary": "Health Care Deals Thrive, but Dealmakers Predict Significant Slowdown in Future ActivityThe Affordable Care Act has been driving health care deals, but its impact is lessening over time, and its future is uncertain in this election yearExpectations for M&A in the health care industry have plummeted over the last year, according to Mergers & Acquisitions\u2019 Mid-Market Pulse (MMP).\nAs recently as August, transaction pros gave health care a 3-month score of 78.1.\nA year ago, they gave health care a 3-month score of 91.2, the highest ranking ever received on the MMP for any sector.\nDealmakers polled in March gave the sector a 3-month composite score of 53.2 and a slightly higher 12-month composite score of 59.8.\nSome poll respondents expressed uncertainty about the future of the ACA, due to the upcoming presidential election."}