{"article_title": "RILING TRUMP -- THE FORMER PAGE who leaked the Mark Foley texts goes public -- BRAD DAYSPRING joins Politico -- B\u2019DAY: Vice President Biden, Judy Woodruff, Charlie Cook", "article_keywords": ["riling", "trump", "vice", "broadband", "house", "woodruff", "ht", "mark", "texts", "dayspring", "playbook", "politico", "president", "john", "refugees", "public", "page"], "article_url": "http://www.politico.com/playbook/2015/11/politico-playbook-november-20-gop-anti-trump-campaign-211381", "article_text": "RILING TRUMP -- THE FORMER PAGE who leaked the Mark Foley texts goes public -- BRAD DAYSPRING joins Politico -- B\u2019DAY: Vice President Biden, Judy Woodruff, Charlie Cook\n\nBy Mike Allen (@mikeallen; mallen@politico.com) and Daniel Lippman (@dlippman; dlippman@politico.com)\n\nBREAKING: \u201cGunmen attack luxury hotel in Mali capital, 170 taken hostage,\u201d by Reuters\u2019 Tiemoko Diallo in Bamako: \u201cMalian special forces stormed a luxury hotel in Bamako on Friday after Islamist gunmen took 170 people including many foreigners hostage in the capital of the former French colony, which has been battling rebels allied to al Qaeda for several years. ... State television said 80 hostages had been freed but ... at least three people had been killed in the initial attack.\u201d http://yhoo.it/1OiGo2s\n\nStory Continued Below\n\n--\u201cIsraeli spy Jonathan Pollard released from U.S. prison after 30 years,\u201d by LATimes\u2019 Tim Phelps: http://lat.ms/1O7ARxu\n\nHappy Friday! TOP TALKER -- \u201cPolitico Hires Brad Dayspring, Veteran G.O.P. Operative\u201d as its first Vice President of Communications, beginning Dec. 14 -- N.Y. Times\u2019 Nick Corasaniti: \u201cThe growing news organization has hired Brad Dayspring, the outspoken and occasionally combative Republican political operative with a notorious Twitter feed \u2026 \u2018We have always thought of Politico like a political candidate,\u2019 Kim Kingsley, Politico\u2019s chief operating officer, said in a memo \u2026 to the staff \u2026 \u2018One that needs a carefully managed and consistent message, a great offensive strategy and a clear path ahead. \u2026 Brad was born for this job.\u2019 \u2026\n\n\u201cThe position is a new one at Politico, one that \u2026 Jim VandeHei, chief executive and co-founder of Politico, said was necessary as the organization evolves into a global media company. Mr. Dayspring will oversee the entire communications portfolio and operation at Politico: promotion, booking, publicity and, yes, defending the brand against attacks. \u2026\n\n\u201cDayspring described the opportunity as an amalgamation of his loves \u2013 politics and policy \u2026 Dayspring will still be expected to maintain the quick response that drives his constant presence on social media. \u2018I think one of his many tricks in his bag is he does understand the speed and different dimensions of communication now, and you\u2019ve got to be quick and smart on all those platforms,\u2019 Mr. VandeHei said in an interview.\u201d http://nyti.ms/1OiLDzt ... Full memo http://politi.co/1I3ricy\n\n**SUBSCRIBE to Playbook: http://politi.co/1M75UbX\n\nSCOOP DU JOUR -- \u201cGOP group plans most aggressive anti-Trump campaign yet,\u201d by Alex Isenstadt: \u201c[Kasich\u2019s] super PAC is planning to invest $2.5 million in the most aggressive takedown of the poll leader yet \u2014 on behalf of an increasingly anxious GOP establishment. The attack ... will play out over the next two months on radio, TV, mail and online in New Hampshire. Strategists with the pro-Kasich group, called New Day for America, say the budget for the anti-Trump campaign is likely to grow.\u201d http://politi.co/1MY2Qih\n\n--\u201cTrump threatens to sue pro-Kasich super PAC,\u201d by Alex Isenstadt: \u201c[A] Trump lawyer, Alan Garten, sent two top strategists from the group, Matt David and Fred Davis, a letter on Trump Organization letterhead. A letter was also sent to Kasich himself. \u2018Please be advised that in the event your ads contain any false, misleading, defamatory, or otherwise tortious statements or representations regarding Mr. Trump\u2019s businesses or his brand, we will not hesitate to seek immediate legal action to prevent such distribution and hold you and your organizations jointly and severally liable.\u2019\u201d http://politi.co/1PDqcfp\n\nARTICLE OF THE DAY -- Zack Stanton, editor-in-chief of the Wilson Quarterly, on Politico, \u201cThe Page Who Took Down the GOP: Why I leaked the scandalous Mark Foley messages\u2014and what I regret about it\u201d: \u201cI was a congressional page in 2001 and 2002. During that year, Foley sent sexual instant messages to at least three of my classmates. The messages weren\u2019t flirtatious\u2014though some started that way\u2014but out and out lewd. ... [H]ow the conversations went public, and who gave them to reporters and started the avalanche that ended Foley\u2019s career and dealt a blow to the Republican congressional majority, has never come out.\n\n\u201cIt was me. I didn\u2019t do it to sink the Republicans, though as an aspiring Democratic politico, I wasn\u2019t sorry to see it happen. I did it because I realized just how easily Congressman Foley had been evading accountability for repeat offenses, and that the House leadership was either unwilling or unable to solve the problem.\u201d http://politi.co/1kK9zCa\n\n--\u201cA History of the House Page Program: How House pages have left a permanent mark on the way America governs,\u201d by Noah Weiland \u2013 14 images: http://politi.co/1YjEUtE\n\nINSIDE THE CAMPAIGNS -- \u201cHow Ted Cruz is locking up the evangelical vote,\u201d by Katie Glueck: \u201c[E]vangelical leaders and political operatives who work with the Christian conservative movement say it\u2019s the well-funded Cruz who has made the bigger organizational effort with politically active churchgoers. He\u2019s rounding up the very grassroots leaders who wield influence with this crucial Republican voting bloc.\u201d http://politi.co/1OUnkuC\n\nTHE POLITICO CAUCUS, our weekly insider poll from the early states -- \u201cInsiders: Foreign policy blunders threaten Carson candidacy,\u201d by Steve Shepard: \u201c71 percent of Republicans said Carson was the most vulnerable among the 14 GOP hopefuls on foreign policy \u2014 far more than any other candidate. \u2018He clearly has no idea what he\u2019s talking about,\u2019 said one South Carolina Republican. \u2018Ben Carson's complete ineptitude makes you long for the days of \u201cUz-beki-beki-stan-stan,\u201d\u2019 added an Iowa Republican, referring to a disastrous Herman Cain interview four years ago.\u201d http://politi.co/1SKXgA2\n\n** A message from COMPETIFY: Ever wish you had less options on Thanksgiving? Of course not. So why limit broadband competition? #TryCompetify to experience increased broadband competition, faster Internet speeds and more affordable service. Now, that\u2019s something to be thankful for this Thanksgiving. Learn more at http://bit.ly/CompetifyPB **\n\nMAUREEN DOWD\u2019s blockbuster inaugural piece for the Times Magazine \u2013 Cover story: \u201cThe Women of Hollywood Speak Out \u2026 All around Hollywood, women are ready to run studios, direct blockbuster pictures and write stories that go beyond dinosaurs and superheroes. What will it take to dismantle the pervasive sexism that keeps them from doing it?\u201d: \u201cIn both 2013 and 2014, women were only 1.9 percent of the directors for the 100 top-grossing films. Excluding their art-house divisions, the six major studios released only three movies last year with a female director. ...\n\n\u201cWhen I phoned [a] powerful Hollywood player to ask about the issue, he said dismissively, \u2018Call some chicks.\u2019 So I did. I talked to more than 100 women and men at all levels of Hollywood. What I heard was an avalanche of previously pent-up fears, regrets, recriminations and recommendations.\u201d http://nyti.ms/1NFOEqu See the cover, which features 63 portraits of women in Hollywood. http://bit.ly/1S7ossE\n\n\n\nSIREN -- USA Today banner, \u201cBIGGEST INSURER MAY QUIT OBAMACARE: 540,000 might be forced to find another provider,\u201d by Nathan Bomey and Jayne O\u2019Donnell: \u201cThe possible move by UnitedHealth Group raises new questions about the viability of President Obama's signature health law and follows the departure of more than half of the non-profit insurance cooperatives this year. If UnitedHealth drops out, consumers would lose one of the lowest-cost plans available in much of the country, and some wonder how smaller insurers could fill the void.\u201d http://usat.ly/1PQLoNH\n\n--WSJ A1, at fold, \u201cBiggest Insurer Threatens To Abandon Health Law,\u201d by Anna Wilder Mathews and Stephanie Armour: \u201cThe industry\u2019s woes, and broad rate increases aimed at stanching the red ink, are putting pressure on the Obama administration to tweak aspects of the law; the issues also risk pulling the ACA back into the political spotlight. Republicans \u2026 quickly jumped on the news.\u201d http://on.wsj.com/1Lq4Pqq\n\nDATA DU JOUR \u2013 L.A. Times 2-col. Lead, \u201cBalance tips as more exit U.S. for Mexico, survey finds: Economic and family issues are among the reasons for returning,\u201d by Nigel Duara and Cindy Carcamo: \u201cthe first modern instance of the migration scales tipping: More Mexican nationals are leaving the U.S. than the number of Mexicans entering the country.\u201d http://lat.ms/1PQOwt1\n\nSUNDAY SO FAR:\n\n--\u201cFox News Sunday\u201d: Rubio \u2026 New national Fox News polls on D/R primaries \u2026 Rush Limbaugh \u2026 Power Player: Maryland Gov., Larry Hogan (R) \u2026 Panel: George Will, Kirsten Powers, Heritage Action CEO Michael Needham, Juan Williams\n\n--ABC\u2019s \u201cThis Week\u201d: Ben Carson \u2026 Martin O\u2019Malley ... Martha Raddatz reports from overseas on the latest in the fight against ISIS \u2026 Roundtable: David Axelrod, Matthew Dowd, Rep. Keith Ellison, Rep. Martha McSally\n\n--\u201cFace the Nation\u201d: Rand Paul \u2026 Senate Intelligence Committee Ranking Member Dianne Feinstein and House Homeland Security Chairman Michael McCaul \u2026 Michael Morell, Fran Townsend and Tom Donilon \u2026 results from a CBS News Battleground Tracker poll, with analysis from CBS News Elections Director Anthony Salvanto \u2026 Panel: Karl Rove, Ruth Marcus, Ron Brownstein\n\n--\u201cMeet the Press\u201d: Kasich \u2026 Roundtable: Tom Brokaw, Helene Cooper, Ron Fournier, Kathleen Parker\n\n--CNN\u2019s \u201cState of the Union\u201d: Tapper\u2019s back from his week in Paris. House Intelligence Chair Devin Nunes \u2026 Panel: Bob Kerrey; CFR\u2019s Farah Pandith, former State Dept. Special Representative to Muslim Communities; Rep. Marsha Blackburn; Hugh Hewitt\n\nTHE NATIONAL CONVERSATION \u2013 L.A. Times A1, at fold, \u201cTackling racism with tough talks, harmony,\u201d by Randy Lewis (\u201cNo time for \u2018Kumbaya\u2019: Musicians tackle racism head-on in \u2018Shining a Light\u2019 benefit\u201d): \u201cThe sentiments of [Pharrell] Williams and [John] Legend were echoed by other participants in back-to-back specials airing Friday night on all six cable channels of A&E Networks: the two-hour \u2018Shining a Light: A Concert for Progress on Race in America,\u2019 filmed Wednesday night in Los Angeles, and the hour-long \u2018Shining a Light: Conversations on Race in America.\u2019\u201d http://lat.ms/1NGL5AD\n\nMARCO\u2019s ISIL plan, written for Politico -- \u201cWe Asked Marco Rubio to Lay Out His ISIL Strategy. Here It Is\u201d \u2013 Politico: \u201cThis is now more than a mere military battle; it is a civilizational struggle \u2026 First, I would protect the homeland by immediately stopping the flow of Syrian refugees into the United States\u2014not because refugees fleeing conflict are unwelcome, but because it is currently impossible to verify their identities or intentions. ... Next, I would reverse defense sequestration so we have the capabilities to go on the offense... Furthermore, I understand the ideological conflict at the heart of this struggle and will apply the appropriate pressure to tip the scales in favor of peace and stability.\u201d http://politi.co/1MpXDhQ\n\n--@blakehounshell: \u201cClinton speech a reminder that, for all Obama\u2019s gifts, she has better instincts on the politics of national security.\u201d\n\n--FLASHBACK -- @ezraklein, Sept. 10, 2013: \u201cI can\u2019t believe the White House\u2019s strategy on Syria is working out this well. I doubt they can, either.\u201d\n\n--\u201cHouse approves Syrian refugees bill,\u201d by Lauren French and John Bresnahan: \u201cThe House passed a bill Thursday that would block Syrian and Iraqi refugees from entering the country unless they pass strict background checks \u2014 setting up a collision with President Barack Obama and Senate Democrats. ... The bipartisan support was a rebuke of President Barack Obama by House Democrats who felt that the administration failed to make a compelling case as to why they should vote against the Republican-authored bill when it was bad politics to do so.\u201d http://politi.co/1O6xirE\n\n-- \u201cRubio Open to Trump\u2019s Plan to Close Mosques: Any Facility Used to Radicalize We Should Look At\u201d http://bit.ly/1OinaKn\n\n--\u201cCarson compares Syrian refugees to dogs,\u201d by Nolan McCaskill: \u201cSpeaking to reporters in Alabama, Carson stressed that the United States wants smart leaders who care about people, but noted there should always be a balance between safety and humanitarian concerns. \u2018For instance, you know, if there is a rabid dog running around your neighborhood, you\u2019re probably not going to assume something good about that dog, and you\u2019re probably gonna put your children out of the way,\u2019 Carson said. \u2018Doesn\u2019t mean that you hate all dogs by any stretch of the imagination.\u2019\u201d http://politi.co/1Qx02eC\n\nWHEN THE CIA TALKED TO BLAKE HOUNSHELL -- \u201cHow to anticipate unthinkable terrorist attacks? Hire oddballs to think of them,\u201d by WashPost\u2019s Carlos Lozada, reviewing \u201cRed Team: How to Succeed by Thinking Like the Enemy,\u201d by Micah Zenko: \u201cZenko ... notes that the CIA\u2019s Red Cell team ... even met with Foreign Policy magazine staffers for headline tips. \u2018They wanted to know how our stuff went viral,\u2019 recalls Blake Hounshell, then the magazine\u2019s managing editor. \u2018The techniques that we considered to be \u201cclick bait\u201d were what they were most interested in.\u2019 Not the most encouraging use of tax dollars.\u201d http://wapo.st/1NeFXcp $17.55 on Amazon http://amzn.to/1PCLQ3D\n\nFIRST LOOK \u2013 RNC \u201cChairman Reince Priebus [is announcing] Friday that the RNC raised $8.7 million in October 2015, breaking yet another presidential off-year fundraising record. The RNC has raised over $89 million this cycle and currently has over $20 million cash on hand. ... Percentage of donations $200 and under in October 2015: 99% ... Average donation in October 2015: $69 ... Debt in October 2015: $1.8m.\u201d\n\nHAPPY HOUR HELPER \u2013 \u201cColleges update mascots, mottos, amid pressure from students,\u201d by AP\u2019s Collin Binkley: \u201cAmherst College has turned on its mascot. Georgetown University is renaming buildings. Union College has a new motto. Faced with growing pressure from students, colleges across the U.S. are updating campus fixtures that have been deemed insensitive or outdated. Inspired by racially charged protests at the University of Missouri, students have demanded tweaks of that type among broader calls for improved treatment of minority students.\u201d http://yhoo.it/1S86Jl5\n\nSPOTTED: Carlos Slim in the lobby yesterday morning of the Georgetown Four Seasons.\n\n--Bernie Sanders walking across the street, holding his own dry cleaning and an umbrella, alone. A group of bar patrons cheered outside as he crossed the intersection right by Schneider\u2019s of Capitol Hill.\n\n--George Will, in first class aboard American\u2019s early Thursday morning nonstop to Vegas.\n\nCORRECTION OF THE DAY \u2013 NYT: \u201cAn earlier version of this review misstated a song lyric. Adele sings \u2018Hello from the other siiiiiide, I must have called a thousand tiiiiiiimes\u2019; \u2018Hello from the outsiiiiiide\u2019 appears later in the song.\u201d http://nyti.ms/216gbvd (h/t Sasha Belenky)\n\nLIFE ONLINE -- \u201cImproving the Experience When Relationships End,\u201d by Facebook\u2019s Kelly Winters: \u201c[W]e are testing tools to help people manage how they interact with their former partners on Facebook after a relationship has ended. ... See less of a former partner\u2019s name and profile picture around Facebook without having to unfriend or block them. Their posts won\u2019t show up in News Feed and their name won\u2019t be suggested when people write a new message or tag friends in photos.\u201d http://bit.ly/1ja4wJA\n\nMEDIAWATCH -- \u201cJohn Heilemann and Mark Halperin Ponder Game-Changing Deal With MSNBC,\u201d by New York Mag\u2019s Gabe Sherman: \u201c[A]s the presidential-election season heats up, [NBC News chairman Andy] Lack is looking to give a show to the campaign chroniclers John Heilemann and Mark Halperin. ... Lack is in talks with Bloomberg Television to simulcast Heilemann and Halperin\u2019s politics show With All Due Respect on MSNBC. One scenario being discussed is to air WADR at 6 p.m., filling the slot formerly occupied by Al Sharpton. The novel programming arrangement would conceivably benefit both sides. Heilemann and Halperin would gain access to a far larger audience than ratings-challenged Bloomberg TV provides. ... When asked about the deal, Heilemann said: \u2018I can\u2019t talk to you about any such thing.\u2019\u201d http://nym.ag/1YiVV7i\n\n--\u201cCNN reporter suspended after tweet on refugees,\u201d by Hadas Gold: \u201cCNN global affairs correspondent Elise Labott has been suspended for two weeks ... Earlier on Thursday Labott had tweeted[:] ... \u2018House passes bill that could limit Syrian refugees. Statue of Liberty bows head in anguish,\u2019 she wrote, linking to a CNN article on the vote.\u201d http://politi.co/1l8Sgua\n\n--VINAY MEHRA named Politico\u2019s CFO \u2013 Jim VandeHei emails the world staff: \u201cVinay has served as CFO and treasurer of WGBH ... He is both very strategic and very good at the nuts and bolts of finance and accounting. This is a big moment in the growth of our organization. We are too big and are growing too fast not to have a first-class CFO who can help the Finance Department become a true partner to the business, fully integrated into our daily operations and decision making.\u201d\n\n--David Lerman to CQ -- He posts on Facebook: \u201cAfter a great five-year run at Bloomberg News, I\u2019m proud to join the talented folks at Congressional Quarterly to help cover federal budget issues and assorted matters.\u201d\n\nWELCOME TO THE WORLD -- Gavin Mathis of Edelman and wife Cara of DOJ announce the arrival of their first child, James Holden Mathis, born at 5:38 p.m. on Thursday and weighed in at 6 lbs 2oz. \u201cHe is tall and skinny just like his dad, and impatient and hyper-punctual like his mom. Mom and Holden are doing great. The happy parents first met at a POLITICO Playbook Breakfast (Debbie Wasserman-Schultz) in 2011, before official introductions at Ted\u2019s Bulletin. Thank you, POLITICO, for making this little miracle possible!\u201d Baby pics http://bit.ly/1OhRXHf ... http://bit.ly/1YiW5eQ\n\nOUT AND ABOUT -- OBAMA ALUMNI REUNION -- Hundreds of former Obama alumni and friends of Massachusetts State Senator Eric Lesser (D-Longmeadow and West Wing aide-de-camp to David Axelrod) packed the rooftop of 1905 Bistro last night in Shaw. The fundraiser, organized by Herbie Ziskend and Jake Levine, featured remarks by former Chief of Staff Pete Rouse. CO-HOSTS included: Ron Klain, David Axelrod, Geoff Garin, Charlie Baker III, Stephanie Cutter, Austan Goolsbee, Reggie Love, Ben Labolt, Carol Browner and Tom Downey, Jeremy Bash, Erik Smith.\n\n--SPOTTED: Tammy, Bob Barnett, Anita McBride, Susanna and Jack Quinn, Josh Lipsky, Kevin Bailey, Linda Douglass, Katie Johnson, Dag Vega, Kenny Thompson, Brian Levine, Jeff and Deb Nussbaum, Caitria Mahoney, Will Cappellitti, Arun Chaudhary, Laura Moser, Joe and Maggie Maloney, Marcy Stech, Avra Siegel, Kate Hansen, Sam Simon, Meredith Carden, Eden Schiffmann, Matthew Shapanka, Heather Zichal, Ryan Harper, Zachary Richner, Josh Goldman, Meredith Carden, Ted Chiodo, Roger Fisk, Nate Tibbits, Rachel Cohen, Phil Sharp, Peter Rosenstein.\n\nBIRTHWEEK (was yesterday): The Nation\u2019s Caitlin Graf ... Matt Allen ... Beth Mickelberg, JPMorgan Chase marketing (h/t Steve O\u2019Halloran) ... (was Nov. 11): Gordon Witkin, executive editor at the Center for Public Integrity (h/t Dave Levinthal)\n\nBIRTHDAYS: Judy Woodruff is ageless \u2026 Vice President Biden is 73 \u2026 former U.N. Ambassador John Bolton is 67 \u2026 Charlie Cook, the pride of Shreveport, La. ... Beth Foster (h/ts Teresa Vilmain) \u2026 Politico\u2019s Sagar Sushant, Dan Goldberg and Jeffrey Amster ... Philip Ewing, national security editor with NPR, a Phil Elliott classmate at Ohio ... Don Baker (h/t Peter, Spencer, Ellen) ... BrandLinkDC\u2019s Jayne Sandman ... Cecelia Prewett, SVP at SKDKnickerbocker, former FTC and Hill staffer, celebrating with Will and Ava (h/t Jon Haber) ... Matt Miller ... Julie Hyman, senior markets correspondent for Bloomberg TV, the pride of Baltimore and a former Paris resident (h/t Ben Chang) ... Shawn Hils, formerly in the DNC\u2019s research operation and now helping grow the communications team at the National Basketball Association (h/t James Owens) ... Devorah Adler, founder of Beehive Research ... Brian Reisinger, comms. director for Ron Johnson for Senate and a Lamar Alexander alum, is 31 ... John Darnton ... Vincent Coppola ... Elizabeth O\u2019Connor ... Ciara Torres-Spelliscy ...\n\n\u2026 Toni Nissi ... Jenevieve Newman Beavers \u2026 Nikki Buffa, deputy chief of staff at Interior \u2026 Robert Edmonson \u2026 Jenevieve Beavers ... Parita Shah, a Commerce alum now chief of staff at the Millennium Challenge Corporation \u2026 Sandy McNabb \u2026 Aaron Harison, president of the Washington Free Beacon \u2026 Alexis Weiss \u2026 New Hampshire\u2019s Al Baldasaro ... Jay Lefkowitz ... Ciara Torres-Spelliscy ... Country music Superstar Dierks Bentley...maybe he and VP Biden can celebrate by taking out Air Force II and getting \u201cDrunk on a Plane\u201d (h/t Kurt Bardella) \u2026 actress-comedian Kaye Ballard is 90 \u2026 Dick Smothers is 77\u2026. Bo Derek is 59 \u2026 former NFL player Mark Gastineau is 59 \u2026 Todd Nance (Widespread Panic) is 53 \u2026 Mike D (The Beastie Boys) is 50 \u2026 Jeremy Jordan (\u201cSupergirl\u201d) is 31 \u2026 pop musician Michael Clifford (5 Seconds to Summer) is 20 (h/ts AP)\n\n**A message from COMPETIFY: America\u2019s broadband economy is plagued by chronic broadband access dysfunction and the broadband access fees charged to small businesses, schools, and hospitals are in desperate need of a dose of real competition. Tell the FCC to try COMPETIFY to help lower costs and increase speeds. America shouldn\u2019t have to suffer from lackluster broadband just because a few companies have control issues. Join the COMPETIFY Partners For The Cure and fix America\u2019s chronic broadband access control. Get the cure at http://bit.ly/CompetifyPB **\n\nSUBSCRIBE to the Playbook family: POLITICO Playbook: http://politi.co/1M75UbX ... New York Playbook: http://politi.co/1ON8bqW ... Florida Playbook: http://politi.co/1JDm23W ... New Jersey Playbook: http://politi.co/1HLKltF ... Massachusetts Playbook: http://politi.co/1Nhtq5v ... Illinois Playbook: http://politi.co/1N7u5sb ... California Playbook: http://politi.co/1N8zdJU and our heroic friends at POLITICO Brussels Playbook: http://politi.co/1FZeLcw\n\n** A message from BP: Safety is never being satisfied \u2013 and always working to be better. That\u2019s why at BP, we\u2019re working every day to improve our training, our technology, our culture. See real examples of our progress: on.bp.com/safety **", "article_metadata": {"og": {"site_name": "POLITICO", "description": "The GOP plans its largest attack on Donald Trump yet.", "title": "RILING TRUMP -- THE FORMER PAGE who leaked the Mark Foley texts goes public -- BRAD DAYSPRING joins Politico -- B\u2019DAY: Vice President Biden, Judy Woodruff, Charlie Cook", "url": "http://www.politico.com/playbook/2015/11/politico-playbook-november-20-gop-anti-trump-campaign-211381", "image": "http://static.politico.com/97/de/e15842c94e928ce8b561e20745a0/whitelogoondots.jpeg", "fb_appid": 114037015331397, "type": "website"}, "twitter": {"site": "@politico", "card": "summary_large_image", "creator": "@politico"}, "description": "The GOP plans its largest attack on Donald Trump yet.", "viewport": "width=device-width, initial-scale=1"}, "article_summary": "The happy parents first met at a POLITICO Playbook Breakfast (Debbie Wasserman-Schultz) in 2011, before official introductions at Ted\u2019s Bulletin.\nGet the cure at http://bit.ly/CompetifyPB **SUBSCRIBE to the Playbook family: POLITICO Playbook: http://politi.co/1M75UbX ... New York Playbook: http://politi.co/1ON8bqW ... Florida Playbook: http://politi.co/1JDm23W ... New Jersey Playbook: http://politi.co/1HLKltF ... Massachusetts Playbook: http://politi.co/1Nhtq5v ... Illinois Playbook: http://politi.co/1N7u5sb ... California Playbook: http://politi.co/1N8zdJU and our heroic friends at POLITICO Brussels Playbook: http://politi.co/1FZeLcw** A message from BP: Safety is never being satisfied \u2013 and always working to be better.\nMr. Dayspring will oversee the entire communications portfolio and operation at Politico: promotion, booking, publicity and, yes, defending the brand against attacks.\nI didn\u2019t do it to sink the Republicans, though as an aspiring Democratic politico, I wasn\u2019t sorry to see it happen.\nThe attack ... will play out over the next two months on radio, TV, mail and online in New Hampshire."}