{"article_title": "Obama calls Germany's Merkel to talk Syrian refugee crisis", "article_keywords": ["germanys", "plans", "calls", "house", "merkel", "crisis", "summit", "meeting", "white", "slated", "syrian", "refugee", "talk", "obama"], "article_url": "http://newbostonpost.com/2016/01/22/obama-calls-germanys-merkel-to-talk-syrian-refugee-crisis/", "article_text": "Obama calls Germany\u2019s Merkel to talk Syrian refugee crisis\n\nPrinted from: http://newbostonpost.com/2016/01/22/obama-calls-germanys-merkel-to-talk-syrian-refugee-crisis/\n\nGerman Chancellor Angela Merkel puts down her handbag under her table at the beginning of a board meeting of her Christian Democratic Union party, CDU, at the party's headquarters in Berlin, Germany, Monday, Aug. 17, 2015. (AP Photo/Gero Breloer)\n\nWASHINGTON (AP) \u2014 President Barack Obama is trying to round up support for his plans to host a high-level summit on refugees at the United Nations later this year.\n\nThe White House says Obama discussed his plans Thursday in a phone call with German Chancellor Angela Merkel.\n\nThe summit is slated to be held during the September meeting of the U.N. General Assembly.\n\nThe White House says Obama praised Merkel\u2019s leadership on the Syrian refugee crisis and discussed plans to ask more countries to step up their contributions.\n\nThe leaders will raise the issue at a donors conference slated for February 4 in London.\n\nObama also expressed his condolences for the January terrorist attack in Istanbul. Ten Germans were killed when a suicide bomber set off the explosion near a group of tourists.\n\nCopyright 2016 The Associated Press. All rights reserved. This material may not be published, broadcast, rewritten or redistributed.\n\nPlease enable JavaScript to view the comments powered by Disqus.", "article_metadata": {"shareaholic": {"site_name": "NewBostonPost", "language": "en-US", "url": "http://newbostonpost.com/2016/01/22/obama-calls-germanys-merkel-to-talk-syrian-refugee-crisis/", "article_author_name": "Associated Press", "image": "http://newbostonpost.com/wp-content/uploads/2015/08/Germany-Merkel_Jank-e1455211135201.jpg", "site_id": "ab905d8abdbd23a369259b08e0927728", "shareable_page": "true", "keywords": "Angela Merkel, crisis, Germany, immigrants, migrant, obama, refugee, summit, Syria, United Nations"}, "description": "President Barack Obama is trying to round up support for his plans to host a high-level summit on refugees at the United Nations later this year.", "generator": "WordPress 4.5.2", "og": {"image": "http://newbostonpost.com/wp-content/uploads/2015/08/Germany-Merkel_Jank-e1455211135201.jpg"}, "keywords": "angela merkel,germany,obama,syria,refugee,crisis,migrant,immigrants,united nations,summit", "viewport": "width=device-width, initial-scale=1.0"}, "article_summary": "The White House says Obama praised Merkel\u2019s leadership on the Syrian refugee crisis and discussed plans to ask more countries to step up their contributions.\nThe White House says Obama discussed his plans Thursday in a phone call with German Chancellor Angela Merkel.\nObama calls Germany\u2019s Merkel to talk Syrian refugee crisisPrinted from: http://newbostonpost.com/2016/01/22/obama-calls-germanys-merkel-to-talk-syrian-refugee-crisis/German Chancellor Angela Merkel puts down her handbag under her table at the beginning of a board meeting of her Christian Democratic Union party, CDU, at the party's headquarters in Berlin, Germany, Monday, Aug. 17, 2015.\nThe summit is slated to be held during the September meeting of the U.N. General Assembly.\n(AP Photo/Gero Breloer)WASHINGTON (AP) \u2014 President Barack Obama is trying to round up support for his plans to host a high-level summit on refugees at the United Nations later this year."}