{"article_title": "Z Capital Shows Buyers Crave Restaurant Deals with Pink Taco Investment", "article_keywords": ["pink", "real", "buyers", "restaurant", "capital", "tacos", "deals", "crave", "vegas", "las", "taco", "turtle", "z", "investment", "shows"], "article_url": "http://www.themiddlemarket.com/news/consumer_goods_retail/z-capital-shows-buyers-crave-restaurant-deals-with-pink-taco-investment-260318-1.html", "article_text": "Z Capital Shows Buyers Crave Restaurant Deals with Pink Taco Investment\n\nBarteca Holdings and Greene Turtle have also received PE Interest\n\nPrivate equity firm Z Capital Partners LLC has agreed to buy the Pink Taco restaurant brand for an undisclosed amount.\n\nPink Taco was started in the Hard Rock Hotel Las Vegas in 1999 by Harry Morton. The target is known for its tacos and tequila. Morton will remain with the company leading marketing efforts including future restaurant designs and locations and launching Pink Taco\u2019s packaged food and beverage product line. In addition to Las Vegas, Pink Taco has another location on the sunset strip in Los Angeles. The Las Vegas restaurant will continue to be owned and operated by the Hard Rock after the transaction closes.\n\n\u201cWe believe there is tremendous potential to elevate the brand and expand its unique restaurant experience both domestically and internationally,\u201d says Z Capital CEO James Zenni. The PE firm is also invested in Real Mex Restaurants and is planning on using marketing and operational resources from Real Mex to help expand Pink Taco. Z Capital became Real Mex\u2019s largest shareholder in 2013.\n\nPE firms have been going after regional restaurant chains that have growth potential. In 2015, General Atlantic said it will make a minority growth investment in fast casual chain operator Barteca Holdings and Stone-Goff Partners is buying sports bar chain Greene Turtle Sports Bar & Grille.\n\nFor more information on related topics, visit the following:", "article_metadata": {"status": "open", "domain": "Mergers & Acquisitions", "sailthru.author": "Demitri Diakantonis", "sailthru.expire_date": "2016-05-11 12:03:00", "og": {"url": "http://www.themiddlemarket.com/news/consumer_goods_retail/z-capital-shows-buyers-crave-restaurant-deals-with-pink-taco-investment-260318-1.html", "image": "http://cdn.themiddlemarket.com/media/newspics/pinktaco.jpeg", "site_name": "Mergers & Acquisitions, Latest News", "title": "Z Capital Shows Buyers Crave Restaurant Deals with Pink Taco Investment"}, "type": "Article", "brand": "Mergers & Acquisitions, Latest News", "sailthru.date": "2016-04-11 12:03:00", "wordcount": 212, "sailthru.title": "Z Capital Shows Buyers Crave Restaurant Deals with Pink Taco Investment", "featured": 0, "sailthru.tags": "News, Food & Beverage, Private Equity, Consumer Goods/Retail, Consumer Goods/Retail, Barteca Holdings and Greene Turtle have also received PE Interest, private equity, restaurants, consumer, M&A, food and beverage, Greene Turtle, Barteca Holdings, Hard Rock, General Atlantic, Article", "sailthru.description": "Barteca Holdings and Greene Turtle have also received PE Interest", "sailthru.image.full": "http://cdn.themiddlemarket.com/media/newspics/pinktaco.jpeg"}, "article_summary": "Z Capital Shows Buyers Crave Restaurant Deals with Pink Taco InvestmentBarteca Holdings and Greene Turtle have also received PE InterestPrivate equity firm Z Capital Partners LLC has agreed to buy the Pink Taco restaurant brand for an undisclosed amount.\nIn addition to Las Vegas, Pink Taco has another location on the sunset strip in Los Angeles.\nThe Las Vegas restaurant will continue to be owned and operated by the Hard Rock after the transaction closes.\nPink Taco was started in the Hard Rock Hotel Las Vegas in 1999 by Harry Morton.\n\u201cWe believe there is tremendous potential to elevate the brand and expand its unique restaurant experience both domestically and internationally,\u201d says Z Capital CEO James Zenni."}