{"article_title": "Administration Offers A Stopgap Health Insurance Option", "article_keywords": ["stopgap", "option", "record", "previously", "administration", "canceled", "offers", "health", "policies", "uninsured", "instead", "npr", "insurance", "longer"], "article_url": "http://www.npr.org/2013/12/20/255699210/business-news", "article_text": "Administration Offers A Stopgap Health Insurance Option\n\nMillions of Americans facing canceled health insurance policies under the Affordable Care Act will no longer be fined for being uninsured in the new year. Instead, they can enroll in basic coverage \u2014 previously available only to those with a hardship exemption.\n\nDAVID GREENE, HOST:\n\nNPR's business news starts with more changes to Obamacare.\n\n(SOUNDBITE OF MUSIC)\n\nGREENE: Millions of Americans facing canceled health insurance policies under the Affordable Care Act will no longer be fined for being uninsured in the new year. Instead, they can now enroll in basic coverage, previously available only to those with a hardship exemption.\n\nThe administration hopes this will make for a smoother transition to new policies for those whose insurance was canceled under Obamacare. But insurers say this move will just cause further confusion.\n\nCopyright \u00a9 2013 NPR. All rights reserved. Visit our website terms of use and permissions pages at www.npr.org for further information.\n\nNPR transcripts are created on a rush deadline by Verb8tm, Inc., an NPR contractor, and produced using a proprietary transcription process developed with NPR. This text may not be in its final form and may be updated or revised in the future. Accuracy and availability may vary. The authoritative record of NPR\u2019s programming is the audio record.", "article_metadata": {"Rating": "General", "medium": "audio", "description": "Millions of Americans facing canceled health insurance policies under the Affordable Care Act will no longer be fined for being uninsured in the new year. Instead, they can enroll in basic coverage \u2014 previously available only to those with a hardship exemption.", "og": {"site_name": "NPR.org", "description": "Millions of Americans facing canceled health insurance policies under the Affordable Care Act will no longer be fined for being uninsured in the new year. Instead, they can enroll in basic coverage \u2014 previously available only to those with a hardship exemption.", "title": "Administration Offers A Stopgap Health Insurance Option", "url": "http://www.npr.org/2013/12/20/255699210/business-news", "image": "https://media.npr.org/include/images/facebook-default.jpg?s=1400", "type": "article"}, "twitter": {"domain": "npr.org", "site": "@NPR", "card": "summary"}, "robots": "noarchive,index,follow", "fb": {"app_id": 138837436154588, "pages": 10643211755}, "date": "2013-12-20", "viewport": "width=device-width, initial-scale=1, minimum-scale=1, maximum-scale=1, user-scalable=no, shrink-to-fit=no"}, "article_summary": "Administration Offers A Stopgap Health Insurance OptionMillions of Americans facing canceled health insurance policies under the Affordable Care Act will no longer be fined for being uninsured in the new year.\n(SOUNDBITE OF MUSIC)GREENE: Millions of Americans facing canceled health insurance policies under the Affordable Care Act will no longer be fined for being uninsured in the new year.\nThe administration hopes this will make for a smoother transition to new policies for those whose insurance was canceled under Obamacare.\nInstead, they can enroll in basic coverage \u2014 previously available only to those with a hardship exemption.\nInstead, they can now enroll in basic coverage, previously available only to those with a hardship exemption."}