{"article_title": "United Health Services' Acute Care Revenue Increases in 1Q15", "article_keywords": ["acute", "adjusted", "united", "revenue", "universal", "admissions", "increases", "health", "services", "1q15", "segment", "care"], "article_url": "http://marketrealist.com/2015/04/united-health-services-acute-care-revenue-increases-1q15/", "article_text": "Universal Health Services Posts Strong 1Q15 Results PART 2 OF 5\n\nUnited Health Services\u2019 Acute Care Revenue Increases in 1Q15\n\nUniversal Health Services\u2019 performance\n\nIn 1Q15, Universal Health Services\u2019 (UHS) acute care segment delivered an EBITDA (earnings before interest, tax, depreciation, and amortization) margin of 21.6%\u2014a 140 basis point YoY (year-over-year) improvement.\n\nUniversal Health Services\u2019 acute care segment registered 18% growth in total revenue\u2014from $971 million in 1Q14 to $1,146 million in 1Q15. In the same timeframe, the segment\u2019s same-store revenue increased by 12.2% YoY. This was in excess of the 7%\u20138% revenue growth for the acute care segment, projected in the company\u2019s 2015 guidance. Same-store indicators assume that Universal Health Services operated the same group of acute care hospitals in 1Q14 and 1Q15. As a result, these indicators exclude the impact of acquisitions on the overall performance.\n\nEnrollment growth\n\nUniversal Health Services\u2019 acute care segment witnessed a 5.7 % YoY rise in adjusted admissions in 1Q15. Adjusted admissions is a metric that\u2019s used to calculate the total inpatient and outpatient admissions in a hospital. The number of patient days per adjusted admission also increased by 7.5% in 1Q15\u2014compared to 1Q14. The company also registered a 6.1% increase in revenue per adjusted admission, mainly due to an improvement in the company\u2019s inpatient surgical growth in 1Q15.\n\nOther companies in the for-profit hospital industry (XLV) like HCA Holdings (HCA), Community Health Systems (CYH), and LifePoint Hospitals (LPNT) are also expected to register high acute care admissions in 1Q15. This trend is mainly the result of an overall increase in the percentage of the insured population due to the implementation of the provisions in the Affordable Care Act.\n\nIn 2015, Universal Health Services attributed about a 35%\u201340% improvement in acute care performance to the impact of the Affordable Care Act, 35%\u201340% to economic improvement in markets, and 15%\u201320% to the company\u2019s market share improvements in individual markets.", "article_metadata": {"cXenseParse": {"mre-primary-ticker": "cyh", "mre-content-type": "Post-Release Earnings Reports", "mre-author": "Manali Pradhan", "mre-industry": "Hospitals", "mre-value-driver": "Earnings Overview", "mre-page-type": "post", "mre-section": "Sector Analysis", "mre-sector": "Healthcare", "mre-secondary-ticker": "xlv"}, "viewport": "width=device-width, initial-scale=1.0, maximum-scale=1.0, user-scalable=no", "generator": "WordPress 4.3.1", "description": "In 1Q15, Universal Health Services\u2019 (UHS) acute care segment delivered an EBITDA margin of 21.6%\u2014a 140 basis point YoY improvement."}, "article_summary": "Universal Health Services Posts Strong 1Q15 Results PART 2 OF 5United Health Services\u2019 Acute Care Revenue Increases in 1Q15Universal Health Services\u2019 performanceIn 1Q15, Universal Health Services\u2019 (UHS) acute care segment delivered an EBITDA (earnings before interest, tax, depreciation, and amortization) margin of 21.6%\u2014a 140 basis point YoY (year-over-year) improvement.\nUniversal Health Services\u2019 acute care segment registered 18% growth in total revenue\u2014from $971 million in 1Q14 to $1,146 million in 1Q15.\nEnrollment growthUniversal Health Services\u2019 acute care segment witnessed a 5.7 % YoY rise in adjusted admissions in 1Q15.\nSame-store indicators assume that Universal Health Services operated the same group of acute care hospitals in 1Q14 and 1Q15.\nThis was in excess of the 7%\u20138% revenue growth for the acute care segment, projected in the company\u2019s 2015 guidance."}