{"article_title": "Large turnout for Democratic Caucus in eastern Idaho", "article_keywords": ["sanders", "eastern", "voters", "number", "county", "large", "hes", "hillary", "points", "let", "caucus", "undecided", "democratic", "turnout", "supporter", "idaho"], "article_url": "http://www.localnews8.com/news/Large-turnout-for-Democratic-Caucus-in-eastern-Idaho/38646682", "article_text": "EASTERN IDAHO (KIFI/KIDK) -\n\nA large crowd at the Sho-Ban Event Center in Fort Hall delayed the start of the Democratic Caucus.\n\nRelated Content Chris Nestman KIFI/KIDK\n\n\n\nPeople were still coming in at 7:30 p.m., even though doors were to be locked at 7:00. There were so many people, Bannock County Democrats decided to let people who just wanted to submit a vote to do it early.\n\nBernie Sanders supporters definitely dominated the room, taking up their own half.\n\nThere's been a number of shouting matches between Sanders camp and Hillary Clinton\u2019s camp.\n\nSome first time caucus goers said they felt the passion from this year\u2019s campaign.\n\nJared Adams, a Sanders supporter, said, \"He's been on the right side of history so far from the, the civil rights movement on up. He's the first person I can support to actually bother to take part.\"\n\nJim Moffit, a Clinton supporter, said, \"I believe in Hillary, I believed in Hillary eight years ago. I still think a woman should be given the opportunity to try.\u201d\n\nIn Bonneville County, it was also busy at Skyline High School.\n\nThose supporting Bernie Sanders had a majority of voters, but there was also a decent number of undecided voters who still aren't sure who they want.\n\nKade Marquez, an undecided voter, said \u201cI'm just really trying to learn what are the points, the pro Hillary side has, what are the points the pro-Berny side has and I was going to make my decision out of those.\u201d\n\nThe voting results are still getting tallied, we'll let you know as soon as we have them.", "article_metadata": {"ib-analytics": "data", "description": "A large crowd at the Sho-Ban Event Center in Fort Hall delayed the start of the Democratic Caucus.", "generator": "ibPublish 2", "author": "KIFI", "og": {"site_name": "KIFI", "description": "A large crowd at the Sho-Ban Event Center in Fort Hall delayed the start of the Democratic Caucus.", "title": "Large turnout for Democratic Caucus in eastern Idaho", "url": "http://www.localnews8.com/news/Large-turnout-for-Democratic-Caucus-in-eastern-Idaho/38646682", "image": "http://www.localnews8.com/image/view/-/38648134/highRes/2/-/maxh/640/maxw/640/-/11kwutp/-/CeMdvDtVIAIKakkleelsllw3322-jpg.jpg", "type": "article"}, "twitter": {"url": "http://www.localnews8.com/news/Large-turnout-for-Democratic-Caucus-in-eastern-Idaho/38646682", "card": "summary"}, "fb": {"app_id": 486049978226029}, "keywords": "Caucus", "google-site-verification": "1pj8-zRQkOy-zDa53tgVhVsQrwaVnUCGPDzveCSw9t0", "news_keywords": "Caucus"}, "article_summary": "EASTERN IDAHO (KIFI/KIDK) -A large crowd at the Sho-Ban Event Center in Fort Hall delayed the start of the Democratic Caucus.\nJared Adams, a Sanders supporter, said, \"He's been on the right side of history so far from the, the civil rights movement on up.\nThose supporting Bernie Sanders had a majority of voters, but there was also a decent number of undecided voters who still aren't sure who they want.\nRelated Content Chris Nestman KIFI/KIDKPeople were still coming in at 7:30 p.m., even though doors were to be locked at 7:00.\nJim Moffit, a Clinton supporter, said, \"I believe in Hillary, I believed in Hillary eight years ago."}