{"article_title": "5 lawyers from well-known Calif. firm form new boutique", "article_keywords": ["firm", "lawyers", "business", "form", "wellknown", "boutique", "practice", "leavitt", "kennaday", "sacramento", "law", "calif", "care"], "article_url": "http://www.abajournal.com/news/article/5_lawyers_from_well_known_calif._firm_form_new_health_care_boutique/", "article_text": "Home Daily News 5 lawyers from well-known Calif. firm form\u2026\n\nBusiness of Law\n\n5 lawyers from well-known Calif. firm form new boutique\n\nFive lawyers have left a well-known Sacramento, Calif., law firm to establish a new legal shop focusing on health care and employment matters.\n\nExiting Wilke, Fleury, Hoffelt, Gould & Birney for the new Kennaday, Leavitt & Daponde are name partners Kelli Kennaday, Curtis Leavitt and Michael Daponde and two additional lawyers who are on the partner roster at the new firm, Kelly Ryan and Troy Szabo. Another lawyer, Eunice Majam-Simpson, left Nossaman to join Kennaday, Leavitt as senior counsel and Nicole Moore, a recent law graduate, is a Kennaday Leavitt associate, according to the Sacramento Bee and the Sacramento Business Journal.\n\nKennaday, who chaired the labor and employment practice at her now-former firm, says major changes in the Affordable Care Act, as well as perennially changing California law made this a good time for the group to go out on its own and expect to be busy.\n\n\u201cThe ACA is a lifetime employment act for health care attorneys,\u201d Curtis Leavitt told the Business Journal. \u201cIf we are ever to do our own thing, the time is now.\u201d\n\nHe said the founding partners took out \u201cpersonal loans that would make most people queasy\u201d to get the firm up and running, but were able to cut some costs by using technology instead of people. For example, Kennaday Leavitt has no live receptionist; clients use a computer touch screen to alert lawyers of their presence, explains another Sacramento Business Journal article.\n\nManaging partner Ron Lamb of Wilke Fleury told the Sacramento Bee that his 25-attorney general business firm still has \u201ca health care practice that\u2019s unrivaled for depth and breadth in the region.\u201d It is also noted for its bankruptcy, insurance and real estate practice groups.", "article_metadata": {"rating": "General", "dcterms.description": "Five lawyers have left a well-known Sacramento, Calif., law firm to establish a new legal shop focusing on health care and employment matters.Exiting &lt;a href=&quot;http://www.wilkefleury.com/&quot; title=&quot;Wilke, Fleury&quot;&gt;Wilke, Fleury&lt;/a&gt;, Hoffelt, Gould", "description": "Five lawyers have left a well-known Sacramento, Calif., law firm to establish a new legal shop focusing on health care and employment matters.Exiting &lt;a href=&quot;http://www.wilkefleury.com/&quot; title=&quot;Wilke, Fleury&quot;&gt;Wilke, Fleury&lt;/a&gt;, Hoffelt, Gould", "application-name": "ABA Journal", "author": "Martha Neil", "og": {"site_name": "ABA Journal", "description": "Five lawyers have left a well-known Sacramento, Calif., law firm to establish a new legal shop focusing on health care and employment matters.Exiting &lt;a href=&quot;http://www.wilkefleury.com/&quot; title=&quot;Wilke, Fleury&quot;&gt;Wilke, Fleury&lt;/a&gt;, Hoffelt, Gould", "title": "5 lawyers from well-known Calif. firm form new boutique", "url": "http://www.abajournal.com/news/article/5_lawyers_from_well_known_calif._firm_form_new_health_care_boutique/", "image": "http://www.abajournal.com/images/topic_images/law_firms.jpg", "type": "article"}, "dcterms.rights": "\u00a9 2004-2016", "twitter": {"description": "Five lawyers have left a well-known Sacramento, Calif., law firm to establish a new legal shop focusing on health care and employment matters.Exiting &lt;a href=&quot;http://www.wilkefleury.com/&quot; title=&quot;Wilke, Fleury&quot;&gt;Wilke, Fleury&lt;/a&gt;, Hoffelt, Gould", "title": "5 lawyers from well-known Calif. firm form new boutique"}, "robots": "All", "dcterms.creator": "ABA Journal", "keywords": "ABA Journal, legal news, law, States, Labor & Employment, Law Firms, Health Law, Law Practice Management, California, Careers, Partners, Associates, Business of Law, Midsize Firm", "dcterms.contributor": "Martha Neil", "dcterms.title": "5 lawyers from well-known Calif. firm form new boutique"}, "article_summary": "Home Daily News 5 lawyers from well-known Calif. firm form\u2026Business of Law5 lawyers from well-known Calif. firm form new boutiqueFive lawyers have left a well-known Sacramento, Calif., law firm to establish a new legal shop focusing on health care and employment matters.\nFor example, Kennaday Leavitt has no live receptionist; clients use a computer touch screen to alert lawyers of their presence, explains another Sacramento Business Journal article.\nAnother lawyer, Eunice Majam-Simpson, left Nossaman to join Kennaday, Leavitt as senior counsel and Nicole Moore, a recent law graduate, is a Kennaday Leavitt associate, according to the Sacramento Bee and the Sacramento Business Journal.\n\u201cThe ACA is a lifetime employment act for health care attorneys,\u201d Curtis Leavitt told the Business Journal.\nExiting Wilke, Fleury, Hoffelt, Gould & Birney for the new Kennaday, Leavitt & Daponde are name partners Kelli Kennaday, Curtis Leavitt and Michael Daponde and two additional lawyers who are on the partner roster at the new firm, Kelly Ryan and Troy Szabo."}