{"article_title": "Cryptosoft Adds to Technology M&A Wave with DeviceAuthority", "article_keywords": ["supercom", "ma", "cybersecurity", "data", "company", "iot", "solution", "deviceauthority", "wave", "authentication", "cryptosoft", "adds", "security", "technology", "software"], "article_url": "http://www.themiddlemarket.com/news/tech_telecom/cryptosoft-adds-to-technology-m-260400-1.html", "article_text": "Cryptosoft Adds to Technology M&A Wave with DeviceAuthority\n\nRecent deals in cybersecurity include purchases by SuperCom, FireEye and Thycotic\n\nData security company Cryptosoft has acquired DeviceAuthority Inc, a provider of authentication technology. This transaction follows the October 2015 strategic partnership formed between the two entities, which expanded Cryptosoft\u2019s Internet of Things (IoT) data security offering to clients.\n\nFreemont, California-based DeviceAuthority\u2019s D-Factor authentication engine identifies devices to establish trust between endpoints, gateways and applications. London-based Cyrpotsoft\u2019s platform tackles the data security and authentication challenges for the IoT to protect sensitive company and customer data assets. This combination positions the company as an advanced policy-based security platform that can provide a scalable device authentication solution to manage hundreds of thousands of client devices, and policy driven data centric encryption technology.\n\n\u201cBoth companies coming together further advances our strategy of providing customers with the most reliable, cost-effective IoT security solution, through a comprehensive portfolio of products\u201d, says Darron Antill, CEO of Cryptosoft.\n\nMiddle-market M&A activity has seen healthy input from deals in the technology sector, particularly cybersecurity. In March, SuperCom (Nasdaq: SPCB), which sells secure-ID and secure payment solutions acquired encryption and data theft protection software company Safend Ltd. Also completed this year were cybersecurity firm FireEye Inc.\u2019 (Nasdaq: FEYE) acquisition of competitor iSight Partners and cybersecurity provider Thycotic purchase of Windows protection software company Arellia.\n\nFor more information on related topics, visit the following:", "article_metadata": {"status": "open", "domain": "Mergers & Acquisitions", "sailthru.author": "Jakema Lewis", "sailthru.expire_date": "2016-05-21 14:01:00", "og": {"url": "http://www.themiddlemarket.com/news/tech_telecom/cryptosoft-adds-to-technology-m-260400-1.html", "image": "http://cdn.themiddlemarket.com/media/newspics/cybersecurity.jpeg", "site_name": "Mergers & Acquisitions, Latest News", "title": "Cryptosoft Adds to Technology M&A Wave with DeviceAuthority"}, "type": "Article", "brand": "Mergers & Acquisitions, Latest News", "sailthru.date": "2016-04-21 14:01:00", "wordcount": 207, "sailthru.title": "Cryptosoft Adds to Technology M&A Wave with DeviceAuthority", "featured": 1, "sailthru.tags": "News, Tech, Media & Telecom, Tech, Media & Telecom, Cryptosoft Adds to Technology M&A Wave with DeviceAuthority, cybersecurity, SuperCom, Safend Ltd., FireEye Inc., iSight Partners, Thycotic, Arellia., Article", "sailthru.description": "Recent deals in cybersecurity include purchases by SuperCom, FireEye and Thycotic", "sailthru.image.full": "http://cdn.themiddlemarket.com/media/newspics/cybersecurity.jpeg"}, "article_summary": "Cryptosoft Adds to Technology M&A Wave with DeviceAuthorityRecent deals in cybersecurity include purchases by SuperCom, FireEye and ThycoticData security company Cryptosoft has acquired DeviceAuthority Inc, a provider of authentication technology.\nThis transaction follows the October 2015 strategic partnership formed between the two entities, which expanded Cryptosoft\u2019s Internet of Things (IoT) data security offering to clients.\n\u201cBoth companies coming together further advances our strategy of providing customers with the most reliable, cost-effective IoT security solution, through a comprehensive portfolio of products\u201d, says Darron Antill, CEO of Cryptosoft.\nLondon-based Cyrpotsoft\u2019s platform tackles the data security and authentication challenges for the IoT to protect sensitive company and customer data assets.\nMiddle-market M&A activity has seen healthy input from deals in the technology sector, particularly cybersecurity."}