{"article_title": "Announcing Our Exclusive Healthcare Summit Feb. 21: Request an Invite", "article_keywords": ["leaders", "exclusive", "feb", "invite", "announcing", "startup", "medical", "request", "summit", "health", "healthcare", "medicine", "care", "texas", "21"], "article_url": "http://www.xconomy.com/texas/2014/01/16/announcing-our-exclusive-healthcare-summit-feb-21-request-an-invite/", "article_text": "Announcing Our Exclusive Healthcare Summit Feb. 21: Request an Invite\n\nXconomy Texas \u2014\n\nAdvances in genomics, mobile technology, and data collection and analysis are poised to transform healthcare from drug development to patient care and hospital management. But what will it take to realize their promise in the age of the Affordable Care Act, and what does this require of payers, providers, and patients? How can we utilize new innovations to hold the line on medical costs while also improving care and promoting health rather than just treating illness?\n\nOur \u201cFrom Precision Medicine to Precision Management\u201d Healthcare Summit\u2014held in partnership with BioHouston following its annual meeting\u2014will take place the morning of Friday, February 21, 2014, at Rice University\u2019s BioScience Research Collaborative in Houston.\n\nThis invitation-only gathering will convene around 75 leaders in healthcare, personalized medicine and genomics, health IT, big data, venture capital, and more as we consider the future of medicine and health and look for entrepreneurial solutions to the challenges facing our healthcare system.\n\nWe are bringing together leaders from renowned Texas institutions\u2014including Robert Robbins, CEO of the Texas Medical Center, and MD Anderson chief Ronald DePinho\u2014as well as entrepreneurs and investors from outside the state who are pushing the kind of innovation that will reinvent the way healthcare is funded and delivered. Among them: Kevin Kinsella, founder at Avalon Ventures, Michael Greeley, partner at Foundation Medical Partners, aTyr Pharma\u2019s John Mendlein, Pokitdok founder Lisa Maki, and healthcare leaders from General Electric and Xerox.\n\nEarly-bird registration, which ends January 23, is $395. But this is an invitation-only event, so please apply for one by emailing a request to hcsummit14@xconomy.com. (The registration fee goes up to $495 after the 23rd.) We also have a limited number of startup tickets at $295 for companies that are less than three years old, with 20 or fewer employees. Please email hcsummit14@xconomy.com to qualify for the startup rate.\n\nAs always, we are convening an elite group of healthcare leaders, entrepreneurs, and investors from Texas and beyond for a morning of networking and discussion.\n\nTo register for the event\u2014and for more information, including the full list of speakers to date\u2014please visit our Healthcare Summit event page.\n\nWe look forward to seeing you next month.", "article_metadata": {"og": {"site_name": "Xconomy", "description": "Advances in genomics, mobile technology, and data collection and analysis are poised to transform healthcare from drug development to patient care and hosp", "title": "Announcing Our Exclusive Healthcare Summit Feb. 21: Request an Invite | Xconomy", "locale": "en_US", "image": "http://www.xconomy.com/wordpress/wp-content/images/2014/01/houston_healthcare_WP.gif", "url": "http://www.xconomy.com/texas/2014/01/16/announcing-our-exclusive-healthcare-summit-feb-21-request-an-invite/", "type": "article"}, "google-site-verification": "kB8sd1DYBBxgDN18IeVmM224YUBB03iZS3Z3kL6qXBw", "twitter": {"domain": "Xconomy", "description": "Advances in genomics, mobile technology, and data collection and analysis are poised to transform healthcare from drug development to patient care and hosp", "title": "Announcing Our Exclusive Healthcare Summit Feb. 21: Request an Invite | Xconomy", "image": {"src": "http://www.xconomy.com/wordpress/wp-content/images/2014/01/houston_healthcare_WP.gif"}, "creator": "@angelashah", "site": "@xconomy", "card": "summary"}, "description": "Advances in genomics, mobile technology, and data collection and analysis are poised to transform healthcare from drug development to patient care and hosp", "article": {"section": "National blog main", "tag": "Xerox", "published_time": "2014-01-16T09:45:45+00:00"}}, "article_summary": "Announcing Our Exclusive Healthcare Summit Feb. 21: Request an InviteXconomy Texas \u2014Advances in genomics, mobile technology, and data collection and analysis are poised to transform healthcare from drug development to patient care and hospital management.\nTo register for the event\u2014and for more information, including the full list of speakers to date\u2014please visit our Healthcare Summit event page.\nAs always, we are convening an elite group of healthcare leaders, entrepreneurs, and investors from Texas and beyond for a morning of networking and discussion.\nAmong them: Kevin Kinsella, founder at Avalon Ventures, Michael Greeley, partner at Foundation Medical Partners, aTyr Pharma\u2019s John Mendlein, Pokitdok founder Lisa Maki, and healthcare leaders from General Electric and Xerox.\nHow can we utilize new innovations to hold the line on medical costs while also improving care and promoting health rather than just treating illness?"}