{"article_title": "Coburn loses cancer doc due to ACA", "article_keywords": ["pocket", "aca", "politico", "cancer", "doc", "obamacare", "great", "loses", "spokesman", "health", "pay", "prostate", "coburn"], "article_url": "http://www.politico.com/story/2014/01/obamacare-tom-coburn-cancer-doctor-102724", "article_text": "In November, Coburn said he had been diagnosed with a recurrence of prostate cancer. Coburn loses cancer doc due to ACA\n\nCancer-stricken Sen. Tom Coburn revealed Tuesday that his health insurance under Obamacare doesn\u2019t cover his oncologist, but said he still is receiving excellent care.\n\n\u201cI\u2019m doing well from a health standpoint, got great docs,\u201d Coburn said on MSNBC\u2019s \u201cMorning Joe\u201d on Tuesday when asked about his health. \u201cFortunately \u2014 even though my new coverage won\u2019t cover my specialist \u2014 I\u2019m going to have great care, and I have a great prognosis.\u201d\n\nStory Continued Below\n\nThe Oklahoma Republican\u2019s spokesman confirmed to POLITICO that since the senator enrolled in his health insurance plan under Obamacare, his coverage has been reduced and he lost coverage for his cancer specialist. Coburn will continue to pay out of pocket and see his oncologist, his office said.\n\n( Also on POLITICO: Keating won't seek Coburn's seat)\n\nCoburn made public in November that he had been diagnosed with a recurrence of prostate cancer. He also had prostate cancer surgery in 2011 and has survived colon cancer and melanoma. He also announced earlier this month he would not serve out his full Senate term, but said his decision was not made because of his health.\n\nThe Oklahoma Republican and physician has been a critic of Obamacare, unveiling on Monday a plan with two other senators to repeal and replace the Affordable Care Act.\n\n( Also on POLITICO: Coburn fights cancer again)\n\nHis spokesman said Coburn\u2019s struggles with his own doctor illustrate the need for a new policy, saying that not every American has the option to pay out of pocket for care.\n\n\u201cWe hope the White House will work with us to make sure Americans who can\u2019t afford to pay out of pocket don\u2019t lose access to life-saving care,\u201d spokesman John Hart said. \u201cAs Dr. Coburn\u2019s experience shows, the American people are about to learn they\u2019re going to lose access to not only their doctors and plans, but their specialists and treatments.\u201d\n\nFollow @politico", "article_metadata": {"og": {"site_name": "POLITICO", "description": "The Oklahoma senator says his health insurance under Obamacare doesn\u2019t cover his oncologist.", "title": "Coburn loses cancer doc due to ACA", "url": "http://www.politico.com/story/2014/01/obamacare-tom-coburn-cancer-doctor-102724.html", "image": "http://s3-origin-images.politico.com/news/101201_tom_coburn_ap_328.jpg", "fb_appid": 114037015331397, "type": "article"}, "keywords": "Obamacare,Tom Coburn,Health Insurance", "twitter": {"site": "@politico", "card": "summary_large_image", "creator": "@politico"}, "description": "The Oklahoma senator says his health insurance under Obamacare doesn\u2019t cover his oncologist.", "viewport": "width=device-width, initial-scale=1"}, "article_summary": "Coburn loses cancer doc due to ACACancer-stricken Sen. Tom Coburn revealed Tuesday that his health insurance under Obamacare doesn\u2019t cover his oncologist, but said he still is receiving excellent care.\nHe also had prostate cancer surgery in 2011 and has survived colon cancer and melanoma.\nIn November, Coburn said he had been diagnosed with a recurrence of prostate cancer.\n( Also on POLITICO: Keating won't seek Coburn's seat)Coburn made public in November that he had been diagnosed with a recurrence of prostate cancer.\n\u201cI\u2019m doing well from a health standpoint, got great docs,\u201d Coburn said on MSNBC\u2019s \u201cMorning Joe\u201d on Tuesday when asked about his health."}