{"article_title": "10 Surprising Tax Deductions in 2015", "article_keywords": ["knows", "surprising", "medical", "tax", "deducted", "taxes", "expenses", "deductions", "income", "2015", "qualify"], "article_url": "http://www.thefiscaltimes.com/2015/02/02/10-Surprising-Tax-Deductions-2015", "article_text": "Every homeowner knows about deducting mortgage interest payments from their income taxes, just as every freelance worker knows that certain business-related expenses can be deducted from their income, assuming they qualify.\n\nBut many taxpayers may not realize that dozens of other personal expenses can be claimed on their taxes \u2013 everything from pet moving expenses to whale hunting.\n\nRelated: 10 Surprising Tax Deductions in 2015\n\nWhile you may not qualify for many of them \u2013 you just never know. If you recently had a baby, for example, you and your spouse probably took at least one pregnancy test, enrolled in a series of childbirth classes and invested in a breast pump and other birthing-related materials. These qualify as medical expenses \u2013 and medical expenses can be deducted from your taxable income if they amount to more than 10 percent of your adjusted gross income, assuming you itemize deductions. (Check with tax professionals.)\n\nSeniors over 65 could also deduct dental expenses if they exceed 7.5 percent of AGI. Adapters to TV sets and telephones for the hearing impaired; artificial limbs; crutches; chiropractor services \u2013 a lot of this can also be deducted.\n\nThere are limits, however. Reimbursed medical expenses from your insurance provider or from a health savings account don\u2019t qualify as a deduction. As always, you\u2019ll need proof that your doctor required that fancy electronic wheelchair for your temporary back pain.\n\nClick here to see 10 Surprising Tax Deductions in 2015\n\nTop Reads from The Fiscal Times:", "article_metadata": {"og": {"site_name": "The Fiscal Times", "description": "Every homeowner knows about deducting mortgage interest payments from their income tax", "title": "10 Surprising Tax Deductions in 2015", "url": "http://www.thefiscaltimes.com/2015/02/02/10-Surprising-Tax-Deductions-2015", "image": "http://cdn.thefiscaltimes.com/sites/default/files/06042014_Offshore_Tax_Loophole.jpg", "type": "article"}, "twitter": {"url": "http://www.thefiscaltimes.com/2015/02/02/10-Surprising-Tax-Deductions-2015", "image": "http://cdn.thefiscaltimes.com/sites/default/files/06042014_Offshore_Tax_Loophole.jpg", "card": "summary", "title": "The Fiscal Times"}, "viewport": "initial-scale=1, maximum-scale=1", "description": "Every homeowner knows about deducting mortgage interest payments from their income tax", "generator": "Drupal 7 (http://drupal.org)"}, "article_summary": "Click here to see 10 Surprising Tax Deductions in 2015Top Reads from The Fiscal Times:\nRelated: 10 Surprising Tax Deductions in 2015While you may not qualify for many of them \u2013 you just never know.\nReimbursed medical expenses from your insurance provider or from a health savings account don\u2019t qualify as a deduction.\nThese qualify as medical expenses \u2013 and medical expenses can be deducted from your taxable income if they amount to more than 10 percent of your adjusted gross income, assuming you itemize deductions.\nEvery homeowner knows about deducting mortgage interest payments from their income taxes, just as every freelance worker knows that certain business-related expenses can be deducted from their income, assuming they qualify."}