{"article_title": "Rubio calls out pope on Cuba", "article_keywords": ["gross", "cuban", "pope", "calls", "cuba", "personal", "rubio", "role", "release", "francis", "obama"], "article_url": "http://www.politico.com/story/2014/12/marco-rubio-cuba-pope-criticism-113645", "article_text": "John Shinkle/POLITICO Rubio calls out pope on Cuba\n\nSen. Marco Rubio, a Catholic, criticized Pope Francis on Wednesday after the pontiff played a key role in helping the United States and Cuba forge an agreement that resulted in the release of American Alan Gross from Cuba.\n\nRubio said he would \u201cask His Holiness to take up the cause of freedom and democracy.\u201d\n\nStory Continued Below\n\nThe Florida Republican said he didn\u2019t criticize Francis\u2019 personal appeals to help facilitate Gross\u2019 release, but was speaking in response to the White House\u2019s announcement about talks to normalize relations with Cuba after a nearly 50-year embargo with the country.\n\nThe pope played a pivotal role through personal appeals to President Barack Obama and Cuban President Raul Castro to help the two countries forge an agreement for the release of Gross, Obama announced on Wednesday.\n\n( Also on POLITICO: Don't expect a Cuban oil bonanza)\n\nRubio is set to play a major role in Cuba policy as the chairman of the Senate Foreign Relations subcommittee on Western Affairs, and he noted Wednesday some of Congress\u2019 leverage points, such as funding for embassies and nomination of a U.S. ambassador to Cuba.\n\n\u201cI\u2019m committed to doing everything I can to unravel as many of these changes as possible,\u201d Rubio said.\n\nObama said on Wednesday that Gross\u2019 release, which came as part of a prisoner swap for convicted Cuban spies held in the U.S., came after a personal appeal from Francis to the Obama administration.", "article_metadata": {"og": {"site_name": "POLITICO", "description": "Rubio said he would \u201cask His Holiness to take up the cause of freedom and democracy.\u201d", "title": "Rubio calls out pope on Cuba", "url": "http://www.politico.com/story/2014/12/marco-rubio-cuba-pope-criticism-113645.html", "image": "http://s3-origin-images.politico.com/2014/12/17/141217_rubio_js_629.jpg", "fb_appid": 114037015331397, "type": "article"}, "keywords": "Cuba,Pope Francis,Marco Rubio", "twitter": {"site": "@politico", "card": "summary_large_image", "creator": "@politico"}, "description": "Rubio said he would \u201cask His Holiness to take up the cause of freedom and democracy.\u201d", "viewport": "width=device-width, initial-scale=1"}, "article_summary": "John Shinkle/POLITICO Rubio calls out pope on CubaSen. Marco Rubio, a Catholic, criticized Pope Francis on Wednesday after the pontiff played a key role in helping the United States and Cuba forge an agreement that resulted in the release of American Alan Gross from Cuba.\n\u201cI\u2019m committed to doing everything I can to unravel as many of these changes as possible,\u201d Rubio said.\nThe pope played a pivotal role through personal appeals to President Barack Obama and Cuban President Raul Castro to help the two countries forge an agreement for the release of Gross, Obama announced on Wednesday.\nObama said on Wednesday that Gross\u2019 release, which came as part of a prisoner swap for convicted Cuban spies held in the U.S., came after a personal appeal from Francis to the Obama administration.\nRubio said he would \u201cask His Holiness to take up the cause of freedom and democracy.\u201dStory Continued BelowThe Florida Republican said he didn\u2019t criticize Francis\u2019 personal appeals to help facilitate Gross\u2019 release, but was speaking in response to the White House\u2019s announcement about talks to normalize relations with Cuba after a nearly 50-year embargo with the country."}