{"article_title": "Dem. Rep.: 'I Think the President Was Grossly Misleading to the American Public'", "article_keywords": ["going", "right", "lot", "rep", "problems", "public", "american", "misleading", "dem", "policies", "president", "think", "grossly", "know"], "article_url": "http://www.weeklystandard.com/dem.-rep.-i-think-the-president-was-grossly-misleading-to-the-american-public/article/766938", "article_text": "\"So I think the president saying you could stay with it and not being honest that a lot of these policies were going to get cancelled was grossly misleading to the American public and is causing added stress and added strife as we go through a really difficult time with health care.\"\n\n\"I think the president was grossly misleading to the American public. I know right away as a veterinarian, I have my own business, that my policies got cancelled even before the Affordable Care Act. I know that I would change policies on a regular basis, trying to find the best deal for myself and my employees. But a lot of Americans, a lot of Oregonians, have stayed with the same policy for a number of years and are shocked that their policy got cancelled.\n\n\"I think next year at the election time, people are going to want to know, was I able to sign up? And what is the shape of the benefit package I'm going to get and how much is it going to cost me, at the end of the day? I think this will, the sign-up period and problems and the horrendous problems that are going on right now will be way in the past.\n\nThe Weekly Standard http://assets.weeklystandard.com.s3.amazonaws.com/tws15/images/logo-large.png\n\nThe Weekly Standard\n\n2013\n\nWashington, DC\n\nPolitics\n\nhttp://www.weeklystandard.com/dem.-rep.-i-think-the-president-was-grossly-misleading-to-the-american-public/article/766938\n\n2013-11-12T09:02\n\n2013-11-12T08:05\n\nDem. Rep.: 'I Think the President Was Grossly Misleading to the American Public'\n\nRep. Kurt Schrader, a Democrat from Oregon, said that President Obama was grossly misleading on Obamacare: Very misleading, the Democratic congressman says of Obama's promise that you can keep your health care plan, if you like it. I think next year at the election time, people are going to want to know, was I able to sign up? And what is the shape of the benefit package I'm going to get and how much is it going to cost me, at the end of the day? I think this will, the sign-up period and problems and the horrendous problems that are going on right now will be way in the past. I think the president was grossly misleading to the American public. I know right away as a veterinarian, I have my own business, that my policies got cancelled even before the Affordable Care Act. I know that I would change policies on a regular basis, trying to find the best deal for myself and my employees. But a lot of Americans, a lot of Oregonians, have stayed with the same policy for a number of years and are shocked that their policy got cancelled.\n\nBarack Obama, Daniel Halper, Health Care, Oregon\n\nhttp://cdn.weeklystandard.biz/cache/280x280-.jpg", "article_metadata": {"news_keywords": "Barack Obama,Daniel Halper,Health Care,Oregon", "og": {"url": "http://www.weeklystandard.com/dem.-rep.-i-think-the-president-was-grossly-misleading-to-the-american-public/article/766938", "type": "article", "site_name": "Weekly Standard", "description": "Rep. Kurt Schrader, a Democrat from Oregon, said that President Obama was grossly misleading on Obamacare:\n\nVery misleading, the Democratic congressman says of Obama's promise that you can keep your health care plan, if you like it.\nI think next year at the election time, people are going to want to know, was I able to sign up? And what is the shape of the benefit package I'm going to get and how much is it going to cost me, at the end of the day? I think this will, the sign-up period and problems and the horrendous problems that are going on right now will be way in the past.\nI think the president was grossly misleading to the American public. I know right away as a veterinarian, I have my own business, that my policies got cancelled even before the Affordable Care Act. I know that I would change policies on a regular basis, trying to find the best deal for myself and my employees. But a lot of Americans, a lot of Oregonians, have stayed with the same policy for a number of years and are shocked that their policy got cancelled.", "title": "Dem. Rep.: 'I Think the President Was Grossly Misleading to the American Public'"}, "twitter": {"description": "Rep. Kurt Schrader, a Democrat from Oregon, said that President Obama was grossly misleading on Obamacare:\n\nVery misleading, the Democratic congressman says of Obama's promise that you can keep your health care plan, if you like it.\nI think next year at the election time, people are going to want to know, was I able to sign up? And what is the shape of the benefit package I'm going to get and how much is it going to cost me, at the end of the day? I think this will, the sign-up period and problems and the horrendous problems that are going on right now will be way in the past.\nI think the president was grossly misleading to the American public. I know right away as a veterinarian, I have my own business, that my policies got cancelled even before the Affordable Care Act. I know that I would change policies on a regular basis, trying to find the best deal for myself and my employees. But a lot of Americans, a lot of Oregonians, have stayed with the same policy for a number of years and are shocked that their policy got cancelled.", "creator": "@danielhalper", "title": "Dem. Rep.: 'I Think the President Was Grossly Misleading to the American Public'", "site": "@weeklystandard", "widgets": {"csp": "on"}, "card": "summary"}, "fb": {"admins": 1285945407}, "google-site-verification": "QxcYUvYDy42iu46zPMF2vwdQlMXsJP74MqOgujGnpaQ", "keywords": "Barack Obama,Daniel Halper,Health Care,Oregon", "article": {"author": "Daniel Halper", "published_time": "2013-11-12 09:02", "title": "Dem. Rep.: 'I Think the President Was Grossly Misleading to the American Public'"}, "viewport": "width=device-width,user-scalable=0"}, "_id": "\"57477afa6914bd0286fe6193\"", "article_summary": "\"I think the president was grossly misleading to the American public.\nRep.: 'I Think the President Was Grossly Misleading to the American Public'Rep. Kurt Schrader, a Democrat from Oregon, said that President Obama was grossly misleading on Obamacare: Very misleading, the Democratic congressman says of Obama's promise that you can keep your health care plan, if you like it.\nI think the president was grossly misleading to the American public.\nI know right away as a veterinarian, I have my own business, that my policies got cancelled even before the Affordable Care Act.\n\"I think next year at the election time, people are going to want to know, was I able to sign up?"}