{"article_title": "Rubio: 'We Need More Welders and Less Philosophers'", "article_keywords": ["wage", "going", "welders", "raise", "reform", "vocational", "philosophers", "rubio", "minimum", "way", "need", "education", "best"], "article_url": "http://www.weeklystandard.com/rubio-we-need-more-welders-and-less-philosophers/article/1062072", "article_text": "\"If we do that, we will be able to increase wages for millions of Americans. We will be able to leave everyone better off without making anyone worse off.\"\n\n\"Here is the best way to raise wages. Make America the best place in America to start a business or expand an existing business. Tax reform, and regulatory reform. Bring our debt under control. Fully utilize our energy resources to reinvigorate manufacturing. Repeal and replace Obamacare. And make higher education faster and easier to access, especially vocational training. For the life of me I don't know why we stigmatize vocational education. Welders make more money than philosophers. We need more welders and less philosophers.\n\n\"If I thought that raising the minimum wage was the best way to help people increase their pay, I would be all for it. But it isn't. In the 20th century it is disaster. If you raise the minimum wage you're going to make people more expensive than a machine. And that means all this automation that's replacing jobs and people right now is going to be accelerated.\n\nThe Weekly Standard http://assets.weeklystandard.com.s3.amazonaws.com/tws15/images/logo-large.png\n\nThe Weekly Standard\n\n2015\n\nWashington, DC\n\nPolitics\n\nhttp://www.weeklystandard.com/rubio-we-need-more-welders-and-less-philosophers/article/1062072\n\n2015-11-10T22:09\n\n2015-11-10T21:13\n\nRubio: 'We Need More Welders and Less Philosophers'\n\nDuring Tuesday night's Republican presidential debate, Marco Rubio articulated his disagreements with increasing the minimum wage, and explained his alternative ideas. If I thought that raising the minimum wage was the best way to help people increase their pay, I would be all for it. But it isn't. In the 20th century it is disaster. If you raise the minimum wage you're going to make people more expensive than a machine. And that means all this automation that's replacing jobs and people right now is going to be accelerated. Here is the best way to raise wages. Make America the best place in America to start a business or expand an existing business. Tax reform, and regulatory reform. Bring our debt under control. Fully utilize our energy resources to reinvigorate manufacturing. Repeal and replace Obamacare. And make higher education faster and easier to access, especially vocational training. For the life of me I don't know why we stigmatize vocational education. Welders make more money than philosophers. We need more welders and less philosophers.\n\n2016 Elections, debates, Marco Rubio, Philosophy, SHOSHANA WEISSMANN\n\nhttp://cdn.weeklystandard.biz/cache/280x280-157e79466275b108655c4876900e0d11.jpg", "article_metadata": {"news_keywords": "2016 Elections,debates,Marco Rubio,Philosophy,SHOSHANA WEISSMANN", "og": {"site_name": "Weekly Standard", "description": "During Tuesday night's Republican presidential debate, Marco Rubio articulated his disagreements with increasing the minimum wage, and explained his alternative ideas.&nbsp;\n\nIf I thought that raising the minimum wage was the best way to help people increase their pay, I would be all for it. But it isn't. In the 20th century it is disaster. If you raise the minimum wage you're going to make people more expensive than a machine. And that means all this automation that's replacing jobs and people right now is going to be accelerated.\nHere is the best way to raise wages. Make America the best place in America to start a business or expand an existing business. Tax reform, and regulatory reform. Bring our debt under control. Fully utilize our energy resources to reinvigorate manufacturing. Repeal and replace Obamacare. And make higher education faster and easier to access, especially vocational training. For the life of me I don't know why we stigmatize vocational education. Welders make more money than philosophers. We need more welders and less philosophers.", "title": "Rubio: 'We Need More Welders and Less Philosophers'", "url": "http://www.weeklystandard.com/rubio-we-need-more-welders-and-less-philosophers/article/1062072", "image": "http://cdn.weeklystandard.biz/cache/r960-157e79466275b108655c4876900e0d11.jpg", "type": "article"}, "twitter": {"description": "During Tuesday night's Republican presidential debate, Marco Rubio articulated his disagreements with increasing the minimum wage, and explained his alternative ideas.&nbsp;\n\nIf I thought that raising the minimum wage was the best way to help people increase their pay, I would be all for it. But it isn't. In the 20th century it is disaster. If you raise the minimum wage you're going to make people more expensive than a machine. And that means all this automation that's replacing jobs and people right now is going to be accelerated.\nHere is the best way to raise wages. Make America the best place in America to start a business or expand an existing business. Tax reform, and regulatory reform. Bring our debt under control. Fully utilize our energy resources to reinvigorate manufacturing. Repeal and replace Obamacare. And make higher education faster and easier to access, especially vocational training. For the life of me I don't know why we stigmatize vocational education. Welders make more money than philosophers. We need more welders and less philosophers.", "title": "Rubio: 'We Need More Welders and Less Philosophers'", "image": "http://cdn.weeklystandard.biz/cache/r960-157e79466275b108655c4876900e0d11.jpg", "site": "@weeklystandard", "widgets": {"csp": "on"}, "card": "summary"}, "fb": {"admins": 1285945407}, "article": {"title": "Rubio: 'We Need More Welders and Less Philosophers'", "published_time": "2015-11-10 22:09", "author": "Shoshana Weissmann"}, "keywords": "2016 Elections,debates,Marco Rubio,Philosophy,SHOSHANA WEISSMANN", "google-site-verification": "QxcYUvYDy42iu46zPMF2vwdQlMXsJP74MqOgujGnpaQ", "viewport": "width=device-width,user-scalable=0"}, "article_summary": "The Weekly Standard http://assets.weeklystandard.com.s3.amazonaws.com/tws15/images/logo-large.pngThe Weekly Standard2015Washington, DCPoliticshttp://www.weeklystandard.com/rubio-we-need-more-welders-and-less-philosophers/article/10620722015-11-10T22:092015-11-10T21:13Rubio: 'We Need More Welders and Less Philosophers'During Tuesday night's Republican presidential debate, Marco Rubio articulated his disagreements with increasing the minimum wage, and explained his alternative ideas.\nFor the life of me I don't know why we stigmatize vocational education.\n\"If I thought that raising the minimum wage was the best way to help people increase their pay, I would be all for it.\nWe need more welders and less philosophers.\nIf I thought that raising the minimum wage was the best way to help people increase their pay, I would be all for it."}