{"article_title": "Senate Candidate Ben Sasse's Personal Investment in Repealing Obamacare", "article_keywords": ["ben", "sasse", "candidate", "senate", "obamacare", "primary", "osborn", "personal", "repealing", "nebraska", "polling", "sasses", "investment", "weekly"], "article_url": "http://www.weeklystandard.com/senate-candidate-ben-sasses-personal-investment-in-repealing-obamacare/article/786706", "article_text": "In other Nebraska GOP primary news, THE WEEKLY STANDARD has learned that private polling in Nebraska by an independent outside group has the race dead even at 31-30, a slight edge for former state treasurer Shane Osborn. However, the poll also shows that, despite being a statistical tie, Sasse is still behind Osborn in name recognition. Given Sasse's polling momentum and much stronger fundraising numbers , Sasse looks to have a bigger opportunity than Osborn to pick up new votes before the May 13 primary election.\n\nNebraska Senate candidate Ben Sasse has been declared \" Obamacare's Nebraska Nemesis ,\" and in a new ad Sasse explains why he's personally invested in repealing the law. In 2007, his wife Melissa had an aneurysm followed by an arduous recovery, which left his family with $160,000 in medical bills. Sasse ended up waging a months-long battle against the health insurance system, and Sasse is convinced Obamacare will only make these problems worse:\n\nNebraska Senate candidate Ben Sasse has been declared \" Obamacare's Nebraska Nemesis ,\" and in a new ad Sasse explains why he's personally invested in repealing the law. In 2007, his wife Melissa had an aneurysm followed by an arduous recovery, which left his family with $160,000 in medical bills. Sasse ended up waging a months-long battle against the health insurance system, and Sasse is convinced Obamacare will only make these problems worse:\n\nThe Weekly Standard http://assets.weeklystandard.com.s3.amazonaws.com/tws15/images/logo-large.png\n\nThe Weekly Standard\n\n2014\n\nWashington, DC\n\nPolitics\n\nhttp://www.weeklystandard.com/senate-candidate-ben-sasses-personal-investment-in-repealing-obamacare/article/786706\n\n2014-04-09T08:19\n\n2014-04-09T08:20\n\nSenate Candidate Ben Sasse's Personal Investment in Repealing Obamacare\n\nNebraska Senate candidate Ben Sasse has been declared Obamacare's Nebraska Nemesis, and in a new ad Sasse explains why he's personally invested in repealing the law. In 2007, his wife Melissa had an aneurysm followed by an arduous recovery, which left his family with $160,000 in medical bills. Sasse ended up waging a months-long battle against the health insurance system, and Sasse is convinced Obamacare will only make these problems worse: In other Nebraska GOP primary news, THE WEEKLY STANDARD has learned that private polling in Nebraska by an independent outside group has the race dead even at 31-30, a slight edge for former state treasurer Shane Osborn. However, the poll also shows that, despite being a statistical tie, Sasse is still behind Osborn in name recognition. Given Sasse's polling momentum and much stronger fundraising numbers, Sasse looks to have a bigger opportunity than Osborn to pick up new votes before the May 13 primary election.\n\n2014 Elections, Ben Sasse, Mark Hemingway, Nebraska, Obamacare, Senate, Shane Osborn\n\nhttp://cdn.weeklystandard.biz/cache/280x280-.jpg", "article_metadata": {"news_keywords": "2014 Elections,Ben Sasse,Mark Hemingway,Nebraska,Obamacare,Senate,Shane Osborn", "og": {"url": "http://www.weeklystandard.com/senate-candidate-ben-sasses-personal-investment-in-repealing-obamacare/article/786706", "type": "article", "site_name": "Weekly Standard", "description": "Nebraska Senate candidate Ben Sasse has been declared Obamacare's Nebraska Nemesis,&nbsp; and in a new ad Sasse explains why he's personally invested in repealing the law. In 2007, his wife Melissa had an aneurysm followed by an arduous recovery, which left his family with $160,000 in medical bills. Sasse ended up waging a months-long battle against the health insurance system, and Sasse is convinced Obamacare will only make these problems worse:\n\nIn other Nebraska GOP primary news, THE WEEKLY STANDARD has learned that private polling in Nebraska by an independent outside group has the race dead even at 31-30, a slight edge for former state treasurer Shane Osborn. However, the poll also shows that, despite being a statistical tie, Sasse is still behind Osborn in name recognition. Given Sasse's polling momentum and much stronger fundraising numbers, Sasse looks to have a bigger opportunity than Osborn to pick up new votes before the May 13 primary election.", "title": "Senate Candidate Ben Sasse's Personal Investment in Repealing Obamacare"}, "twitter": {"description": "Nebraska Senate candidate Ben Sasse has been declared Obamacare's Nebraska Nemesis,&nbsp; and in a new ad Sasse explains why he's personally invested in repealing the law. In 2007, his wife Melissa had an aneurysm followed by an arduous recovery, which left his family with $160,000 in medical bills. Sasse ended up waging a months-long battle against the health insurance system, and Sasse is convinced Obamacare will only make these problems worse:\n\nIn other Nebraska GOP primary news, THE WEEKLY STANDARD has learned that private polling in Nebraska by an independent outside group has the race dead even at 31-30, a slight edge for former state treasurer Shane Osborn. However, the poll also shows that, despite being a statistical tie, Sasse is still behind Osborn in name recognition. Given Sasse's polling momentum and much stronger fundraising numbers, Sasse looks to have a bigger opportunity than Osborn to pick up new votes before the May 13 primary election.", "creator": "@heminator", "title": "Senate Candidate Ben Sasse's Personal Investment in Repealing Obamacare", "site": "@weeklystandard", "widgets": {"csp": "on"}, "card": "summary"}, "fb": {"admins": 1285945407}, "google-site-verification": "QxcYUvYDy42iu46zPMF2vwdQlMXsJP74MqOgujGnpaQ", "keywords": "2014 Elections,Ben Sasse,Mark Hemingway,Nebraska,Obamacare,Senate,Shane Osborn", "article": {"author": "Mark Hemingway", "published_time": "2014-04-09 08:19", "title": "Senate Candidate Ben Sasse's Personal Investment in Repealing Obamacare"}, "viewport": "width=device-width,user-scalable=0"}, "_id": "\"57477af36914bd0286fca981\"", "article_summary": "2014 Elections, Ben Sasse, Mark Hemingway, Nebraska, Obamacare, Senate, Shane Osbornhttp://cdn.weeklystandard.biz/cache/280x280-.jpg\nNebraska Senate candidate Ben Sasse has been declared \" Obamacare's Nebraska Nemesis ,\" and in a new ad Sasse explains why he's personally invested in repealing the law.\nSasse ended up waging a months-long battle against the health insurance system, and Sasse is convinced Obamacare will only make these problems worse:The Weekly Standard http://assets.weeklystandard.com.s3.amazonaws.com/tws15/images/logo-large.pngThe Weekly Standard2014Washington, DCPoliticshttp://www.weeklystandard.com/senate-candidate-ben-sasses-personal-investment-in-repealing-obamacare/article/7867062014-04-09T08:192014-04-09T08:20Senate Candidate Ben Sasse's Personal Investment in Repealing ObamacareNebraska Senate candidate Ben Sasse has been declared Obamacare's Nebraska Nemesis, and in a new ad Sasse explains why he's personally invested in repealing the law.\nHowever, the poll also shows that, despite being a statistical tie, Sasse is still behind Osborn in name recognition.\nSasse ended up waging a months-long battle against the health insurance system, and Sasse is convinced Obamacare will only make these problems worse:Nebraska Senate candidate Ben Sasse has been declared \" Obamacare's Nebraska Nemesis ,\" and in a new ad Sasse explains why he's personally invested in repealing the law."}