{"article_title": "Federal Employees Union Says Obamacare Could 'Hurt' Members", "article_keywords": ["federal", "legislation", "employees", "obamacare", "hurt", "union", "tabs", "sponsored", "members", "treasury", "workers", "fact"], "article_url": "http://www.weeklystandard.com/federal-employees-union-says-obamacare-could-hurt-members/article/802995", "article_text": "With a Republican-controlled House of Representatives that was elected on a message of reining in federal spending, the NTEU's been on alert for any and all legislation that proposes reducing pay and benefits for federal workers. In fact, on the union's website, there's a handy list of 13 active pieces of legislation (all sponsored by Republicans) that the NTEU says it wants to stop. \"Warning!\" reads the top of the fact sheet. \"Which of these bills could hurt you? ALL OF THEM.\"\n\nThe National Treasury Employees Union is an independent union representing, according to its own figures, \"some 150,000\" federal workers from many different agencies. The union claims to fight for the \"dignity and respect\" of its members, and it maintains a \"legislative action center\" to keep tabs on what Congress is up to.\n\nThe National Treasury Employees Union is an independent union representing, according to its own figures, \"some 150,000\" federal workers from many different agencies. The union claims to fight for the \"dignity and respect\" of its members, and it maintains a \"legislative action center\" to keep tabs on what Congress is up to.\n\nThe Weekly Standard http://assets.weeklystandard.com.s3.amazonaws.com/tws15/images/logo-large.png\n\nThe Weekly Standard\n\n2014\n\nWashington, DC\n\nPolitics\n\nhttp://www.weeklystandard.com/federal-employees-union-says-obamacare-could-hurt-members/article/802995\n\n2014-08-15T11:05\n\n2014-08-15T11:05\n\nFederal Employees Union Says Obamacare Could 'Hurt' Members\n\nThe National Treasury Employees Union is an independent union representing, according to its own figures, some 150,000 federal workers from many different agencies. The union claims to fight for the dignity and respect of its members, and it maintains a legislative action center to keep tabs on what Congress is up to. With a Republican-controlled House of Representatives that was elected on a message of reining in federal spending, the NTEU's been on alert for any and all legislation that proposes reducing pay and benefits for federal workers. In fact, on the union's website, there's a handy list of 13 active pieces of legislation (all sponsored by Republicans) that the NTEU says it wants to stop. Warning! reads the top of the fact sheet. Which of these bills could hurt you? ALL OF THEM. Among the bills is H.R. 1780, sponsored by Michigan Republican Dave Camp. The NTEU says the bill could hurt workers because it would require most federal employees to leave the Federal Employees Health Benefits Program...and instead join health plans established under the Affordable Care Act.\n\nfederal government, Michael Warren, Obamacare, Unions\n\nhttp://cdn.weeklystandard.biz/cache/280x280-bdcf63390ee4335c7510022252bf2b85.jpg", "article_metadata": {"news_keywords": "federal government,Michael Warren,Obamacare,Unions", "og": {"site_name": "Weekly Standard", "description": "The National Treasury Employees Union is an independent union representing, according to its own figures, some 150,000 federal workers from many different agencies. The union claims to fight for the dignity and respect of its members, and it maintains a legislative action center to keep tabs on what Congress is up to.\nWith a Republican-controlled House of Representatives that was elected on a message of reining in federal spending, the NTEU's been on alert for any and all legislation that proposes reducing pay and benefits for federal workers. In fact, on the union's website, there's a handy list of 13 active pieces of legislation (all sponsored by Republicans) that the NTEU says it wants to stop. Warning! reads the top of the fact sheet. Which of these bills could hurt you? ALL OF THEM.\nAmong the bills is H.R. 1780, sponsored by Michigan Republican Dave Camp. The NTEU says the bill could hurt workers because it would require most federal employees to leave the Federal Employees Health Benefits Program...and instead join health plans established under the Affordable Care Act.", "title": "Federal Employees Union Says Obamacare Could 'Hurt' Members", "url": "http://www.weeklystandard.com/federal-employees-union-says-obamacare-could-hurt-members/article/802995", "image": "http://cdn.weeklystandard.biz/cache/r960-bdcf63390ee4335c7510022252bf2b85.jpg", "type": "article"}, "twitter": {"description": "The National Treasury Employees Union is an independent union representing, according to its own figures, some 150,000 federal workers from many different agencies. The union claims to fight for the dignity and respect of its members, and it maintains a legislative action center to keep tabs on what Congress is up to.\nWith a Republican-controlled House of Representatives that was elected on a message of reining in federal spending, the NTEU's been on alert for any and all legislation that proposes reducing pay and benefits for federal workers. In fact, on the union's website, there's a handy list of 13 active pieces of legislation (all sponsored by Republicans) that the NTEU says it wants to stop. Warning! reads the top of the fact sheet. Which of these bills could hurt you? ALL OF THEM.\nAmong the bills is H.R. 1780, sponsored by Michigan Republican Dave Camp. The NTEU says the bill could hurt workers because it would require most federal employees to leave the Federal Employees Health Benefits Program...and instead join health plans established under the Affordable Care Act.", "creator": "@MichaelRWarren", "image": "http://cdn.weeklystandard.biz/cache/r960-bdcf63390ee4335c7510022252bf2b85.jpg", "title": "Federal Employees Union Says Obamacare Could 'Hurt' Members", "site": "@weeklystandard", "widgets": {"csp": "on"}, "card": "summary"}, "fb": {"admins": 1285945407}, "google-site-verification": "QxcYUvYDy42iu46zPMF2vwdQlMXsJP74MqOgujGnpaQ", "keywords": "federal government,Michael Warren,Obamacare,Unions", "article": {"author": "Michael Warren", "published_time": "2014-08-15 11:05", "title": "Federal Employees Union Says Obamacare Could 'Hurt' Members"}, "viewport": "width=device-width,user-scalable=0"}, "article_summary": "The Weekly Standard http://assets.weeklystandard.com.s3.amazonaws.com/tws15/images/logo-large.pngThe Weekly Standard2014Washington, DCPoliticshttp://www.weeklystandard.com/federal-employees-union-says-obamacare-could-hurt-members/article/8029952014-08-15T11:052014-08-15T11:05Federal Employees Union Says Obamacare Could 'Hurt' MembersThe National Treasury Employees Union is an independent union representing, according to its own figures, some 150,000 federal workers from many different agencies.\nThe NTEU says the bill could hurt workers because it would require most federal employees to leave the Federal Employees Health Benefits Program...and instead join health plans established under the Affordable Care Act.\nThe National Treasury Employees Union is an independent union representing, according to its own figures, \"some 150,000\" federal workers from many different agencies.\nWith a Republican-controlled House of Representatives that was elected on a message of reining in federal spending, the NTEU's been on alert for any and all legislation that proposes reducing pay and benefits for federal workers.\nThe union claims to fight for the \"dignity and respect\" of its members, and it maintains a \"legislative action center\" to keep tabs on what Congress is up to."}