{"article_title": "Tragic Update on French Drug Trial Gone Wrong", "article_keywords": ["gone", "given", "participant", "declared", "brain", "hospitalized", "update", "drug", "trial", "wrong", "tragic", "french", "participants", "dead"], "article_url": "http://www.hcplive.com/medical-news/tragic-update-on-french-drug-trial-gone-wrong", "article_text": "Tragic Update on French Drug Trial Gone Wrong\n\nMD Magazine is on Facebook, Twitter, Instagram, and LinkedIn!\n\nA drug trial in France has officially gone from bad to worse.On January 15 we learned that one participant was declared brain dead and five additional participants were hospitalized after taking part in a phase I clinical trial. The trial was testing an experimental molecule for a painkiller, a FAAH enzyme inhibitor. The University Hospital of Rennes revealed that the participant who had been declared brain dead passed away on January 17.Out of the 128 participants, 90 were given the drug at different dosage levels and the remainder were given a placebo. BIAL, a Portuguese pharmaceutical company, developed the drug and said that 108 patients had used the drug with any moderate or serious problems.\u201cOur thoughts and solidarity go out to the family of this volunteer,\u201d a statement from Bial said.Bial says that they continue to follow the other hospitalized participants and are working with the Health Authorities.", "article_metadata": {"description": "A drug trial in France has officially gone from bad to worse.", "og": {"site_name": "MD Magazine", "description": "A drug trial in France has officially gone from bad to worse.", "title": "Tragic Update on French Drug Trial Gone Wrong", "url": "http://www.hcplive.com/medical-news/tragic-update-on-french-drug-trial-gone-wrong", "image": "https://s3.amazonaws.com/hcplive/v1_media/_upload_image/_thumbnails/Heart_Rate_Reading.jpg", "type": "Article"}, "msapplication-TileColor": "#ffffff", "msapplication-TileImage": "https://s3.amazonaws.com/hcplive/v2_media/_core/favi/ms-icon-144x144.png", "keywords": "neurology, hospital medicine, pain management, addiction medicine", "theme-color": "#ffffff"}, "article_summary": "Tragic Update on French Drug Trial Gone WrongMD Magazine is on Facebook, Twitter, Instagram, and LinkedIn!\nA drug trial in France has officially gone from bad to worse.On January 15 we learned that one participant was declared brain dead and five additional participants were hospitalized after taking part in a phase I clinical trial.\nThe trial was testing an experimental molecule for a painkiller, a FAAH enzyme inhibitor.\nThe University Hospital of Rennes revealed that the participant who had been declared brain dead passed away on January 17.Out of the 128 participants, 90 were given the drug at different dosage levels and the remainder were given a placebo.\nBIAL, a Portuguese pharmaceutical company, developed the drug and said that 108 patients had used the drug with any moderate or serious problems.\u201cOur thoughts and solidarity go out to the family of this volunteer,\u201d a statement from Bial said.Bial says that they continue to follow the other hospitalized participants and are working with the Health Authorities."}