{"article_title": "Dr. Ben Carson Calls for Replacing Obamacare", "article_keywords": ["control", "ben", "calls", "replacing", "obamacare", "principles", "proven", "carson", "carsons", "innovation", "dr", "care"], "article_url": "http://www.weeklystandard.com/dr.-ben-carson-calls-for-replacing-obamacare/article/786451", "article_text": "Given the proven failure of Obamacare\u2014to secure liberty, to control costs, and even to cover anywhere near the number of people it was supposed to cover when it was passed\u2014 Carson\u2019s first principles, and his call for a replacement , will likely resonate with the bulk of his fellow citizens.\n\nCarson calls for personal control, advancing technology and innovation, granting states maximum flexibility, recognizing that doctors are the backbone of American medicine, and ensuring that Americans are always \u201cfree to buy coverage and benefits consistent with their moral and religious beliefs.\u201d If these sound like the opposite of Obamacare, another of Carson\u2019s principles makes the contrast even clearer: \u201cCentralization and bureaucracy are the antithesis of personalization, and only discourage choice and innovation.\u201d Another declares, \u201cLarge-scale change should not be imposed from above. Instead, we must have the freedom to choose what is best for our families and build on proven successes.\u201d\n\nThe Weekly Standard http://assets.weeklystandard.com.s3.amazonaws.com/tws15/images/logo-large.png\n\nThe Weekly Standard\n\n2014\n\nWashington, DC\n\nPolitics\n\nhttp://www.weeklystandard.com/dr.-ben-carson-calls-for-replacing-obamacare/article/786451\n\n2014-04-03T10:10\n\n2014-04-03T10:10\n\nDr. Ben Carson Calls for Replacing Obamacare\n\nDr. Ben Carson has just launched the Save Our Healthcare Project, the goal of which is \u201cto replace Obamacare with positive, patient-centered reforms to ensure all Americans have access to high-quality care.\u201d In the launch\u2019s initial phase, Carson lists his seven core principles of real health care reform. Carson calls for personal control, advancing technology and innovation, granting states maximum flexibility, recognizing that doctors are the backbone of American medicine, and ensuring that Americans are always \u201cfree to buy coverage and benefits consistent with their moral and religious beliefs.\u201d If these sound like the opposite of Obamacare, another of Carson\u2019s principles makes the contrast even clearer: \u201cCentralization and bureaucracy are the antithesis of personalization, and only discourage choice and innovation.\u201d Another declares, \u201cLarge-scale change should not be imposed from above. Instead, we must have the freedom to choose what is best for our families and build on proven successes.\u201d\n\nBarack Obama, Ben Carson, Health Care, Jeffrey H. Anderson, Obamacare\n\nhttp://cdn.weeklystandard.biz/cache/280x280-.jpg", "article_metadata": {"news_keywords": "Barack Obama,Ben Carson,Health Care,Jeffrey H. Anderson,Obamacare", "og": {"url": "http://www.weeklystandard.com/dr.-ben-carson-calls-for-replacing-obamacare/article/786451", "type": "article", "site_name": "Weekly Standard", "description": "Dr. Ben Carson has just launched the&nbsp;Save Our Healthcare Project, the goal of which is \u201cto replace Obamacare with positive, patient-centered reforms to ensure all Americans have access to high-quality care.\u201d&nbsp;&nbsp;In the launch\u2019s initial phase, Carson&nbsp;lists his seven core principles&nbsp;of real health care reform.&nbsp;&nbsp;\nCarson calls for personal control, advancing technology and innovation, granting states maximum flexibility, recognizing that doctors are the backbone of American medicine, and ensuring that Americans are always \u201cfree to buy coverage and benefits consistent with their moral and religious beliefs.\u201d&nbsp;&nbsp;If these sound like the opposite of Obamacare, another of Carson\u2019s principles makes the contrast even clearer:&nbsp;\u201cCentralization and bureaucracy are the antithesis of personalization, and only discourage choice and innovation.\u201d&nbsp;&nbsp;Another declares, \u201cLarge-scale change should not be imposed from above.&nbsp;&nbsp;Instead, we must have the freedom to choose what is best for our families and build on proven successes.\u201d&nbsp;", "title": "Dr. Ben Carson Calls for Replacing Obamacare"}, "twitter": {"widgets": {"csp": "on"}, "site": "@weeklystandard", "description": "Dr. Ben Carson has just launched the&nbsp;Save Our Healthcare Project, the goal of which is \u201cto replace Obamacare with positive, patient-centered reforms to ensure all Americans have access to high-quality care.\u201d&nbsp;&nbsp;In the launch\u2019s initial phase, Carson&nbsp;lists his seven core principles&nbsp;of real health care reform.&nbsp;&nbsp;\nCarson calls for personal control, advancing technology and innovation, granting states maximum flexibility, recognizing that doctors are the backbone of American medicine, and ensuring that Americans are always \u201cfree to buy coverage and benefits consistent with their moral and religious beliefs.\u201d&nbsp;&nbsp;If these sound like the opposite of Obamacare, another of Carson\u2019s principles makes the contrast even clearer:&nbsp;\u201cCentralization and bureaucracy are the antithesis of personalization, and only discourage choice and innovation.\u201d&nbsp;&nbsp;Another declares, \u201cLarge-scale change should not be imposed from above.&nbsp;&nbsp;Instead, we must have the freedom to choose what is best for our families and build on proven successes.\u201d&nbsp;", "card": "summary", "title": "Dr. Ben Carson Calls for Replacing Obamacare"}, "fb": {"admins": 1285945407}, "google-site-verification": "QxcYUvYDy42iu46zPMF2vwdQlMXsJP74MqOgujGnpaQ", "keywords": "Barack Obama,Ben Carson,Health Care,Jeffrey H. Anderson,Obamacare", "article": {"author": "Jeffrey H. Anderson", "published_time": "2014-04-03 10:10", "title": "Dr. Ben Carson Calls for Replacing Obamacare"}, "viewport": "width=device-width,user-scalable=0"}, "_id": "\"57477af46914bd0286fda434\"", "article_summary": "Instead, we must have the freedom to choose what is best for our families and build on proven successes.\u201dBarack Obama, Ben Carson, Health Care, Jeffrey H. Anderson, Obamacarehttp://cdn.weeklystandard.biz/cache/280x280-.jpg\nInstead, we must have the freedom to choose what is best for our families and build on proven successes.\u201dThe Weekly Standard http://assets.weeklystandard.com.s3.amazonaws.com/tws15/images/logo-large.pngThe Weekly Standard2014Washington, DCPoliticshttp://www.weeklystandard.com/dr.-ben-carson-calls-for-replacing-obamacare/article/7864512014-04-03T10:102014-04-03T10:10Dr. Ben Carson Calls for Replacing ObamacareDr. Ben Carson has just launched the Save Our Healthcare Project, the goal of which is \u201cto replace Obamacare with positive, patient-centered reforms to ensure all Americans have access to high-quality care.\u201d In the launch\u2019s initial phase, Carson lists his seven core principles of real health care reform.\nGiven the proven failure of Obamacare\u2014to secure liberty, to control costs, and even to cover anywhere near the number of people it was supposed to cover when it was passed\u2014 Carson\u2019s first principles, and his call for a replacement , will likely resonate with the bulk of his fellow citizens.\nCarson calls for personal control, advancing technology and innovation, granting states maximum flexibility, recognizing that doctors are the backbone of American medicine, and ensuring that Americans are always \u201cfree to buy coverage and benefits consistent with their moral and religious beliefs.\u201d If these sound like the opposite of Obamacare, another of Carson\u2019s principles makes the contrast even clearer: \u201cCentralization and bureaucracy are the antithesis of personalization, and only discourage choice and innovation.\u201d Another declares, \u201cLarge-scale change should not be imposed from above."}