{"article_title": "Audax Remains Active, Investing in Schwag Distributor Halo", "article_keywords": ["firm", "sri", "audax", "portfolio", "investing", "schwag", "private", "promotional", "remains", "products", "pe", "distributor", "equity", "active", "halo"], "article_url": "http://www.themiddlemarket.com/news/financial_sponsors/audax-remains-active-investing-in-schwag-distributor-halo-260358-1.html", "article_text": "Audax Remains Active, Investing in Schwag Distributor Halo\n\nThe PE firm recently backed Foam Products and SRI Connector Gage\n\nAudax Private Equity has acquired promotional products distributor Halo Branded Solutions. The PE firms has partnered with management on the deal.\n\nHalo, based in Sterling, Illinois, distributes promotional products (known as \u201cschwag\u201d in the public relations community), such as towels, candy boxes and t-shirts. Some of its clients include Ace Hardware, the National Hockey League\u2019s Columbus Blue Jackets and the Wendy's Co. (Nasdaq: WEN). \u201cWe are impressed with Halo\u2019s leadership position in an industry that is positioned for strong growth,\u201d says Audax co-Ceo Geoffrey Rehnert.\n\nAudax won Mergers & Acquisitions\u2019 2015 M&A Mid-Market Award for Private Equity Firm of the Year. While activity in the overall middle market slowed down in 2015, Audax raised its fifth fund, closed 100-plus investments (including 12 platform acquisitions and 91 add-on deals) and sold more portfolio companies than most of its competitors.\n\nAudax has been busy making deals lately. ICP, which is backed by the PE firm, acquired adhesives maker Fomo Products Inc., and Winchester Electronics, another Audax portfolio company, purchased SRI Connector Gage.\n\nFor more information on related topics, visit the following:", "article_metadata": {"status": "open", "domain": "Mergers & Acquisitions", "sailthru.author": "Demitri Diakantonis", "sailthru.expire_date": "2016-05-15 12:00:00", "og": {"url": "http://www.themiddlemarket.com/news/financial_sponsors/audax-remains-active-investing-in-schwag-distributor-halo-260358-1.html", "image": "http://cdn.themiddlemarket.com/media/newspics/halo.jpeg", "site_name": "Mergers & Acquisitions, Latest News", "title": "Audax Remains Active, Investing in Schwag Distributor Halo"}, "sailthru.description": "The PE firm recently backed Foam Products and SRI Connector Gage", "brand": "Mergers & Acquisitions, Latest News", "sailthru.date": "2016-04-15 12:00:00", "wordcount": 168, "sailthru.title": "Audax Remains Active, Investing in Schwag Distributor Halo", "featured": 1, "sailthru.tags": "News, Business Services, Private Equity, Private Equity, Audax Remains Active, Investing in Schwag Distributor Halo, SRI Connector, Foam Products, private equity, M&A, Geoffrey Rehnert, Winchester Electronics, Article", "type": "Article", "sailthru.image.full": "http://cdn.themiddlemarket.com/media/newspics/halo.jpeg"}, "article_summary": "Audax Remains Active, Investing in Schwag Distributor HaloThe PE firm recently backed Foam Products and SRI Connector GageAudax Private Equity has acquired promotional products distributor Halo Branded Solutions.\nHalo, based in Sterling, Illinois, distributes promotional products (known as \u201cschwag\u201d in the public relations community), such as towels, candy boxes and t-shirts.\nAudax won Mergers & Acquisitions\u2019 2015 M&A Mid-Market Award for Private Equity Firm of the Year.\nICP, which is backed by the PE firm, acquired adhesives maker Fomo Products Inc., and Winchester Electronics, another Audax portfolio company, purchased SRI Connector Gage.\n\u201cWe are impressed with Halo\u2019s leadership position in an industry that is positioned for strong growth,\u201d says Audax co-Ceo Geoffrey Rehnert."}