{"article_title": "IOP Adds to Building Products Deals with Alexandria Moulding Investment", "article_keywords": ["building", "partners", "alexandria", "adds", "million", "private", "iop", "deals", "mouldings", "products", "management", "moulding", "investment", "veneer"], "article_url": "http://www.themiddlemarket.com/news/building_products/industrial-opportunity-adds-to-building-products-deals-alexandria-moulding-260348-1.html", "article_text": "IOP Adds to Building Products Deals with Alexandria Moulding Investment\n\nIn 2015, the private equity firm also acquired Coldwater Veneer through the same fund\n\nPrivate equity firm Industrial Opportunity Partners (IOP) has invested in Alexandria Moulding Inc., a manufacturer and distributor of wood mouldings. This is the ninth platform investment for the PE firm\u2019s $275 million Industrial Opportunity Partners II fund. In September 2015, the fund also acquired Coldwater Veneer Inc., a manufacturer of hardwood veneer for building products.\n\nIOP typically invests in manufacturing and distribution businesses with sales between $30 million and $350 million. Financial terms of the Alexandria Moulding transaction were not disclosed.\n\nAlexandria Moulding is headquartered in Alexandria, Ontario, and also has facilities in Moxee, Washington and Wilkes Barre, Pennsylvania. The company sells directly to retailers, wholesale building product distributors and industrial customers.\n\nIOP, which is based in Evanston, Illinois, is partnering in the investment with Alexandria Moulding\u2019s CEO Andre Cholette and the company\u2019s management team. The team will remain in their current management roles, focusing on growing the business. Dave Macking, an operating partner at IOP, will take on the role of chairman.\n\nFinancing for deal was provided to IOP by Wells Fargo and Scotiabank, with McDermott, Will & Emery serving as the legal adviser to the company. Osprey Capital Partners represented Alexandria Moulding\u2019s shareholders.\n\nCompanies in the homebuilding sector have been attractive targets recently. In April, Audax Private Equity-backed Innovative Chemical Products (ICP) announced its acquisition of adhesives maker Fomo Products Inc. Earlier in April, IPS Corp., backed by middle market private equity firm Nautic Partners, purchased Integra Adhesives from management .\n\nFor more information on related topics, visit the following:", "article_metadata": {"status": "open", "domain": "Mergers & Acquisitions", "sailthru.author": "Jakema Lewis", "sailthru.expire_date": "2016-05-14 12:57:00", "og": {"url": "http://www.themiddlemarket.com/news/building_products/industrial-opportunity-adds-to-building-products-deals-alexandria-moulding-260348-1.html", "image": "http://cdn.themiddlemarket.com/media/newspics/woodmoulding.jpeg", "site_name": "Mergers & Acquisitions, Latest News", "title": "IOP Adds to Building Products Deals with Alexandria Moulding Investment"}, "sailthru.description": "In 2015, the private equity firm also acquired Coldwater Veneer through the same fund", "brand": "Mergers & Acquisitions, Latest News", "sailthru.date": "2016-04-14 12:57:00", "wordcount": 241, "sailthru.title": "IOP Adds to Building Products Deals with Alexandria Moulding Investment", "featured": 1, "sailthru.tags": "News, Private Equity, Building Products, Building Products, IOP Adds to Building Products Deals with Alexandria Moulding Investment, coldwater veneer, Dave Macking, Wells Fargo, Scotiabank, McDermott, Will & Emery, Osprey Capital Partners, Audax, Innovative Chemical Products, Fomo Products Inc.,IPS Corp., Nautic Partners, Integra Adhesives, Article", "type": "Article", "sailthru.image.full": "http://cdn.themiddlemarket.com/media/newspics/woodmoulding.jpeg"}, "article_summary": "Alexandria Moulding is headquartered in Alexandria, Ontario, and also has facilities in Moxee, Washington and Wilkes Barre, Pennsylvania.\nIOP Adds to Building Products Deals with Alexandria Moulding InvestmentIn 2015, the private equity firm also acquired Coldwater Veneer through the same fundPrivate equity firm Industrial Opportunity Partners (IOP) has invested in Alexandria Moulding Inc., a manufacturer and distributor of wood mouldings.\nFinancial terms of the Alexandria Moulding transaction were not disclosed.\nIOP, which is based in Evanston, Illinois, is partnering in the investment with Alexandria Moulding\u2019s CEO Andre Cholette and the company\u2019s management team.\nIn September 2015, the fund also acquired Coldwater Veneer Inc., a manufacturer of hardwood veneer for building products."}