{"article_title": "Fusion Acquires TFB, Anticipating Growth in Call Center Software", "article_keywords": ["purchase", "center", "contact", "nasdaq", "tfb", "deals", "fusion", "growth", "anticipating", "tierpoint", "equinix", "software", "acquires"], "article_url": "http://www.themiddlemarket.com/news/tech_telecom/fusion-acquires-tfb-anticipating-growth-in-call-center-software-260216-1.html", "article_text": "Fusion Acquires TFB, Anticipating Growth in Call Center Software\n\nEquinix and TierPoint have made similar deals recently\n\nData communications provider Fusion Telecommunications International Inc. (Nasdaq: FSNN) has agreed to buy call center software company Technology for Business Corp. (TFB). The purchase will give New York-based Fusion a range of software products for in the sector.\n\n\u201cThe contact center market is one which we have long targeted and determined there is significant demand for migration to the cloud,\u201d says Fusion CEO Matthew Rosen. Fusion estimates contact center sales to grow to around $14.7 billion by 2020.\n\nTFB, founded in 1989 and based in Manhattan Beach, California, serves business organizations in the government, health care, energy and retail industries. The target\u2019s software is designed to set up automated messages that can give emergency notifications, appointment reminders and order status updates.\n\nFusion provides cloud-based communication services for businesses including conferencing and IT network systems. The company went public in 2005.\n\nIn other recent data center deals, TierPoint LLC has agreed to buy Cosentry and Equinix Inc. (Nasdaq: EQIX) is adding Bit-isle Inc. In 2015, Equinix reached a deal to purchase Telecity Group Plc.\n\nFor more information on related topics, visit the following:", "article_metadata": {"status": "open", "domain": "Mergers & Acquisitions", "sailthru.author": "Demitri Diakantonis", "sailthru.expire_date": "2016-04-28 11:55:00", "og": {"url": "http://www.themiddlemarket.com/news/tech_telecom/fusion-acquires-tfb-anticipating-growth-in-call-center-software-260216-1.html", "image": "http://cdn.themiddlemarket.com/media/newspics/callcenter.jpeg", "site_name": "Mergers & Acquisitions, Latest News", "title": "Fusion Acquires TFB, Anticipating Growth in Call Center Software"}, "type": "Article", "brand": "Mergers & Acquisitions, Latest News", "sailthru.date": "2016-03-28 11:55:00", "wordcount": 169, "sailthru.title": "Fusion Acquires TFB, Anticipating Growth in Call Center Software", "featured": 0, "sailthru.tags": "News, Strategic Buyers, Business Services, Tech, Media & Telecom, Tech, Media & Telecom, Fusion Acquires TFB, Anticipating Growth in Call Center Software, technology, communications, telecommunications, cloud software, M&A, business services, Equinix, Tierpoint, data, Article", "sailthru.description": "Equinix and TierPoint have made similar deals recently", "sailthru.image.full": "http://cdn.themiddlemarket.com/media/newspics/callcenter.jpeg"}, "article_summary": "Fusion Acquires TFB, Anticipating Growth in Call Center SoftwareEquinix and TierPoint have made similar deals recentlyData communications provider Fusion Telecommunications International Inc. (Nasdaq: FSNN) has agreed to buy call center software company Technology for Business Corp. (TFB).\nFusion estimates contact center sales to grow to around $14.7 billion by 2020.\nIn other recent data center deals, TierPoint LLC has agreed to buy Cosentry and Equinix Inc. (Nasdaq: EQIX) is adding Bit-isle Inc.\n\u201cThe contact center market is one which we have long targeted and determined there is significant demand for migration to the cloud,\u201d says Fusion CEO Matthew Rosen.\nThe purchase will give New York-based Fusion a range of software products for in the sector."}