{"article_title": "11 Insanely Overpaid Public Employees", "article_keywords": ["overpaid", "11", "football", "university", "va", "employees", "insanely", "salaries", "winning", "chief", "public"], "article_url": "http://www.thefiscaltimes.com/2015/04/22/11-Insanely-Overpaid-Public-Employees", "article_text": "The highest-paid public employee in your state is likely to be a football or basketball coach.\n\nWhile their salaries are often controversial -- Nick Saban, head coach of the University of Alabama\u2019s football team made more than $7 million in 2014 -- some argue that winning coaches can be big revenue drivers for their schools.\n\nSLIDESHOW: 11 Insanely Overpaid Public Employees\n\nMost public employees aren\u2019t riding around in Bentleys, but it\u2019s difficult to justify how much some of them earn. Take the seven-figure pay package of a plastic surgeon in Nevada or the six-figure salary of a small-city police chief in New Jersey.\n\nSuch salaries often defy logic. Why would a small town police chief in New Jersey make more than the governor, Chris Christie? Or why would a VA doctor cash in a higher paycheck than President Barack Obama?\n\nThe most irritating part of these staggering salaries may be that your tax dollars are paying for them.\n\nClick here to see the 11 insanely overpaid public employees\n\nTop Reads from The Fiscal Times:", "article_metadata": {"og": {"site_name": "The Fiscal Times", "description": "The", "title": "11 Insanely Overpaid Public Employees", "url": "http://www.thefiscaltimes.com/2015/04/22/11-Insanely-Overpaid-Public-Employees", "image": "http://cdn.thefiscaltimes.com/sites/default/files/Rick_Pitino.jpg", "type": "article"}, "twitter": {"url": "http://www.thefiscaltimes.com/2015/04/22/11-Insanely-Overpaid-Public-Employees", "image": "http://cdn.thefiscaltimes.com/sites/default/files/Rick_Pitino.jpg", "card": "summary", "title": "The Fiscal Times"}, "viewport": "initial-scale=1, maximum-scale=1", "description": "The", "generator": "Drupal 7 (http://drupal.org)"}, "_id": "\"57477af46914bd0286fe1c24\"", "article_summary": "SLIDESHOW: 11 Insanely Overpaid Public EmployeesMost public employees aren\u2019t riding around in Bentleys, but it\u2019s difficult to justify how much some of them earn.\nClick here to see the 11 insanely overpaid public employeesTop Reads from The Fiscal Times:\nThe highest-paid public employee in your state is likely to be a football or basketball coach.\nThe most irritating part of these staggering salaries may be that your tax dollars are paying for them.\nWhy would a small town police chief in New Jersey make more than the governor, Chris Christie?"}