{"article_title": "Government Propaganda, Then and Now (Updated)", "article_keywords": ["wearing", "updated", "twitter", "season", "image", "account", "young", "barack", "published", "propaganda", "talk", "obama"], "article_url": "http://www.weeklystandard.com/government-propaganda-then-and-now-updated/article/771439", "article_text": "Online humorist Iowahawk took to his own Twitter account to contrast the message and tone of Obama's propaganda poster with one from the American government's past:\n\nThe Twitter account of Barack Obama published an image Tuesday night that seems designed to encourage young Americans to \"talk about getting health insurance\" and Obamacare during the holiday season. The image featured a photograph of a young man wearing what appear to be full-length pajamas and holding a mug. Here's the image:\n\nThe Twitter account of Barack Obama published an image Tuesday night that seems designed to encourage young Americans to \"talk about getting health insurance\" and Obamacare during the holiday season. The image featured a photograph of a young man wearing what appear to be full-length pajamas and holding a mug. Here's the image:\n\nThe Weekly Standard http://assets.weeklystandard.com.s3.amazonaws.com/tws15/images/logo-large.png\n\nThe Weekly Standard\n\n2013\n\nWashington, DC\n\nPolitics\n\nhttp://www.weeklystandard.com/government-propaganda-then-and-now-updated/article/771439\n\n2013-12-18T13:48\n\n2013-12-18T13:33\n\nGovernment Propaganda, Then and Now (Updated)\n\nThe Twitter account of Barack Obama published an image Tuesday night that seems designed to encourage young Americans to talk about getting health insurance and Obamacare during the holiday season. The image featured a photograph of a young man wearing what appear to be full-length pajamas and holding a mug. Here's the image: How do you plan to spend the cold days of December? http://t.co/Rwf5AYc3bG #GetTalking pic.twitter.com/PBQ397yLf4 \u2014 Barack Obama (@BarackObama) December 17, 2013 Online humorist Iowahawk took to his own Twitter account to contrast the message and tone of Obama's propaganda poster with one from the American government's past:\n\nMichael Warren, Obamacare\n\nhttp://cdn.weeklystandard.biz/cache/280x280-7668915bfc58bb9cc57d61fbfcf3eda8.jpg", "article_metadata": {"news_keywords": "Michael Warren,Obamacare", "og": {"site_name": "Weekly Standard", "description": "The Twitter account of Barack Obama published an image Tuesday night that seems designed to encourage young Americans to talk about getting health insurance and Obamacare during the holiday season. The image featured a photograph of a young man wearing what appear to be full-length pajamas and holding a mug. Here's the image:\n\nHow do you plan to spend the cold days of December? http://t.co/Rwf5AYc3bG #GetTalking pic.twitter.com/PBQ397yLf4\n\u2014 Barack Obama (@BarackObama) December 17, 2013\nOnline humorist Iowahawk took to his own Twitter account to contrast the message and tone of Obama's propaganda poster with one from the American government's past:", "title": "Government Propaganda, Then and Now (Updated)", "url": "http://www.weeklystandard.com/government-propaganda-then-and-now-updated/article/771439", "image": "http://cdn.weeklystandard.biz/cache/r960-7668915bfc58bb9cc57d61fbfcf3eda8.jpg", "type": "article"}, "twitter": {"description": "The Twitter account of Barack Obama published an image Tuesday night that seems designed to encourage young Americans to talk about getting health insurance and Obamacare during the holiday season. The image featured a photograph of a young man wearing what appear to be full-length pajamas and holding a mug. Here's the image:\n\nHow do you plan to spend the cold days of December? http://t.co/Rwf5AYc3bG #GetTalking pic.twitter.com/PBQ397yLf4\n\u2014 Barack Obama (@BarackObama) December 17, 2013\nOnline humorist Iowahawk took to his own Twitter account to contrast the message and tone of Obama's propaganda poster with one from the American government's past:", "creator": "@MichaelRWarren", "image": "http://cdn.weeklystandard.biz/cache/r960-7668915bfc58bb9cc57d61fbfcf3eda8.jpg", "title": "Government Propaganda, Then and Now (Updated)", "site": "@weeklystandard", "widgets": {"csp": "on"}, "card": "summary"}, "fb": {"admins": 1285945407}, "google-site-verification": "QxcYUvYDy42iu46zPMF2vwdQlMXsJP74MqOgujGnpaQ", "keywords": "Michael Warren,Obamacare", "article": {"author": "Michael Warren", "published_time": "2013-12-18 13:48", "title": "Government Propaganda, Then and Now (Updated)"}, "viewport": "width=device-width,user-scalable=0"}, "_id": "\"57477af36914bd0286fcce14\"", "article_summary": "http://t.co/Rwf5AYc3bG #GetTalking pic.twitter.com/PBQ397yLf4 \u2014 Barack Obama (@BarackObama) December 17, 2013 Online humorist Iowahawk took to his own Twitter account to contrast the message and tone of Obama's propaganda poster with one from the American government's past:Michael Warren, Obamacarehttp://cdn.weeklystandard.biz/cache/280x280-7668915bfc58bb9cc57d61fbfcf3eda8.jpg\nThe image featured a photograph of a young man wearing what appear to be full-length pajamas and holding a mug.\nHere's the image:The Weekly Standard http://assets.weeklystandard.com.s3.amazonaws.com/tws15/images/logo-large.pngThe Weekly Standard2013Washington, DCPoliticshttp://www.weeklystandard.com/government-propaganda-then-and-now-updated/article/7714392013-12-18T13:482013-12-18T13:33Government Propaganda, Then and Now (Updated)The Twitter account of Barack Obama published an image Tuesday night that seems designed to encourage young Americans to talk about getting health insurance and Obamacare during the holiday season.\nHere's the image:The Twitter account of Barack Obama published an image Tuesday night that seems designed to encourage young Americans to \"talk about getting health insurance\" and Obamacare during the holiday season.\nOnline humorist Iowahawk took to his own Twitter account to contrast the message and tone of Obama's propaganda poster with one from the American government's past:The Twitter account of Barack Obama published an image Tuesday night that seems designed to encourage young Americans to \"talk about getting health insurance\" and Obamacare during the holiday season."}