{"article_title": "Southern Textile taking steps toward relocation", "article_keywords": ["building", "producers", "square", "space", "relocation", "taking", "sts", "southern", "tree", "textile", "state", "rubin", "steps", "double", "company"], "article_url": "http://www.thetowntalk.com/story/news/local/2015/03/21/southern-textile-taking-steps-toward-relocation/25149653/", "article_text": "Southern Textile Services is getting closer to moving a new location that will position the company to double in size.\n\n\u201cDouble our space, double our employees, double our equipment,\u201d said Adam Rubin, owner of the Alexandria-based company that provides linen service to health care facilities.\n\nFounded in 2006, STS currently calls a building on Masonic Drive home. Its work space in that building is about 12,000 square feet, Rubin said.\n\nThe company\u2019s new home \u2014 a building at 1819 Memorial Drive that was the longtime site of Carroll Furniture before it closed in 2013 \u2014 has 25,000 square feet of space for STS, as well as additional space Rubin is leasing for extra revenue.\n\nSTS currently has 57 employees, and Rubin can easily see that number rising to 100 more with the company\u2019s growth pattern. It services facilities throughout the state and in Mississippi.\n\nLast week, the U.S. Department of Agriculture announced a $7.1 million guaranteed loan for the company to remodel the former Carroll building and buy additional equipment.\n\nAgCenter event for timber owners\n\nAn upcoming LSU AgCenter event in Pollock is designed to show how landowners can maximize the value of an existing or future tree farm by taking advantage of the emerging biofuels industry.\n\nThe 2015 Louisiana Natural Resources Symposium will be held at Camp Grant Walker on Aug. 21.\n\nTopics will include economics, weed control, insects and diseases of short rotation stands, tree spacing, genetically improved seedlings, benefits of a consulting forester, alternative tree species, biomass and procurement needs by industry, and state financial assistance.\n\nFor more information, contact Todd Shupe or Niels de Hoop at (225) 578-4131.\n\nFarmers market moving\n\nThe Alexandria Mid-Week Market is moving to its new location starting Tuesday. It will be set up across Jackson Street from First United Methodist Church.\n\nOf note for local producers or budding producers, a guide on the basic steps of selling your product to retailers is available on freshcentral.org.\n\nThe Homegrown Produce Vendor Guide is designed to answer some of the initial questions producers often ask. Look for on the site under the \u201cSell Your Produce\u201d tab.\n\nRead or Share this story: http://www.thetowntalk.com/story/news/local/2015/03/21/southern-textile-taking-steps-toward-relocation/25149653/", "article_metadata": {"google": "notranslate", "description": "Southern Textile Services is getting closer to moving a new location that will position the company to double in size.", "og": {"site_name": "thetowntalk.com", "description": "Southern Textile Services is getting closer to moving a new location that will position the company to double in size.", "title": "Southern Textile taking steps toward relocation", "url": "http://www.thetowntalk.com/story/news/local/2015/03/21/southern-textile-taking-steps-toward-relocation/25149653/", "image": "http://www.gannett-cdn.com/GDContent/applogos/thetowntalk.png", "type": "article"}, "twitter": {"description": "Southern Textile Services is getting closer to moving a new location that will position the company to double in size.", "title": "Southern Textile taking steps toward relocation", "image": "http://www.gannett-cdn.com/GDContent/applogos/thetowntalk.png", "creator": "@TownTalkdotcom", "site": "@TownTalkdotcom", "card": "summary_large_image"}, "ROBOTS": "NOODP, NOYDIR", "apple-itunes-app": "app-id=898045744", "fb": {"app_id": 116986585038108}, "Content-Type": "text/html; charset=UTF-8", "viewport": "width=1070"}, "_id": "\"57477af46914bd0286fdbc54\"", "article_summary": "Southern Textile Services is getting closer to moving a new location that will position the company to double in size.\n\u201cDouble our space, double our employees, double our equipment,\u201d said Adam Rubin, owner of the Alexandria-based company that provides linen service to health care facilities.\nOf note for local producers or budding producers, a guide on the basic steps of selling your product to retailers is available on freshcentral.org.\nIts work space in that building is about 12,000 square feet, Rubin said.\nSTS currently has 57 employees, and Rubin can easily see that number rising to 100 more with the company\u2019s growth pattern."}