{"article_title": "Roy Williams encourages fans to get insured", "article_keywords": ["website", "auriemma", "head", "basketball", "insured", "encourages", "encourage", "sign", "roy", "fans", "health", "white", "williams", "care"], "article_url": "http://www.dailytarheel.com/blog/view-from-the-hill/2014/03/roy-williams-encourages-fans-to-get-insured", "article_text": "Roy Williams encourages fans to get insured\n\nEric Garcia Published 03/17/14 1:33pm\n\nUNC Head Basketball Coach Roy Williams is used to motivating players on the court, and now he\u2019s using some of that influence to encourage people to sign up for health insurance.\n\nIn a video posted on the White House\u2019s website, Williams and University of Connecticut head basketball coach Geno Auriemma encourage basketball fans to sign up for health care through the Affordable Care Act\u2019s health care marketplace.\n\n\u201cYou only got \u2018til March 31st,\u201d Williams said in the video. \u201cBeat the buzzer.\u201d\n\nIn addition, Williams and Auriemma encourage people to head to a page on the White House website where they can vote for the top .GIF images of the Sweet Sixteen reasons to sign up for health insurance.\n\nNot only are Williams and Auriemma rivals on the court, but their home states differ in terms of health care policy.\n\nConnecticut\u2019s health care marketplace is run by its state government and expanded Medicaid eligibility.\n\nNorth Carolina\u2019s marketplace is run through the federal government and its state legislature did not expand Medicaid eligibility.\n\nView from the Hill is a political blog by Daily Tar Heel staff writers. Any opinion expressed in it does not represent the Daily Tar Heel. Email the blog coordinator at dthviewfromthehill@gmail.com.", "article_metadata": {"description": "Daily student newspaper with university, local, and national news and commentary and coverage of Tar Heel basketball.", "generator": "Gryphon 20160217001 (Foundry 6.1-20150615001)", "og": {"site_name": "The Daily Tar Heel", "description": "View from the Hill", "title": "Roy Williams encourages fans to get insured", "url": "http://www.dailytarheel.com/blog/view-from-the-hill/2014/03/roy-williams-encourages-fans-to-get-insured", "image": "http://d39xfl750sfsi8.cloudfront.net/201604217ygrp9dscZ/dist/img/DTH-fb-icon.png", "type": "article"}, "twitter": {"domain": "www.dailytarheel.com", "site": "@dailytarheel", "card": "summary"}, "google-site-verification": "CHlXbXA4sWralvQUEv7pJfpAAlXw8V34QT7XXWre_aU", "viewport": "width=device-width, initial-scale=1.0, minimum-scale=1.0, maximum-scale=1.0, user-scalable=no"}, "_id": "\"57477af46914bd0286fd9d8c\"", "article_summary": "Roy Williams encourages fans to get insuredEric Garcia Published 03/17/14 1:33pmUNC Head Basketball Coach Roy Williams is used to motivating players on the court, and now he\u2019s using some of that influence to encourage people to sign up for health insurance.\nIn a video posted on the White House\u2019s website, Williams and University of Connecticut head basketball coach Geno Auriemma encourage basketball fans to sign up for health care through the Affordable Care Act\u2019s health care marketplace.\nNot only are Williams and Auriemma rivals on the court, but their home states differ in terms of health care policy.\nConnecticut\u2019s health care marketplace is run by its state government and expanded Medicaid eligibility.\n\u201cYou only got \u2018til March 31st,\u201d Williams said in the video."}