{"article_title": "7 OTC Product Categories Completely Covered by Insurance", "article_keywords": ["product", "prescription", "provide", "otc", "cover", "patients", "completely", "health", "covered", "preventive", "insurance", "categories", "care"], "article_url": "http://www.pharmacytimes.com/news/8-otc-product-categories-completely-covered-by-insurance", "article_text": "7 OTC Product Categories Completely Covered by Insurance\n\nKatie Eder, Senior Editor\n\nDid you know that health plans completely cover certain OTC products when patients present a prescription?Under Affordable Care Act requirements, insurers must cover certain OTC preventive medications at 100% with no co-pays, co-insurance, or deductibles, but only when the patient obtains a prescription.In addition, health care reform rules effective January 1, 2011, allow distributions from health flexible spending arrangements (FSAs) and health reimbursement arrangements (HRAs) to reimburse the cost of OTC medicines or drugs when they are purchased with a prescription. Eligible prescribed OTC expenses that Aetna FSAs may pay, for example, are OTC acid controllers, anti-diarrheals, cold sore remedies, sleep aids, painkillers, and respiratory treatments, among others.To get these OTC expenses reimbursed from their employer\u2019s health FSA or HRA, patients need to provide documentation such as a customer receipt issued by a pharmacy that reflects the date of sale and the amount of the charge, along with a copy of the prescription, according to the Internal Revenue Service.To provide pharmacists with opportunities to add value to patient counseling by informing their patients of these potential medication cost savings, Pharmacy Times reached out to America\u2019s largest health insurers to find out which OTC product categories they cover when the medicines are age-, gender-, and condition-appropriate and prescribed by a licensed health care professional for preventive care purposes.The 7 OTC product categories where complete coverage overlaps across UnitedHealthcare, Anthem, Aetna, Cigna, and Humana are as follows:", "article_metadata": {"keywords": "OTC,insurance,UnitedHealthcare,Humana,Aetna,Anthem,Cigna,Technician-news,", "og": {"type": "Article", "image": "http://pharmacytimes.s3.amazonaws.com/v1_media/_upload_image/_thumbnails/PharmacistCounseling_opt300x121.png", "site_name": "Pharmacy Times", "description": "Did you know that health plans completely cover certain OTC products when patients present a prescription?", "title": "7 OTC Product Categories Completely Covered by Insurance"}, "description": "Did you know that health plans completely cover certain OTC products when patients present a prescription?"}, "article_summary": "7 OTC Product Categories Completely Covered by InsuranceKatie Eder, Senior EditorDid you know that health plans completely cover certain OTC products when patients present a prescription?Under Affordable Care Act requirements, insurers must cover certain OTC preventive medications at 100% with no co-pays, co-insurance, or deductibles, but only when the patient obtains a prescription.In addition, health care reform rules effective January 1, 2011, allow distributions from health flexible spending arrangements (FSAs) and health reimbursement arrangements (HRAs) to reimburse the cost of OTC medicines or drugs when they are purchased with a prescription.\nEligible prescribed OTC expenses that Aetna FSAs may pay, for example, are OTC acid controllers, anti-diarrheals, cold sore remedies, sleep aids, painkillers, and respiratory treatments, among others.To get these OTC expenses reimbursed from their employer\u2019s health FSA or HRA, patients need to provide documentation such as a customer receipt issued by a pharmacy that reflects the date of sale and the amount of the charge, along with a copy of the prescription, according to the Internal Revenue Service.To provide pharmacists with opportunities to add value to patient counseling by informing their patients of these potential medication cost savings, Pharmacy Times reached out to America\u2019s largest health insurers to find out which OTC product categories they cover when the medicines are age-, gender-, and condition-appropriate and prescribed by a licensed health care professional for preventive care purposes.The 7 OTC product categories where complete coverage overlaps across UnitedHealthcare, Anthem, Aetna, Cigna, and Humana are as follows:"}