{"article_title": "Riverside Exits Another Company in Blood Test Equipment Manufacturer Diatron", "article_keywords": ["firm", "group", "exits", "stratec", "company", "diatron", "hematology", "equipment", "blood", "pe", "test", "riverside", "sold", "manufacturer"], "article_url": "http://www.themiddlemarket.com/news/healthcare/riverside-exits-another-company-260202-1.html", "article_text": "Riverside Exits Another Company in Blood Test Equipment Manufacturer Diatron\n\nThe PE firm recently sold Emergency Communications and Orliman\n\nThe Riverside Co. has agreed to sell hematology equipment maker Diatron Group to Germany\u2019s Stratec Biomedical Group, as the PE firm continues to exit portfolio companies. Riverside won Mergers & Acquisitions\u2019 2015 Seller of the Year for exiting seven investments and making it one of the most frequent sellers of companies in the middle market.\n\nDiatron, founded in 1989, produces hematology analyzers. Riverside says Diatron has grown significantly under the firm\u2019s ownership through new products and geographic expansion. In 2008, Diatron, based in Budapest, Hungary, acquired another hematology analyzer producer in Metrolab. Riverside invested in Diatron in 2005. \u201cThese and other operational efforts, helped Diatron more than triple its turnover since Riverside\u2019s acquisition,\u201d says Riverside operating partner Fabio Pesiri. Stratec, located in Birkenfeld, Germany also makes testing and other medical equipment.\n\nIn 2015, Riverside sold Emergency Communications Network (ECN) to Veritas Capital. The Cleveland-based firm also sold Orliman, a Valencia, Spain-based manufacturer and distributor of non-invasive orthopedic devices, to Magnum Capital. Lincoln International and Allen & Overy are advising Riverside on the Diatron Sale.\n\nFor more information on related topics, visit the following:", "article_metadata": {"status": "open", "domain": "Mergers & Acquisitions", "sailthru.author": "Demitri Diakantonis", "sailthru.expire_date": "2016-04-24 12:32:00", "og": {"url": "http://www.themiddlemarket.com/news/healthcare/riverside-exits-another-company-260202-1.html", "image": "http://cdn.themiddlemarket.com/media/newspics/stratec.jpeg", "site_name": "Mergers & Acquisitions, Latest News", "title": "Riverside Exits Another Company in Blood Test Equipment Manufacturer Diatron"}, "type": "Article", "brand": "Mergers & Acquisitions, Latest News", "sailthru.date": "2016-03-24 12:32:00", "wordcount": 170, "sailthru.title": "Riverside Exits Another Company in Blood Test Equipment Manufacturer Diatron", "featured": 0, "sailthru.tags": "News, Private Equity, Manufacturing, Health Care, Health Care, Riverside Exits Another Company in Blood Test Equipment Manufacturer Diatron, private equity, health care, medical devices, manufacturing, Emergency Communications, Orliman, Seller of the Year, Veritas Capital, Magnum Capital, M&A, Lincoln International, Metrolab, Article", "sailthru.description": "The PE firm recently sold Emergency Communications and Orliman", "sailthru.image.full": "http://cdn.themiddlemarket.com/media/newspics/stratec.jpeg"}, "article_summary": "Riverside Exits Another Company in Blood Test Equipment Manufacturer DiatronThe PE firm recently sold Emergency Communications and OrlimanThe Riverside Co. has agreed to sell hematology equipment maker Diatron Group to Germany\u2019s Stratec Biomedical Group, as the PE firm continues to exit portfolio companies.\nIn 2015, Riverside sold Emergency Communications Network (ECN) to Veritas Capital.\nRiverside says Diatron has grown significantly under the firm\u2019s ownership through new products and geographic expansion.\nThe Cleveland-based firm also sold Orliman, a Valencia, Spain-based manufacturer and distributor of non-invasive orthopedic devices, to Magnum Capital.\n\u201cThese and other operational efforts, helped Diatron more than triple its turnover since Riverside\u2019s acquisition,\u201d says Riverside operating partner Fabio Pesiri."}