{"article_title": "Mass. teen killed in Israel terror attack", "article_keywords": ["teen", "israel", "yeshiva", "schwartz", "palestinian", "west", "school", "attack", "near", "mass", "terror", "killed", "man"], "article_url": "http://newbostonpost.com/2015/11/21/mass-teen-killed-in-israel-terror-attack/", "article_text": "Mass. teen killed in Israel terror attack\n\nPrinted from: http://newbostonpost.com/2015/11/21/mass-teen-killed-in-israel-terror-attack/\n\n(Photo via Facebook)\n\nA teenager from Sharon, Mass., was one of three people murdered in Israel on Thursday afternoon when a Palestinian man attacked cars stuck in traffic in the West Bank.\n\nEzra Schwartz, 18, a recent high school graduate, was spending a \u201cgap year\u201d in Israel studying and performing community service through a program at Yeshiva Ashreinu. Schwartz and five other yeshiva students were in a minivan driving to bring snacks to Israeli Defense Force soldiers when the gunman opened fire with a submachine gun on a road near the settlement of Alon Shvut.\n\nThe Times of Israel has identified the shooter as 24-year-old Mohammed Abdel Basset al-Kharoub, from the West Bank Village of Dir Smat near Hebron.\n\nA spokesperson for the U.S. State Department, told The Jerusalem Post that the U.S. \u201ccondemn(s) these terrorist attacks against innocent civilians in the strongest possible terms.\u201d\n\nSchwartz, a graduate of the Maimonides School, a Jewish Day School in Brookline, planned to attend Rutgers University in New Jersey next fall, according to the Jewish Daily Forward.\n\nA 49-year-old Israeli man and a 24-year-old Palestinian man were also killed in the attack. Police arrested al-Kharoub at the scene after he intentionally rammed his car into another vehicle.\n\nPlease enable JavaScript to view the comments powered by Disqus.", "article_metadata": {"shareaholic": {"site_name": "NewBostonPost", "language": "en-US", "url": "http://newbostonpost.com/2015/11/21/mass-teen-killed-in-israel-terror-attack/", "article_author_name": "NBP Staff", "image": "http://newbostonpost.com/wp-content/uploads/2015/11/Picture-e1453996734508.jpg", "site_id": "ab905d8abdbd23a369259b08e0927728", "shareable_page": "true", "keywords": "ezra schwartz, Israel, Massachusetts, Palestine, rutgers university, sharon, terrorist attack, west bank"}, "description": "A teenager from Sharon, Mass., was one of three people murdered in Israel on Thursday afternoon when a Palestinian man attacked cars stuck in traffic in the", "generator": "WordPress 4.5.2", "og": {"image": "http://newbostonpost.com/wp-content/uploads/2015/11/Picture-e1453996734508.jpg"}, "keywords": "israel,palestine,west bank,terrorist attack,sharon,massachusetts,rutgers university,ezra schwartz", "viewport": "width=device-width, initial-scale=1.0"}, "article_summary": "teen killed in Israel terror attackPrinted from: http://newbostonpost.com/2015/11/21/mass-teen-killed-in-israel-terror-attack/(Photo via Facebook)A teenager from Sharon, Mass., was one of three people murdered in Israel on Thursday afternoon when a Palestinian man attacked cars stuck in traffic in the West Bank.\nA 49-year-old Israeli man and a 24-year-old Palestinian man were also killed in the attack.\nEzra Schwartz, 18, a recent high school graduate, was spending a \u201cgap year\u201d in Israel studying and performing community service through a program at Yeshiva Ashreinu.\nThe Times of Israel has identified the shooter as 24-year-old Mohammed Abdel Basset al-Kharoub, from the West Bank Village of Dir Smat near Hebron.\nPolice arrested al-Kharoub at the scene after he intentionally rammed his car into another vehicle."}