{"article_title": "Life After White House", "article_keywords": ["life", "whats", "whatya", "house", "ideas", "send", "yesterday", "roksanabisnowcom", "white", "newsletter"], "article_url": "https://www.bisnow.com/archives/newsletter/dc-legal/2475-life-after-white-house", "article_text": "If you don't see images, click here to view\n\nStory Ideas . Events\n\nTo ensure delivery, please add newsletter@bisnow.com to your address book, learn how Life After White House What are you doing this summer? Send a picture of your barbecues, beach visits, or vacations to Roksana@Bisnow.com and we'll feature some here. Yesterday, we caught up with Ed Pagano, who joined Akin Gump after two years as White House deputy assistant to the President for legislative affairs. What's life like post-White House?\n\nFrom HHS to Crowell & Moring Whatya Know About\n\nPublic-Private Partnerships? The Citi Open! It's already Aug. 1! On this day in history, Francis Scott Key (1779) and Herman Melville (1819) were both born. Send story ideas to Roksana@Bisnow.com CONTACT\n\nEDITORIAL ADVERTISING CONTACT\n\nwhitney.cohn@bisnow.com CONTACT\n\nGENERAL INFO This newsletter is a journalistic news source which accepts no payment for featured interviews. It is supported by conventional advertisers clearly identified in the right hand column. You have been selected to receive it either through prior contact or professional association. If you have received it in error, please accept our apologies and unsubscribe at bottom of the newsletter. \u00a9 2013, Bisnow LLC, 1817 M St., NW, Washington, DC 20036. All rights reserved.", "article_metadata": {"og": {"image": "https://www.bisnow.com/img/bisnow.PNG", "site_name": "Bisnow", "description": "", "title": "Life After White House"}, "twitter": {"site": "@bisnow", "image": "https://www.bisnow.com/img/bisnow.PNG", "description": "", "card": "summary", "title": "Life After White House"}, "description": "", "viewport": "width=device-width, minimal-ui", "format-detection": "telephone=no"}, "article_summary": "EventsTo ensure delivery, please add newsletter@bisnow.com to your address book, learn how Life After White House What are you doing this summer?\nYesterday, we caught up with Ed Pagano, who joined Akin Gump after two years as White House deputy assistant to the President for legislative affairs.\nWhat's life like post-White House?\nSend story ideas to Roksana@Bisnow.com CONTACTEDITORIAL ADVERTISING CONTACTwhitney.cohn@bisnow.com CONTACTGENERAL INFO This newsletter is a journalistic news source which accepts no payment for featured interviews.\nSend a picture of your barbecues, beach visits, or vacations to Roksana@Bisnow.com and we'll feature some here."}