{"article_title": "\u2018He Is Over Her\u2019 \u2018We Can\u2019t Stop\u2019 Singer Pushed \u2018Paranoia\u2019 Actor to the Limit After VMA Performance, Wedding Off", "article_keywords": ["wants", "singer", "source", "straw", "couple", "stop", "paranoia", "actor", "vma", "break", "pushed", "cant", "vmas", "limit", "wedding", "performance", "hemsworth", "cyrus"], "article_url": "http://www.fashionnstyle.com/articles/11058/20130907/miley-cyrus-liam-hemsworth-2013-break-up-over-we-cant-stop-singer-paranoia-actor-limit-vma-performance-wedding-off.htm", "article_text": "Celebrity Hot News\n\nMiley Cyrus, Liam Hemsworth 2013 Break Up: \u2018He Is Over Her\u2019 \u2018We Can\u2019t Stop\u2019 Singer Pushed \u2018Paranoia\u2019 Actor to the Limit After VMA Performance, Wedding Off\n\nSIGN UP TO RECEIVE THE LATEST NEWS FROM FASHION&STYLE\n\n(Photo : Twitter/@staralbum)\n\nMiley Cyrus' performance at the VMAs was apparently the last straw for fiance Liam Hemsworth. Perhaps the on-and-off relationship for the \"Hunger Games\" star is over as it looks like he is ready to call it quits once and for all.\n\n\n\nMiley Cyrus\u2019 MTV VMA performance definitely sparked some interesting reactions and didn\u2019t earn a lot of praise, especially from her current boyfriend.\n\n\n\n\u201cHe is over her and wants to make a clean break,\u201d said a source to Us Magazine. \u201cNo more back and forth.\u201d\n\n\n\nThe source also added that apparently Hemsworth is just weeks away from permanently calling it off.\n\n\n\nCurrently, the couple reside together at Cyrus\u2019 home in L.A.\u2019s Toluca Lake. However, they are acting as if they are roommates rather than lovers.\n\n\n\n\u201cThey\u2019re not even sleeping in the same room,\u201d said another source to the magazine.\n\n\n\nHemsworth wasn\u2019t at the awards show, however he noticed the buzz about his girlfriend\u2019s performance and the attention it got. His family doesn\u2019t seem too happy about it either and is urging him to break things off.\n\n\n\nCyrus and Hemsworth are rumored to be on the rocks following the \u201cWe Can\u2019t Stop\u201d singer\u2019s performance with Robin Thicke to \u201cBlurred Lines.\u201d Hemsworth was not pleased with the show they put on and called it \u201cmortifying.\u201d\n\n\n\n\u201cThe VMAs is the straw that will break him,\u201d said a source. \u201cHe wants out of the relationship.\u201d\n\n\n\nThe actor and singer have been on and off in recent months, and sometimes act \u201cas if they were strangers.\u201d\n\n\n\nThe couple was last seen together at the premiere of Hemsworth\u2019s movie, \u201cParanoia,\u201d in Los Angeles on August 8. The couple decided to spend time apart over the Labor Day weekend after Hemsworth flew to London to support his brother at the world premiere of his new movie, \u201cRush.\u201d\n\n\n\nSIGN UP TO RECEIVE THE LATEST NEWS FROM FASHION&STYLE\n\n\u00a9 2015 Fashion & Style.com All rights reserved. Do not reproduce without permission.", "article_metadata": {"Description": "Miley Cyrus\u2019 performance at the VMAs was apparently the last straw for fiance Liam Hemsworth. Perhaps the on-and-off relationship for the \u201cHunger Games\u201d star is over as it looks like he is ready to call it quits once and for all.", "Copyright": "2014 Fashion&Style", "Author": "Fashion&Style", "og": {"site_name": "Fashion & Style", "description": "Miley Cyrus\u2019 performance at the VMAs was apparently the last straw for fiance Liam Hemsworth. Perhaps the on-and-off relationship for the \u201cHunger Games\u201d star is over as it looks like he is ready to call it quits once and for all.", "title": "Miley Cyrus, Liam Hemsworth 2013 Break Up: \u2018He Is Over Her\u2019 \u2018We Can\u2019t Stop\u2019 Singer Pushed \u2018Paranoia\u2019 Actor to the Limit After VMA Performance, Wedding Off", "url": "http://www.fashionnstyle.com/articles/11058/20130907/miley-cyrus-liam-hemsworth-2013-break-up-over-we-cant-stop-singer-paranoia-actor-limit-vma-performance-wedding-off.htm", "image": "http://images.fashionnstyle.com/data/images/full/15604/miley-cyrus-and-liam-hemsworth.png", "type": "article"}, "twitter": {"domain": "fashionnstyle.com", "description": "Miley Cyrus\u2019 performance at the VMAs was apparently the last straw for fiance Liam Hemsworth. Perhaps the on-and-off relationship for the \u201cHunger Games\u201d star is over as it looks like he is ready to call it quits once and for all.", "title": "Miley Cyrus, Liam Hemsworth 2013 Break Up: \u2018He Is Over Her\u2019 \u2018We Can\u2019t Stop\u2019 Singer Pushed \u2018Paranoia\u2019 Actor to the Limit After VMA Performance, Wedding Off", "url": "http://www.fashionnstyle.com/articles/11058/20130907/miley-cyrus-liam-hemsworth-2013-break-up-over-we-cant-stop-singer-paranoia-actor-limit-vma-performance-wedding-off.htm", "image": "http://images.fashionnstyle.com/data/images/full/15604/miley-cyrus-and-liam-hemsworth.png", "creator": "@FNStylecom", "site": "@FNStylecom", "card": "summary_large_image"}, "syndication-source": "http://www.fashionnstyle.com/articles/11058/20130907/miley-cyrus-liam-hemsworth-2013-break-up-over-we-cant-stop-singer-paranoia-actor-limit-vma-performance-wedding-off.htm", "robots": "index, follow", "Title": "Fashion&Style offers online coverage of latest fashion news, hottest trends and celebrity style from around the world, unveiling fashion and style from street corners to runways and red carpets.", "Googlebot-news": "index, follow", "Keywords": "Fashion&Style", "article": {"published_time": "2013-09-07"}, "news_keywords": "miley, cyrus, liam, hemsworth, 2013, break, up, over, we, cant, stop, singer, paranoia, actor, limit, vma, performance, wedding, off", "viewport": "width=device-width", "Subject": "fashionnstyle.com"}, "_id": "\"57477af36914bd0286fce0a0\"", "article_summary": "Miley Cyrus\u2019 MTV VMA performance definitely sparked some interesting reactions and didn\u2019t earn a lot of praise, especially from her current boyfriend.\nCelebrity Hot NewsMiley Cyrus, Liam Hemsworth 2013 Break Up: \u2018He Is Over Her\u2019 \u2018We Can\u2019t Stop\u2019 Singer Pushed \u2018Paranoia\u2019 Actor to the Limit After VMA Performance, Wedding OffSIGN UP TO RECEIVE THE LATEST NEWS FROM FASHION&STYLE(Photo : Twitter/@staralbum)Miley Cyrus' performance at the VMAs was apparently the last straw for fiance Liam Hemsworth.\nHemsworth wasn\u2019t at the awards show, however he noticed the buzz about his girlfriend\u2019s performance and the attention it got.\n\u201cHe is over her and wants to make a clean break,\u201d said a source to Us Magazine.\n\u201cNo more back and forth.\u201dThe source also added that apparently Hemsworth is just weeks away from permanently calling it off."}