{"article_title": "People Moves: Carlyle, Guggenheim, Victory Park", "article_keywords": ["carlyle", "focuses", "ma", "previously", "guggenheim", "llp", "park", "joined", "recently", "hired", "victory", "promoted", "partner", "firms", "moves"], "article_url": "http://www.themiddlemarket.com/news/people_moves/people-moves-carlyle-guggenheim-victory-park-260068-1.html", "article_text": "People Moves: Carlyle, Guggenheim, Victory Park\n\nCarlyle adds operating executive; Guggenheim expands restructuring group; Victory Park hires Upacala Mapatuna as chief investment officer\n\nMichele Alexander was hired by Bracewell LLP as a partner. Alexander, most recently with Lowenstein Sandler LLP, advises companies on M&A, securities and other capital markets matters.\n\nTerrence Allen has joined Pepper Hamilton LLP as a partner. Allen, previously with Gibson Dunn & Crutcher LLP, concentrates on M&A, asset sales and recapitalizations.\n\nFernando Araya was hired by Antarctica Advisors International Corp. to lead the firm\u2019s new office in Chile. Araya previously led Rabobank\u2019s M&A team in Chile.\n\nThomas Bremner has been promoted to partner at Adams Street Partners. Bremner, who has been with the PE firm since 2013, focuses on growth equity investments in the health care sector.\n\nRyan Budlong was promoted to managing director at Harris Williams & Co. Budlong focuses on M&A in the food and beverage, restaurants and retail sectors.\n\nOliver Currall is now with Sidley Austin LLP as a partner. Currall, most recently with Kirkland & Ellis LLP, advises private equity firms on tax matters related to M&A.\n\nErik Dahl has joined Sidley Austin as a partner. Dahl, previously with Kirkland & Ellis, concentrates on M&A and cross-border leveraged buyouts.\n\nFrank Dworak has been promoted to partner at K&L Gates. He represents clients on tax matters related to M&A.\n\nStuart Erickson has joined Guggenheim Securities\u2019 restructuring group as a senior managing director. Erickson, most recently with Miller Buckfire, focuses on restructuring and recapitalizations.\n\nRichard Farley was hired by Kramer Levin Naftalis & Frankel LLP as a partner. Farley, most recently with Paul Hastings, will chair the firm\u2019s leveraged finance group.\n\nJohn Geaneotes is now with BMI Mergers & Acquisitions as an M&A adviser. Geaneotes, previously with Deloitte Consulting, focuses on M&A in the life sciences and manufacturing sectors.\n\nJoseph Goldrick has been promoted to partner at Adams Street Partners. Goldrick is responsible for the firm\u2019s North American and Latin American secondary investments.\n\nRen\u00e9e James was hired by the Carlyle Group (Nasdaq: CG) as an operating executive in the telecommunications, media and technology group. James, a former Intel Corp. (Nasdaq: INTC) president, will advise the PE firm on operational and due diligence for potential sector investments.\n\nWilliam Kuntz has joined Peak Rock Capital as a principal. Kuntz, most recently with Housatonic Partners, will focus on investments in the technology sector.\n\nAdam Larson has joined Kirkland & Ellis as a partner. Larson, previously with Vinson & Elkins LLP, advises private equity firms on M&A in the energy, consumer and financial services sectors.\n\nRobert Lee is now with Rimon Law as a partner. Lee, previously with Foley & Lardner LLP, concentrates on cross-border deals in Asia and Latin America.\n\nBrennan Libbey was hired by Livingstone as a partner. Libbey will head the firm\u2019s Los Angeles office and business services group.\n\nUpacala Mapatuna (pictured) has joined Victory Park Capital as chief investment officer. Mapatuna, most recently with Goldman Sachs Group Inc. (NYSE: GS) will oversee Victory Park\u2019s current and future funds.\n\nJames McNerney Jr. has joined Clayton Dubilier & Rice as a senior adviser. McNerney, a former Boeing Co. (NYSE: BA) CEO, will assist the PE firm in evaluating potential investments and creating strategies for portfolio companies.\n\nRandall Mehrberg has joined Jenner & Block as a partner. Mehrberg, most recently with Vail Resorts, concentrates on restructuring and bankruptcy.\n\nFrank Monaco was hired by Mayer Brown as a partner. Monaco, most recently with Hogan Lovells, represents insurance companies, investment banks and other financial service firms on M&A.\n\nNaomi Ogan has been promoted to partner at K&L Gates. Ogan concentrates on M&A, venture capital and other financings.\n\nFatema Orjela was hired by Sidley Austin as a partner. Orjela, previously with Kirkland & Ellis, concentrates on M&A in private equity.\n\nMichael Parisi was hired by Alston & Bird as a partner. Parisi, previously with McGuireWoods LLP, focuses on M&A financing and debt restructuring in the health care, media, retail and manufacturing sectors.\n\nHarsh Patel was promoted to Principal at Victory Park Capital. Patel is responsible for making investments in middle market companies outside the U.S.\n\nLauren Pryor has been promoted to partner at K&L Gates. Pryor focuses on M&A and divestitures.\n\nBryan Robson has joined Sidley Austin as a partner. Robson, mostly with Kirkland & Ellis, advises lenders on acquisitions.\n\nPatrick Rogers has been promoted to partner at K&L Gates. Rogers focuses on M&A along with other corporate transactions.\n\nVittorio Salvadori di Wiesenhoff has been promoted to partner at K&L Gates. He advises on tax matters related to M&A and private equity.\n\nSava Savov has joined Sidley Austin as a partner. Savov, previously with Kirkland & Ellis, focuses on all aspects in private equity.\n\nTom Schramkowski was hired by Seyfarth Shaw as a partner. Schramkowski, most recently with Troutman Sanders LLP, focuses on M&A in the agriculture, technology, manufacturing and energy sectors.\n\nBrent Spiller has been promoted to managing director at Harris Williams & Co. Spiller advises clients on M&A in the lifestyle brand along with the garden and pet sectors.\n\nGordon Watson was promoted to partner at Victory Park Capital. Watson focuses on direct private debt and equity investments in the specialty finance sector.\n\nMorgan Webber has been promoted to partner at Adams Street Partners. Webber focuses on the firm\u2019s U.S. health care and consumer portfolio.\n\nMatt White has been promoted to managing director at Harris Williams & Co. White concentrates on M&A in the energy and power sectors.\n\nLaila Worrell was hired as a managing director in the Boston Consulting Group\u2019s private equity practice. Worrell, previously with Accenture, will advise investment firms on due diligence.\n\nAchi Yaffe was hired by GI Partners as an operating principal. Yaffe, previously with Lee Equity Partners, will support the PE firm\u2019s portfolio companies.\n\nMichael Zappert has been promoted to partner at Adams Street Partners. Zappert is responsible for sourcing late stage venture capital investments in the software and technology space.\n\nFor more information on related topics, visit the following:", "article_metadata": {"status": "open", "domain": "Mergers & Acquisitions", "sailthru.author": "Demitri Diakantonis", "sailthru.expire_date": "2016-04-08 06:30:00", "og": {"url": "http://www.themiddlemarket.com/news/people_moves/people-moves-carlyle-guggenheim-victory-park-260068-1.html", "image": "http://cdn.themiddlemarket.com/media/newspics/upacala.jpeg", "site_name": "Mergers & Acquisitions, Latest News", "title": "People Moves: Carlyle, Guggenheim, Victory Park"}, "sailthru.description": "Carlyle adds operating executive; Guggenheim expands restructuring group; Victory Park hires Upacala Mapatuna as chief investment officer", "brand": "Mergers & Acquisitions, Latest News", "sailthru.date": "2016-03-08 06:30:00", "wordcount": 984, "sailthru.title": "People Moves: Carlyle, Guggenheim, Victory Park", "featured": 0, "sailthru.tags": "News, Private Equity, Investment Banking, Financial Services, People Moves, People Moves, People Moves: Carlyle, Guggenheim, Victory Park, private equity, investment banking, financial services, operating executives, restructuring, Kirkland & Ellis, law firms, middle market, M&A, Harris Williams, Article", "type": "Article", "sailthru.image.full": "http://cdn.themiddlemarket.com/media/newspics/upacala.jpeg"}, "article_summary": "People Moves: Carlyle, Guggenheim, Victory ParkCarlyle adds operating executive; Guggenheim expands restructuring group; Victory Park hires Upacala Mapatuna as chief investment officerMichele Alexander was hired by Bracewell LLP as a partner.\nParisi, previously with McGuireWoods LLP, focuses on M&A financing and debt restructuring in the health care, media, retail and manufacturing sectors.\nSchramkowski, most recently with Troutman Sanders LLP, focuses on M&A in the agriculture, technology, manufacturing and energy sectors.\nGordon Watson was promoted to partner at Victory Park Capital.\nLarson, previously with Vinson & Elkins LLP, advises private equity firms on M&A in the energy, consumer and financial services sectors."}