{"article_title": "The Weekly Standard", "article_keywords": ["jindal", "shown", "bobby", "republicans", "governor", "standard", "secret", "replace", "louisiana", "urgency", "weekly"], "article_url": "http://www.weeklystandard.com/ponnuru-v.-jindal/article/839035", "article_text": "It's no secret that Republicans are divided both about how to replace Obamacare and about the urgency of coming up with an alternative plan. Louisiana Governor Bobby Jindal has just escalated that internal debate -- and shown why his side should lose it.\n\nThe Weekly Standard http://assets.weeklystandard.com.s3.amazonaws.com/tws15/images/logo-large.png\n\nThe Weekly Standard\n\n2015\n\nWashington, DC\n\nPolitics\n\nhttp://www.weeklystandard.com/ponnuru-v.-jindal/article/839035\n\n2015-02-04T13:08\n\n2015-02-04T13:00\n\nPonnuru v. Jindal\n\nRamesh Ponnuru is no fan of the bizarre, anti-intellectual jeremiad that Louisiana Governor Bobby Jindal launched in Politico Magazine early this week. At Bloomberg View, Ponnuru writes: It's no secret that Republicans are divided both about how to replace Obamacare and about the urgency of coming up with an alternative plan. Louisiana Governor Bobby Jindal has just escalated that internal debate -- and shown why his side should lose it.\n\nBobby Jindal, Ethan Epstein, health insurance, Obamacare\n\nhttp://cdn.weeklystandard.biz/cache/280x280-.jpg", "article_metadata": {"news_keywords": "Bobby Jindal,Ethan Epstein,health insurance,Obamacare", "og": {"url": "http://www.weeklystandard.com/ponnuru-v.-jindal/article/839035", "type": "article", "site_name": "Weekly Standard", "description": "Ramesh Ponnuru is no fan of the&nbsp;bizarre, anti-intellectual jeremiad&nbsp;that Louisiana Governor Bobby Jindal launched in&nbsp;Politico Magazine&nbsp;early this week. At&nbsp;Bloomberg View, Ponnuru writes:\n\nIt's no secret that Republicans are divided both about how to replace Obamacare and about the urgency of coming up with an alternative plan. Louisiana Governor Bobby Jindal has just escalated that internal debate -- and shown why his side should lose it.&nbsp;", "title": "Ponnuru v. Jindal"}, "twitter": {"description": "Ramesh Ponnuru is no fan of the&nbsp;bizarre, anti-intellectual jeremiad&nbsp;that Louisiana Governor Bobby Jindal launched in&nbsp;Politico Magazine&nbsp;early this week. At&nbsp;Bloomberg View, Ponnuru writes:\n\nIt's no secret that Republicans are divided both about how to replace Obamacare and about the urgency of coming up with an alternative plan. Louisiana Governor Bobby Jindal has just escalated that internal debate -- and shown why his side should lose it.&nbsp;", "creator": "@ethanepstiiiine", "title": "Ponnuru v. Jindal", "site": "@weeklystandard", "widgets": {"csp": "on"}, "card": "summary"}, "fb": {"admins": 1285945407}, "google-site-verification": "QxcYUvYDy42iu46zPMF2vwdQlMXsJP74MqOgujGnpaQ", "keywords": "Bobby Jindal,Ethan Epstein,health insurance,Obamacare", "article": {"author": "Ethan Epstein", "published_time": "2015-02-04 13:08", "title": "Ponnuru v. Jindal"}, "viewport": "width=device-width,user-scalable=0"}, "_id": "\"57477af36914bd0286fce1a2\"", "article_summary": "The Weekly Standard http://assets.weeklystandard.com.s3.amazonaws.com/tws15/images/logo-large.pngThe Weekly Standard2015Washington, DCPoliticshttp://www.weeklystandard.com/ponnuru-v.-jindal/article/8390352015-02-04T13:082015-02-04T13:00Ponnuru v. JindalRamesh Ponnuru is no fan of the bizarre, anti-intellectual jeremiad that Louisiana Governor Bobby Jindal launched in Politico Magazine early this week.\nLouisiana Governor Bobby Jindal has just escalated that internal debate -- and shown why his side should lose it.\nBobby Jindal, Ethan Epstein, health insurance, Obamacarehttp://cdn.weeklystandard.biz/cache/280x280-.jpg\nIt's no secret that Republicans are divided both about how to replace Obamacare and about the urgency of coming up with an alternative plan.\nAt Bloomberg View, Ponnuru writes: It's no secret that Republicans are divided both about how to replace Obamacare and about the urgency of coming up with an alternative plan."}