{"article_title": "CNN: Obamacare Enrollment Numbers 'Complete Disaster'", "article_keywords": ["website", "jake", "disaster", "healthcaregov", "borger", "federal", "enrollment", "obamacare", "health", "numbers", "cnn", "insurance", "complete"], "article_url": "http://www.weeklystandard.com/cnn-obamacare-enrollment-numbers-complete-disaster/article/767050", "article_text": "The federal health insurance exchange website created by Obamacare has been a \"complete disaster\" said CNN analyst Gloria Borger. Speaking on Jake Tapper's program Wednesday afternoon, Borger was asked to respond to the enrollment numbers released by the administration following the first month of healthcare.gov and the several state-run exchanges across the country.\n\nThe federal health insurance exchange website created by Obamacare has been a \"complete disaster\" said CNN analyst Gloria Borger. Speaking on Jake Tapper's program Wednesday afternoon, Borger was asked to respond to the enrollment numbers released by the administration following the first month of healthcare.gov and the several state-run exchanges across the country.\n\nThe Weekly Standard http://assets.weeklystandard.com.s3.amazonaws.com/tws15/images/logo-large.png\n\nThe Weekly Standard\n\n2013\n\nWashington, DC\n\nPolitics\n\nhttp://www.weeklystandard.com/cnn-obamacare-enrollment-numbers-complete-disaster/article/767050\n\n2013-11-13T16:03\n\n2013-11-13T15:05\n\nCNN: Obamacare Enrollment Numbers 'Complete Disaster'\n\nThe federal health insurance exchange website created by Obamacare has been a complete disaster said CNN analyst Gloria Borger. Speaking on Jake Tapper's program Wednesday afternoon, Borger was asked to respond to the enrollment numbers released by the administration following the first month of healthcare.gov and the several state-run exchanges across the country. A total of 106,185 people signed up for new health insurance plans, according to the Department of Health and Human Services, and only 26,794 people were able enroll through the federal website. Healthcare.gov has been a complete disaster for the administration, said Borger. It's clear they've been lowballing what to expect, and I'm not quite sure they lowballed it enough. Watch the video below:\n\nCNN, health insurance, Healthcare.gov, Jake Tapper, Michael Warren, Obamacare\n\nhttp://cdn.weeklystandard.biz/cache/280x280-.jpg", "article_metadata": {"news_keywords": "CNN,health insurance,Healthcare.gov,Jake Tapper,Michael Warren,Obamacare", "og": {"url": "http://www.weeklystandard.com/cnn-obamacare-enrollment-numbers-complete-disaster/article/767050", "type": "article", "site_name": "Weekly Standard", "description": "The federal health insurance exchange website created by Obamacare has been a complete disaster said CNN analyst Gloria Borger. Speaking on Jake Tapper's program Wednesday afternoon, Borger was asked to respond to the enrollment numbers released by the administration following the first month of healthcare.gov and the several state-run exchanges across the country.\nA total of 106,185 people signed up for new health insurance plans, according to the Department of Health and Human Services, and only 26,794 people were able enroll through the federal website.\nHealthcare.gov has been a complete disaster for the administration, said Borger. It's clear they've been lowballing what to expect, and I'm not quite sure they lowballed it enough.\nWatch the video below:", "title": "CNN: Obamacare Enrollment Numbers 'Complete Disaster'"}, "twitter": {"description": "The federal health insurance exchange website created by Obamacare has been a complete disaster said CNN analyst Gloria Borger. Speaking on Jake Tapper's program Wednesday afternoon, Borger was asked to respond to the enrollment numbers released by the administration following the first month of healthcare.gov and the several state-run exchanges across the country.\nA total of 106,185 people signed up for new health insurance plans, according to the Department of Health and Human Services, and only 26,794 people were able enroll through the federal website.\nHealthcare.gov has been a complete disaster for the administration, said Borger. It's clear they've been lowballing what to expect, and I'm not quite sure they lowballed it enough.\nWatch the video below:", "creator": "@MichaelRWarren", "title": "CNN: Obamacare Enrollment Numbers 'Complete Disaster'", "site": "@weeklystandard", "widgets": {"csp": "on"}, "card": "summary"}, "fb": {"admins": 1285945407}, "google-site-verification": "QxcYUvYDy42iu46zPMF2vwdQlMXsJP74MqOgujGnpaQ", "keywords": "CNN,health insurance,Healthcare.gov,Jake Tapper,Michael Warren,Obamacare", "article": {"author": "Michael Warren", "published_time": "2013-11-13 16:03", "title": "CNN: Obamacare Enrollment Numbers 'Complete Disaster'"}, "viewport": "width=device-width,user-scalable=0"}, "_id": "\"57477af46914bd0286fdd032\"", "article_summary": "The Weekly Standard http://assets.weeklystandard.com.s3.amazonaws.com/tws15/images/logo-large.pngThe Weekly Standard2013Washington, DCPoliticshttp://www.weeklystandard.com/cnn-obamacare-enrollment-numbers-complete-disaster/article/7670502013-11-13T16:032013-11-13T15:05CNN: Obamacare Enrollment Numbers 'Complete Disaster'The federal health insurance exchange website created by Obamacare has been a complete disaster said CNN analyst Gloria Borger.\nThe federal health insurance exchange website created by Obamacare has been a \"complete disaster\" said CNN analyst Gloria Borger.\nWatch the video below:CNN, health insurance, Healthcare.gov, Jake Tapper, Michael Warren, Obamacarehttp://cdn.weeklystandard.biz/cache/280x280-.jpg\nHealthcare.gov has been a complete disaster for the administration, said Borger.\nA total of 106,185 people signed up for new health insurance plans, according to the Department of Health and Human Services, and only 26,794 people were able enroll through the federal website."}