{"article_title": "Nautic Builds Up IPS Portfolio Company with Integra Adhesives Purchase", "article_keywords": ["firm", "purchase", "builds", "adhesives", "company", "undisclosed", "sales", "ips", "materials", "nautic", "pe", "portfolio", "market", "integra"], "article_url": "http://www.themiddlemarket.com/news/building_products/nautic-builds-up-ips-portfolio-company-with-integra-adhesives-purchase-260272-1.html", "article_text": "Nautic Builds Up IPS Portfolio Company with Integra Adhesives Purchase\n\nRecent construction acquisitions have come from Accella, Distribution International and Hennessy\n\nNautic Partners-backed IPS Corp. has acquired Integra Adhesives from management for an undisclosed amount. The PE firm partnered with management to purchase IPS in 2015.\n\nIntegra, based in Abbotsford, British Columbia, produces adhesive materials that are used in natural stones to build surfaces such as countertops. IPS says the acquisition will expand the company\u2019s customer base and product offerings.\n\nIPS, located in Compton, California, manufactures adhesives for the plumbing, construction and plastic fabrication sectors. The company owns the Weld-On, Water-Tite, Guy Gray and TrueBro brands.\n\nNautic is a Providence, Rhode Island-based middle market PE Firm that usually makes up to $100 million in equity investments. Earlier in 2016, the firm made an undisclosed investment in property restoration company Response Team 1 and in 2015, Nautic announced plans to buy airplane parts manufacturer Aerostar Aerospace Manufacturing LLC.\n\nGrowth in the homebuilding market is likely to increase in tandem with sales, making for attractive targets in the sector. In February, the sale of new single-family homes increased by two percent over sales recorded for January, according to figures released by the U.S. Census Bureau and the Department of Housing and Urban Development. Some recent deals include Hennessy Capital Acquisition Corp. II (Nasdaq: HCAC, HCACU and HCACW) saying it will acquire United Subcontractors Inc. (USI), a provider of insulation systems; Arsenal-backed Accella Performance Materials has purchased Quadrant Chemical Corp.\u2019s spray foam division; and Advent-owned Distribution International added insulation distributor 3i Supply Co. For more on the coatings space, see Innovations in Coatings and Sealants Spark M&A.\n\nFor more information on related topics, visit the following:", "article_metadata": {"status": "open", "domain": "Mergers & Acquisitions", "sailthru.author": "Demitri Diakantonis", "sailthru.expire_date": "2016-05-05 11:25:00", "og": {"url": "http://www.themiddlemarket.com/news/building_products/nautic-builds-up-ips-portfolio-company-with-integra-adhesives-purchase-260272-1.html", "image": "http://cdn.themiddlemarket.com/media/newspics/adhesives.jpeg", "site_name": "Mergers & Acquisitions, Latest News", "title": "Nautic Builds Up IPS Portfolio Company with Integra Adhesives Purchase"}, "type": "Article", "brand": "Mergers & Acquisitions, Latest News", "sailthru.date": "2016-04-05 11:25:00", "wordcount": 252, "sailthru.title": "Nautic Builds Up IPS Portfolio Company with Integra Adhesives Purchase", "featured": 0, "sailthru.tags": "News, Private Equity, Building Products, Building Products, Nautic Builds Up IPS Portfolio Company with Integra Adhesives Purchase, private equity, construction, M&A, middle market, Accella, Distribution International, Hennessy, Response Team 1, Aerostar Aerospace, Quadrant Chemical, 3i Supply, Weld-On, Water-tite, Guy Gray, Truebro, Article", "sailthru.description": "Recent construction acquisitions have come from Accella, Distribution International and Hennessy", "sailthru.image.full": "http://cdn.themiddlemarket.com/media/newspics/adhesives.jpeg"}, "article_summary": "Nautic Builds Up IPS Portfolio Company with Integra Adhesives PurchaseRecent construction acquisitions have come from Accella, Distribution International and HennessyNautic Partners-backed IPS Corp. has acquired Integra Adhesives from management for an undisclosed amount.\nNautic is a Providence, Rhode Island-based middle market PE Firm that usually makes up to $100 million in equity investments.\nThe PE firm partnered with management to purchase IPS in 2015.\nIPS, located in Compton, California, manufactures adhesives for the plumbing, construction and plastic fabrication sectors.\nIntegra, based in Abbotsford, British Columbia, produces adhesive materials that are used in natural stones to build surfaces such as countertops."}