{"article_title": "Pryor: I Still Would Have Voted For Obamacare", "article_keywords": ["pryor", "right", "shot", "pay", "obamacare", "premiums", "voted", "lot", "80", "really", "know"], "article_url": "http://www.weeklystandard.com/pryor-i-still-would-have-voted-for-obamacare/article/786528", "article_text": "\"You know, I would have,\" Pryor responded. \"Of course, I would want to see some changes back then, but I think on something like this, it's big, it's complicated, it's difficult. If you get 80 percent of this right, you've really done something. We probably did get 80 percent of it right.\" Watch the video below:\n\n\"A lot of our premiums have really shot up, those of us who have had to pay these premiums,\" said the KARK host. \"Knowing now what you know now, would you have voted for this back then?\"\n\n\"A lot of our premiums have really shot up, those of us who have had to pay these premiums,\" said the KARK host. \"Knowing now what you know now, would you have voted for this back then?\"\n\nThe Weekly Standard http://assets.weeklystandard.com.s3.amazonaws.com/tws15/images/logo-large.png\n\nThe Weekly Standard\n\n2014\n\nWashington, DC\n\nPolitics\n\nhttp://www.weeklystandard.com/pryor-i-still-would-have-voted-for-obamacare/article/786528\n\n2014-04-04T15:34\n\n2014-04-04T15:35\n\nPryor: I Still Would Have Voted For Obamacare\n\nArkansas senator Mark Pryor, a Democrat up for reelection this year, told local station KARK-TV he would have still voted for Obamacare despite all the law's problems. A lot of our premiums have really shot up, those of us who have had to pay these premiums, said the KARK host. Knowing now what you know now, would you have voted for this back then? You know, I would have, Pryor responded. Of course, I would want to see some changes back then, but I think on something like this, it's big, it's complicated, it's difficult. If you get 80 percent of this right, you've really done something. We probably did get 80 percent of it right. Watch the video below: Pryor is facing Republican congressman Tom Cotton in what is considered one of the hottest Senate races of 2014. According to the Real Clear Politics poll average, Cotton leads Pryor by three points.\n\n2014 Elections, Arkansas, Mark Pryor, Michael Warren, Obamacare, Polls, Senate, Tom Cotton\n\nhttp://cdn.weeklystandard.biz/cache/280x280-17dc6100d0c9c46c5af4c875e44f4e4b.jpg", "article_metadata": {"news_keywords": "2014 Elections,Arkansas,Mark Pryor,Michael Warren,Obamacare,Polls,Senate,Tom Cotton", "og": {"site_name": "Weekly Standard", "description": "Arkansas senator Mark Pryor, a Democrat up for reelection this year, told local station KARK-TV he would have still voted for Obamacare despite all the law's problems.\nA lot of our premiums have really shot up, those of us who have had to pay these premiums, said the KARK host. Knowing now what you know now, would you have voted for this back then?\nYou know, I would have, Pryor responded. Of course, I would want to see some changes back then, but I think on something like this, it's big, it's complicated, it's difficult. If you get 80 percent of this right, you've really done something. We probably did get 80 percent of it right. Watch the video below:\n\nPryor is facing Republican congressman Tom Cotton in what is considered one of the hottest Senate races of 2014. According to the Real Clear Politics poll average, Cotton leads Pryor by three points.", "title": "Pryor: I Still Would Have Voted For Obamacare", "url": "http://www.weeklystandard.com/pryor-i-still-would-have-voted-for-obamacare/article/786528", "image": "http://cdn.weeklystandard.biz/cache/r960-17dc6100d0c9c46c5af4c875e44f4e4b.jpg", "type": "article"}, "twitter": {"description": "Arkansas senator Mark Pryor, a Democrat up for reelection this year, told local station KARK-TV he would have still voted for Obamacare despite all the law's problems.\nA lot of our premiums have really shot up, those of us who have had to pay these premiums, said the KARK host. Knowing now what you know now, would you have voted for this back then?\nYou know, I would have, Pryor responded. Of course, I would want to see some changes back then, but I think on something like this, it's big, it's complicated, it's difficult. If you get 80 percent of this right, you've really done something. We probably did get 80 percent of it right. Watch the video below:\n\nPryor is facing Republican congressman Tom Cotton in what is considered one of the hottest Senate races of 2014. According to the Real Clear Politics poll average, Cotton leads Pryor by three points.", "creator": "@MichaelRWarren", "image": "http://cdn.weeklystandard.biz/cache/r960-17dc6100d0c9c46c5af4c875e44f4e4b.jpg", "title": "Pryor: I Still Would Have Voted For Obamacare", "site": "@weeklystandard", "widgets": {"csp": "on"}, "card": "summary"}, "fb": {"admins": 1285945407}, "google-site-verification": "QxcYUvYDy42iu46zPMF2vwdQlMXsJP74MqOgujGnpaQ", "keywords": "2014 Elections,Arkansas,Mark Pryor,Michael Warren,Obamacare,Polls,Senate,Tom Cotton", "article": {"author": "Michael Warren", "published_time": "2014-04-04 15:34", "title": "Pryor: I Still Would Have Voted For Obamacare"}, "viewport": "width=device-width,user-scalable=0"}, "_id": "\"57477af46914bd0286fdd0e1\"", "article_summary": "The Weekly Standard http://assets.weeklystandard.com.s3.amazonaws.com/tws15/images/logo-large.pngThe Weekly Standard2014Washington, DCPoliticshttp://www.weeklystandard.com/pryor-i-still-would-have-voted-for-obamacare/article/7865282014-04-04T15:342014-04-04T15:35Pryor: I Still Would Have Voted For ObamacareArkansas senator Mark Pryor, a Democrat up for reelection this year, told local station KARK-TV he would have still voted for Obamacare despite all the law's problems.\n2014 Elections, Arkansas, Mark Pryor, Michael Warren, Obamacare, Polls, Senate, Tom Cottonhttp://cdn.weeklystandard.biz/cache/280x280-17dc6100d0c9c46c5af4c875e44f4e4b.jpg\n\"A lot of our premiums have really shot up, those of us who have had to pay these premiums,\" said the KARK host.\nA lot of our premiums have really shot up, those of us who have had to pay these premiums, said the KARK host.\nWatch the video below:\"A lot of our premiums have really shot up, those of us who have had to pay these premiums,\" said the KARK host."}