{"article_title": "UnitedHealth macht Verluste bei Obamacare wett", "article_keywords": ["verluste", "macht", "bei", "wett", "von", "obamacare", "mit", "und", "milliarden", "jahr", "im", "mehr", "als", "unitedhealth"], "article_url": "http://de.investing.com/news/aktienmarkt-nachrichten/unitedhealth-macht-verluste-bei-obamacare-wett---gewinnziel-angehoben-386268", "article_text": "UnitedHealth macht Verluste bei Obamacare wett - Gewinnziel angehoben\n\nAktien 19.04.2016 13:17\n\nUnitedHealth macht Verluste bei Obamacare wett - Gewinnziel angehoben\n\nNEW YORK (dpa-AFX) - Der gr\u00f6\u00dfte US-Krankenversicherer UnitedHealth (NYSE: ) ist trotz verlustreicher Gesch\u00e4fte bei Obamacare-Vertr\u00e4gen mit mehr Gewinn ins Jahr gestartet. Dank guter Gesch\u00e4fte der Tochter Optum stand im ersten Quartal unter dem Strich ein Gewinn von 1,6 Milliarden US-Dollar (1,4 Mrd Euro) und damit 14 Prozent mehr als ein Jahr zuvor, wie das Unternehmen am Dienstag in New York mitteilte. Sondereffekte herausgerechnet, lief es damit besser als von Analysten erwartet. Vorstandschef Stephen Hemsley zeigte sich f\u00fcr 2016 optimistischer als zuletzt. So soll der um Sondereffekte bereinigte Gewinn je Aktie im laufenden Jahr nun 7,75 bis 7,95 Dollar erreichen, 15 Cent mehr als zuletzt angek\u00fcndigt. Als Gr\u00fcnde nannte das Management geringere Belastungen durch Steuern und Abschreibungen. Im ersten Quartal machte das Technik- und Beratungsgesch\u00e4ft von Optum die Verluste des Konzerns beim Obamacare-Programm mehr als wett. Optum bietet etwa Datenanalyse im Gesundheitssektor an und unterst\u00fctzt Unternehmen mit Gesundheitsprogrammen f\u00fcr Mitarbeiter. Mit den individuellen \"Obamacare\"-Krankenversicherungsvertr\u00e4gen, die \u00fcber die von US-Pr\u00e4sident Barack Obama initiierten staatlichen Online-Marktpl\u00e4tze vermittelt werden, schreibt UnitedHealth hingegen schon l\u00e4nger rote Zahlen. 2017 will das Unternehmen in mindestens f\u00fcnf US-Bundesstaaten aus dem Programm aussteigen. Diese Vertr\u00e4ge machen zwar nur einen kleinen Teil des UnitedHealth-Gesch\u00e4fts aus, zehren aber an den Gewinnen. Der Konzernumsatz stieg auch deshalb zuletzt deutlich st\u00e4rker als die Ergebnisse. Im ersten Quartal lag er mit 44,5 Milliarden Dollar rund 24 Prozent h\u00f6her als ein Jahr zuvor. Im Gesamtjahr soll er statt \u00fcber 180 Milliarden Dollar nun rund 182 Milliarden erreichen.\n\nUnitedHealth macht Verluste bei Obamacare wett - Gewinnziel angehoben\n\nVerwandte Beitr\u00e4ge", "article_metadata": {"description": "UnitedHealth macht Verluste bei Obamacare wett - Gewinnziel angehoben", "og": {"site_name": "investing.com Deutsch", "description": "UnitedHealth macht Verluste bei Obamacare wett - Gewinnziel angehoben", "title": "UnitedHealth macht Verluste bei Obamacare wett - Gewinnziel angehoben", "url": "http://de.investing.com/news/aktienmarkt-nachrichten/unitedhealth-macht-verluste-bei-obamacare-wett---gewinnziel-angehoben-386268", "image": "http://glocdn.investing.com/news/green3_b._800x533_L_1414322740.jpg", "locale": "de_DE", "type": "article"}, "twitter": {"description": "UnitedHealth macht Verluste bei Obamacare wett - Gewinnziel angehoben", "title": "UnitedHealth macht Verluste bei Obamacare wett - Gewinnziel angehoben", "url": "http://de.investing.com/news/aktienmarkt-nachrichten/unitedhealth-macht-verluste-bei-obamacare-wett---gewinnziel-angehoben-386268", "image": "http://glocdn.investing.com/news/green3_b._800x533_L_1414322740.jpg", "site": "@InvestingDE", "card": "summary_large_image"}, "al": {"ios": {"url": "com.investing.app://8/news/386268", "app_store_id": 909998122}}, "robots": "NOODP", "google-site-verification": "DTRxWXB3vjNUsTCPICWo9yzZmIllylXYkRevEXo7szg", "article": {"section": "Aktien", "author": "dpa-AFX"}}, "article_summary": "UnitedHealth macht Verluste bei Obamacare wett - Gewinnziel angehobenAktien 19.04.2016 13:17UnitedHealth macht Verluste bei Obamacare wett - Gewinnziel angehobenNEW YORK (dpa-AFX) - Der gr\u00f6\u00dfte US-Krankenversicherer UnitedHealth (NYSE: ) ist trotz verlustreicher Gesch\u00e4fte bei Obamacare-Vertr\u00e4gen mit mehr Gewinn ins Jahr gestartet.\nUnitedHealth macht Verluste bei Obamacare wett - Gewinnziel angehobenVerwandte Beitr\u00e4ge\nIm ersten Quartal machte das Technik- und Beratungsgesch\u00e4ft von Optum die Verluste des Konzerns beim Obamacare-Programm mehr als wett.\nSondereffekte herausgerechnet, lief es damit besser als von Analysten erwartet.\nSo soll der um Sondereffekte bereinigte Gewinn je Aktie im laufenden Jahr nun 7,75 bis 7,95 Dollar erreichen, 15 Cent mehr als zuletzt angek\u00fcndigt."}