{"article_title": "Mercer Advisors Combines with Kanaly Trust in Wealth Management Powerhouse", "article_keywords": ["billion", "partners", "combines", "management", "wealth", "company", "advisors", "private", "powerhouse", "services", "lovell", "equity", "kanaly", "firms", "trust", "mercer"], "article_url": "http://www.themiddlemarket.com/news/financial_services/pe-backed-mercer-kanaly-combine-to-create-wealth-management-powerhouse-260217-1.html", "article_text": "Mercer Advisors Combines with Kanaly Trust in Wealth Management Powerhouse\n\nPrivate equity firm Genstar Capital originally acquired Mercer from Lovell Minnick, which will retain a stake in Kanaly\n\nWealth management firms Mercer Advisors and Kanaly Trust, both with private equity backing, have agreed to merge. The combined company, with expected total assets exceeding $8 billion, will be headed by Mercer\u2019s CEO David Barton.\n\nMercer, based in Santa Barbara, California, was acquired by Genstar Capital in 2015 from lower middle-market private equity firm Lovell Minnick Partners, which owned the firm since May 2008. Mercer provides its affluent clients with fee-based financial planning, retirement and estate planning services, investment, tax and wealth management services. Currently, Mercer advises on over $6 billion on behalf of its clients.\n\nKanaly, with over $2 billion in assets under management, has been backed by Lovell, which will retain a stake in the company. The Houston-based company offers services similar to those of Mercer, and also acts as trustee for executor for estates with more than $2.5 billion in assets.\n\nMoelis & Company acted as financial adviser to Kanaly, while Davis Graham & Stubbs served as legal counsel to the company. Willkie Farr & Gallagher acted as legal adviser to Mercer.\n\nM&A transactions in the asset management space are expected to pick up, as combined firms become more equipped to handle regulatory and compliance pressure. Additionally, private equity firms and other strategic buyers have been eyeing the sector for new targets.\n\nIn December, New York investment bank Loeb Partners announced a strategic alliance with London-based Spencer House Partners LLP, which provides advisory and merchant banking services to asset managers, to focus on deal activity in the space. With the alliance, the two firms provide cross-border advice to financial institutions, and has a specific focus on asset management M&A.\n\nFor more information on related topics, visit the following:", "article_metadata": {"status": "open", "domain": "Mergers & Acquisitions", "sailthru.author": "Jakema Lewis", "sailthru.expire_date": "2016-04-28 13:48:00", "og": {"url": "http://www.themiddlemarket.com/news/financial_services/pe-backed-mercer-kanaly-combine-to-create-wealth-management-powerhouse-260217-1.html", "image": "http://cdn.themiddlemarket.com/media/newspics/assetmanagement.jpeg", "site_name": "Mergers & Acquisitions, Latest News", "title": "Mercer Advisors Combines with Kanaly Trust in Wealth Management Powerhouse"}, "type": "Article", "brand": "Mergers & Acquisitions, Latest News", "sailthru.date": "2016-03-28 13:48:00", "wordcount": 266, "sailthru.title": "Mercer Advisors Combines with Kanaly Trust in Wealth Management Powerhouse", "featured": 1, "sailthru.tags": "News, Financial Services, Financial Services, PE-Backed Mercer, Kanaly Combine to Create Wealth Management Powerhouse, genstar capital, lovell minnick, merger, asset management, business services, retirement, david barton, moelis & company, davis graham, willkie farr, Article", "sailthru.description": "Private equity firm Genstar Capital originally acquired Mercer from Lovell Minnick, which will retain a stake in Kanaly", "sailthru.image.full": "http://cdn.themiddlemarket.com/media/newspics/assetmanagement.jpeg"}, "article_summary": "Mercer Advisors Combines with Kanaly Trust in Wealth Management PowerhousePrivate equity firm Genstar Capital originally acquired Mercer from Lovell Minnick, which will retain a stake in KanalyWealth management firms Mercer Advisors and Kanaly Trust, both with private equity backing, have agreed to merge.\nMercer provides its affluent clients with fee-based financial planning, retirement and estate planning services, investment, tax and wealth management services.\nAdditionally, private equity firms and other strategic buyers have been eyeing the sector for new targets.\nKanaly, with over $2 billion in assets under management, has been backed by Lovell, which will retain a stake in the company.\nMercer, based in Santa Barbara, California, was acquired by Genstar Capital in 2015 from lower middle-market private equity firm Lovell Minnick Partners, which owned the firm since May 2008."}