{"article_title": "Accruent Joins Health Care Tech Deal Wave, Acquires Software Co. Mainspring", "article_keywords": ["accruent", "mainspring", "deal", "ibm", "products", "acquires", "wave", "management", "health", "solutions", "joins", "tech", "care", "technology", "software"], "article_url": "http://www.themiddlemarket.com/news/healthcare/accruent-joins-in-health-care-deal-spree-acquires-software-co-mainspring-260310-1.html", "article_text": "Accruent Joins Health Care Tech Deal Wave, Acquires Software Co. Mainspring\n\nGI Partners, Allscripts and IBM have all made recent purchases in the sector\n\nCommercial property management software provider Accruent has acquired Mainspring Healthcare Solutions, which supplies software and technology products to U.S. hospitals. Financial terms of the transaction have not been disclosed.\n\nMainspring, which has served the health care market for over 25 years, provides computerized maintenance management offerings to address operational challenges in hospitals. The company\u2019s corporate headquarters are located in Waltham, Massachusetts.\n\nAustin, Texas-based Accruent\u2019s specialty lies in providing a suite of products for clinical engineering, facility management, environment services, materials management, portfolio management, lease administration and facility capital planning. For Accruent, acquiring Mainspring\u2019s technology solutions will provide customers from both parties with a \u201chigher return on investment and better service to caregivers and patients\u201d, the company says in a statement. With the addition of Mainspring, Accruent\u2019s suite of products will be used by more than 55 percent of U.S. hospitals.\n\nThe integration of the two companies is expected to be completed in mid-2016.\n\nHealth care companies have been seeing a lot of play in the M&A market lately, particularly among software providers. In March, GI Partners and Allscripts Healthcare Solutions Inc. (Nasdaq: MDRX) acquired health care software provider Netsmart Technologies Inc. from Genstar Capital \ufeffin a deal valued at $950 million. Also, in February, IBM (NYSE: IBM) announced plans to purchase Truven Health Analytics for $2.6 billion, making it fourth health data-related target for the company in less than a year. The deal closed in early-April.\n\nFor more information on related topics, visit the following:", "article_metadata": {"status": "open", "domain": "Mergers & Acquisitions", "sailthru.author": "Jakema Lewis", "sailthru.expire_date": "2016-05-08 12:52:00", "og": {"url": "http://www.themiddlemarket.com/news/healthcare/accruent-joins-in-health-care-deal-spree-acquires-software-co-mainspring-260310-1.html", "image": "http://cdn.themiddlemarket.com/media/newspics/healthdatasnippet.jpeg", "site_name": "Mergers & Acquisitions, Latest News", "title": "Accruent Joins Health Care Tech Deal Wave, Acquires Software Co. Mainspring"}, "sailthru.description": "GI Partners, Allscripts and IBM have all made recent purchases in the sector", "brand": "Mergers & Acquisitions, Latest News", "sailthru.date": "2016-04-08 12:52:00", "wordcount": 239, "sailthru.title": "Accruent Joins Health Care Tech Deal Wave, Acquires Software Co. Mainspring", "featured": 1, "sailthru.tags": "News, Health Care, Health Care, Accruent Joins Health Care Tech Deal Wave, Acquires Software Co. Mainspring, IMB, Truven, GI Partners, Allscripts Healthcare Solutions, Netsmart Technologies, Article", "type": "Article", "sailthru.image.full": "http://cdn.themiddlemarket.com/media/newspics/healthdatasnippet.jpeg"}, "article_summary": "Accruent Joins Health Care Tech Deal Wave, Acquires Software Co. MainspringGI Partners, Allscripts and IBM have all made recent purchases in the sectorCommercial property management software provider Accruent has acquired Mainspring Healthcare Solutions, which supplies software and technology products to U.S. hospitals.\nHealth care companies have been seeing a lot of play in the M&A market lately, particularly among software providers.\nMainspring, which has served the health care market for over 25 years, provides computerized maintenance management offerings to address operational challenges in hospitals.\nIn March, GI Partners and Allscripts Healthcare Solutions Inc. (Nasdaq: MDRX) acquired health care software provider Netsmart Technologies Inc. from Genstar Capital \ufeffin a deal valued at $950 million.\nFor Accruent, acquiring Mainspring\u2019s technology solutions will provide customers from both parties with a \u201chigher return on investment and better service to caregivers and patients\u201d, the company says in a statement."}