{"article_title": "Robert Reich: Kasich 'Best of a Bad Lot'", "article_keywords": ["poor", "republican", "robert", "income", "experience", "bad", "reich", "lot", "kasich", "ohio", "john", "best"], "article_url": "http://www.weeklystandard.com/robert-reich-kasich-best-of-a-bad-lot/article/996264", "article_text": "\"I dealt with Kasich when he was a congressman from Ohio and headed the Budget Committee, and found him to be honest, forthright, and willing to listen and change his mind if the arguments were against him. Although a social conservative, against abortion and for the death penalty, Kasich has accused his party of waging a war on the poor, and has spoken up for immigrants. He has argued against repeal of the Affordable Care Act, and has taken Medicaid expansion dollars. According to Bloomberg, when Randy Kendrick, a major contributor and wife of the owner of the Arizona Diamondbacks, objected to Kasich's moral defense of aid to the poor, Kasich fired back, \"I don't know about you, lady, but when I get to the pearly gates, I'm going to have an answer for what I've done for the poor.\" He hasn't been invited to a Koch brothers meet-and-greet since.\n\n\"Of all Republican hopefuls, John Kasich, who announced his bid yesterday, is the best of a bad lot. Kasich has as much experience and an equal or better record than the other governors running, and more experience in government than the rest of the field combined. During his governorship he moved Ohio from 48th in job creation to eighth (second in the Midwest), halved unemployment to 5.2 percent and increased income by 9.8 percent. Poverty fell three times faster than the national rate, helped by a Kasich initiative to adopt a version of the earned income tax credit, which makes work worthwhile for fast-food employees and hotel maids,\" Reich writes in a Facebook post.\n\nThe Weekly Standard http://assets.weeklystandard.com.s3.amazonaws.com/tws15/images/logo-large.png\n\nThe Weekly Standard\n\n2015\n\nWashington, DC\n\nPolitics\n\nhttp://www.weeklystandard.com/robert-reich-kasich-best-of-a-bad-lot/article/996264\n\n2015-07-23T11:38\n\n2015-07-23T11:40\n\nRobert Reich: Kasich 'Best of a Bad Lot'\n\nPresident Clinton's former labor secretary, Robert Reich, has some good things to say about Republican presidential candidate John Kasich. Some good things, but not many. Of all Republican hopefuls, John Kasich, who announced his bid yesterday, is the best of a bad lot. Kasich has as much experience and an equal or better record than the other governors running, and more experience in government than the rest of the field combined. During his governorship he moved Ohio from 48th in job creation to eighth (second in the Midwest), halved unemployment to 5.2 percent and increased income by 9.8 percent. Poverty fell three times faster than the national rate, helped by a Kasich initiative to adopt a version of the earned income tax credit, which makes work worthwhile for fast-food employees and hotel maids, Reich writes in a Facebook post. I dealt with Kasich when he was a congressman from Ohio and headed the Budget Committee, and found him to be honest, forthright, and willing to listen and change his mind if the arguments were against him. Although a social conservative, against abortion and for the death penalty, Kasich has accused his party of waging a war on the poor, and has spoken up for immigrants. He has argued against repeal of the Affordable Care Act, and has taken Medicaid expansion dollars. According to Bloomberg, when Randy Kendrick, a major contributor and wife of the owner of the Arizona Diamondbacks, objected to Kasich's moral defense of aid to the poor, Kasich fired back, I don't know about you, lady, but when I get to the pearly gates, I'm going to have an answer for what I've done for the poor. He hasn't been invited to a Koch brothers meet-and-greet since.\n\n2016 Elections, Daniel Halper, John Kasich, Republicans\n\nhttp://cdn.weeklystandard.biz/cache/280x280-.jpg", "article_metadata": {"news_keywords": "2016 Elections,Daniel Halper,John Kasich,Republicans", "og": {"url": "http://www.weeklystandard.com/robert-reich-kasich-best-of-a-bad-lot/article/996264", "type": "article", "site_name": "Weekly Standard", "description": "President Clinton's former labor secretary, Robert Reich, has some good things to say about Republican presidential candidate John Kasich. Some good things, but not many.\nOf all Republican hopefuls, John Kasich, who announced his bid yesterday, is the best of a bad lot. Kasich has as much experience and an equal or better record than the other governors running, and more experience in government than the rest of the field combined. During his governorship he moved Ohio from 48th in job creation to eighth (second in the Midwest), halved unemployment to 5.2 percent and increased income by 9.8 percent. Poverty fell three times faster than the national rate, helped by a Kasich initiative to adopt a version of the earned income tax credit, which makes work worthwhile for fast-food employees and hotel maids, Reich writes in a Facebook post.\nI dealt with Kasich when he was a congressman from Ohio and headed the Budget Committee, and found him to be honest, forthright, and willing to listen and change his mind if the arguments were against him. Although a social conservative, against abortion and for the death penalty, Kasich has accused his party of waging a war on the poor, and has spoken up for immigrants. He has argued against repeal of the Affordable Care Act, and has taken Medicaid expansion dollars. According to Bloomberg, when Randy Kendrick, a major contributor and wife of the owner of the Arizona Diamondbacks, objected to Kasich's moral defense of aid to the poor, Kasich fired back, I don't know about you, lady, but when I get to the pearly gates, I'm going to have an answer for what I've done for the poor. He hasn't been invited to a Koch brothers meet-and-greet since.", "title": "Robert Reich: Kasich 'Best of a Bad Lot'"}, "twitter": {"description": "President Clinton's former labor secretary, Robert Reich, has some good things to say about Republican presidential candidate John Kasich. Some good things, but not many.\nOf all Republican hopefuls, John Kasich, who announced his bid yesterday, is the best of a bad lot. Kasich has as much experience and an equal or better record than the other governors running, and more experience in government than the rest of the field combined. During his governorship he moved Ohio from 48th in job creation to eighth (second in the Midwest), halved unemployment to 5.2 percent and increased income by 9.8 percent. Poverty fell three times faster than the national rate, helped by a Kasich initiative to adopt a version of the earned income tax credit, which makes work worthwhile for fast-food employees and hotel maids, Reich writes in a Facebook post.\nI dealt with Kasich when he was a congressman from Ohio and headed the Budget Committee, and found him to be honest, forthright, and willing to listen and change his mind if the arguments were against him. Although a social conservative, against abortion and for the death penalty, Kasich has accused his party of waging a war on the poor, and has spoken up for immigrants. He has argued against repeal of the Affordable Care Act, and has taken Medicaid expansion dollars. According to Bloomberg, when Randy Kendrick, a major contributor and wife of the owner of the Arizona Diamondbacks, objected to Kasich's moral defense of aid to the poor, Kasich fired back, I don't know about you, lady, but when I get to the pearly gates, I'm going to have an answer for what I've done for the poor. He hasn't been invited to a Koch brothers meet-and-greet since.", "creator": "@danielhalper", "title": "Robert Reich: Kasich 'Best of a Bad Lot'", "site": "@weeklystandard", "widgets": {"csp": "on"}, "card": "summary"}, "fb": {"admins": 1285945407}, "google-site-verification": "QxcYUvYDy42iu46zPMF2vwdQlMXsJP74MqOgujGnpaQ", "keywords": "2016 Elections,Daniel Halper,John Kasich,Republicans", "article": {"author": "Daniel Halper", "published_time": "2015-07-23 11:38", "title": "Robert Reich: Kasich 'Best of a Bad Lot'"}, "viewport": "width=device-width,user-scalable=0"}, "article_summary": "The Weekly Standard http://assets.weeklystandard.com.s3.amazonaws.com/tws15/images/logo-large.pngThe Weekly Standard2015Washington, DCPoliticshttp://www.weeklystandard.com/robert-reich-kasich-best-of-a-bad-lot/article/9962642015-07-23T11:382015-07-23T11:40Robert Reich: Kasich 'Best of a Bad Lot'President Clinton's former labor secretary, Robert Reich, has some good things to say about Republican presidential candidate John Kasich.\n\"Of all Republican hopefuls, John Kasich, who announced his bid yesterday, is the best of a bad lot.\nOf all Republican hopefuls, John Kasich, who announced his bid yesterday, is the best of a bad lot.\n2016 Elections, Daniel Halper, John Kasich, Republicanshttp://cdn.weeklystandard.biz/cache/280x280-.jpg\nKasich has as much experience and an equal or better record than the other governors running, and more experience in government than the rest of the field combined."}