{"article_title": "White House says it isn't behind 'Adorable Care Act'", "article_keywords": ["politico", "house", "twitter", "official", "tumblr", "isnt", "act", "white", "view", "adorable", "care"], "article_url": "http://www.politico.com/blogs/politico44/2013/09/white-house-says-it-isnt-behind-adorable-care-act-173649", "article_text": "White House says it isn't behind 'Adorable Care Act'\n\nIt would have been a clever move for the White House or Organizing for Action to turn to cute animals and social media to try to draw attention to the start of the Affordable Care Act's registration period.\n\nBut both deny having any connection to the Adorable Care Act accounts on Twitter, Tumblr and Facebook that caught the attention of the political press -- and the White House -- on Thursday.\n\n\"The 'Adorable Care Act' Twitter and Tumblr accounts are not run by the White House,\" a White House official told POLITICO. \"On social media channels, the White House highlights content from outside individuals, groups and organizations. The Adorable Care Act was highlighted by official White House channels as a creative way to raise awareness around the Affordable Care Act and HealthCare.gov.\"\n\n(WATCH: Obamacare timeline)\n\nThe White House's official Twitter account shared some of @adorablecareact's images on Thursday -- beginning with one featuring a mouse saying: \"I can rest easy knowing that lifetime caps on health coverage have been eliminated! Thanks, Adorable Care Act.\" The White House's shares helped the account attract hundreds of new followers, hitting a total of 900 just as this post was filed.\n\nOFA also offered a denial of any involvement. \"Not us,\" an official there said.\n\n\"Kitten coverage till age 26: prayers answered,\" reads the most recent image posted on @adorablecareact. It features a photo of a kitten and blue-and-white graphics reminiscent of the 2012 Obama campaign's iconography.\n\nThe earliest tweet is from Sept. 20, but the earliest post on Tumblr dates back to July 18, and features a pony and this message: \"Introducting the Adorable Care Act protecting America's greatest resource one pony at a time.\"\n\n(Also on POLITICO: Wall Street to GOP: Are you nuts?)\n\nEarlier in the day during his daily briefing, White House press secretary Jay Carney said he wasn't aware of the emerging meme. He did, though, have a take on why it's gained traction. \"Everybody loves cute animals,\" he said.\n\nFollow @politico\n\n\n\n[ View the story \"White House highlights 'Adorable Care Act'\" on Storify]\n\n\n\n\n\nMobile users view here.\n\n\n\n", "article_metadata": {"og": {"site_name": "POLITICO", "description": "<p>Both the White House and OFA deny having any connection to the Adorable Care Act accounts.</p>", "title": "White House says it isn't behind 'Adorable Care Act'", "url": "http://www.politico.com/politico44/2013/09/white-house-says-it-isnt-behind-adorable-care-act-173649.html", "fb_appid": 114037015331397, "type": "article"}, "twitter": {"site": "@politico", "card": "summary_large_image", "creator": "@politico"}, "description": "<p>Both the White House and OFA deny having any connection to the Adorable Care Act accounts.</p>", "viewport": "width=device-width, initial-scale=1"}, "article_summary": "\"The 'Adorable Care Act' Twitter and Tumblr accounts are not run by the White House,\" a White House official told POLITICO.\nThe Adorable Care Act was highlighted by official White House channels as a creative way to raise awareness around the Affordable Care Act and HealthCare.gov.\"\nFollow @politico[ View the story \"White House highlights 'Adorable Care Act'\" on Storify]Mobile users view here.\nWhite House says it isn't behind 'Adorable Care Act'It would have been a clever move for the White House or Organizing for Action to turn to cute animals and social media to try to draw attention to the start of the Affordable Care Act's registration period.\nThanks, Adorable Care Act.\""}