{"article_title": "What We Learned About Depression in 2015", "article_keywords": ["uptodate", "major", "past", "suffering", "condition", "symptoms", "2015", "learned", "disorder", "depressive", "depression", "twoweek"], "article_url": "http://www.hcplive.com/medical-news/what-we-learned-about-depression-in-2015", "article_text": "What We Learned About Depression in 2015\n\nThe past 12 months have brought new insight to major depressive disorder which only brings hope to a better future.During any two-week period, about 8% of Americans are suffering from depression, according to the Centers for Disease Control and Prevention (CDC). Major depressive disorder is not just a debilitating condition all of its own, but often time it\u2019s accompanied by other symptoms that are linked to other illnesses.Read on to catch up on the key depression findings over the past year, and stay up-to-date with the MD Magazine Major Depressive Disorder condition center", "article_metadata": {"description": "The past 12 months have brought new insight to major depressive disorder which only brings hope to a better future.", "og": {"site_name": "MD Magazine", "description": "The past 12 months have brought new insight to major depressive disorder which only brings hope to a better future.", "title": "What We Learned About Depression in 2015", "url": "http://www.hcplive.com/medical-news/what-we-learned-about-depression-in-2015", "image": "https://s3.amazonaws.com/hcplive/v1_media/_upload_image/_thumbnails/Silhouette_depression_man.jpg", "type": "Article"}, "msapplication-TileColor": "#ffffff", "msapplication-TileImage": "https://s3.amazonaws.com/hcplive/v2_media/_core/favi/ms-icon-144x144.png", "keywords": "psychiatry, neurology, hospital medicine, major depressive disorder, depression, anxiety", "theme-color": "#ffffff"}, "article_summary": "What We Learned About Depression in 2015The past 12 months have brought new insight to major depressive disorder which only brings hope to a better future.During any two-week period, about 8% of Americans are suffering from depression, according to the Centers for Disease Control and Prevention (CDC).\nMajor depressive disorder is not just a debilitating condition all of its own, but often time it\u2019s accompanied by other symptoms that are linked to other illnesses.Read on to catch up on the key depression findings over the past year, and stay up-to-date with the MD Magazine Major Depressive Disorder condition center"}