{"article_title": "Nautic Partners Backs Property Restorer Response Team 1, which Made Three Deals", "article_keywords": ["firm", "partners", "purchased", "restorer", "million", "backs", "deals", "restoration", "nautic", "team", "services", "venturi", "property", "response", "reconstruction"], "article_url": "http://www.themiddlemarket.com/news/business_services/nautic-partners-backs-property-restorer-response-team-1-260184-1.html", "article_text": "Nautic Partners Backs Property Restorer Response Team 1, which Made Three Deals\n\nThe target purchased Emergency Reconstruction, JFS Construction Group and Venturi Technologies\n\nNautic Partners LLC has made an undisclosed investment and property restoration company Response Team 1. The PE firm has partnered with the target\u2019s founders, John Goense and Erik Bloom, on the deal. In addition to Nautic\u2019s investment, Response team has purchased three restoration businesses: Emergency Reconstruction; JFS Construction Group; and Venturi Technologies.\n\nResponse team, headquartered in Wheeling, Illinois, offers commercial and residential restoration from water, fire or storm damage. The company\u2019s services include structure stabilization, cleaning, electrical and plumbing repair along with interior restoration.\n\nNautic managing director Doug Hill says the firm will \u201csupport the future growth of the company, which will come both organically and through capitalizing on the substantial consolidation opportunity that exists in the company\u2019s fragmented market.\u201d\n\nIn 2015, Nautic announced plans to buy airplane parts manufacturer Aerostar Aerospace Manufacturing LLC along with substitute teacher services provider Source4Teachers. Nautic, located in Providence, Rhode Island, typically makes equity investments of $25 million to $100 million. The firm recently closed a $900 million fund. Robert W. Baird & Co. advised Response Team. Antares Capital and Lstar Capital provided financing.\n\nFor more information on related topics, visit the following:", "article_metadata": {"status": "open", "domain": "Mergers & Acquisitions", "sailthru.author": "Demitri Diakantonis", "sailthru.expire_date": "2016-04-22 13:19:00", "og": {"url": "http://www.themiddlemarket.com/news/business_services/nautic-partners-backs-property-restorer-response-team-1-260184-1.html", "image": "http://cdn.themiddlemarket.com/media/newspics/responseteam.jpeg", "site_name": "Mergers & Acquisitions, Latest News", "title": "Nautic Partners Backs Property Restorer Response Team 1, which Made Three Deals"}, "type": "Article", "brand": "Mergers & Acquisitions, Latest News", "sailthru.date": "2016-03-22 13:19:00", "wordcount": 179, "sailthru.title": "Nautic Partners Backs Property Restorer Response Team 1, which Made Three Deals", "featured": 0, "sailthru.tags": "News, Private Equity, Infrastructure, Business Services, Business Services, Nautic Partners Backs Property Restorer Response Team 1, which Made Three Deals, private equity, M&A, business services, infrastructure, Emergency Reconstruction, JFS Construction Group, Venturi Technologies, Robert W. Baird, Antares Capital, Lstar Capital, Aerostar, Source4teachers, Article", "sailthru.description": "The target purchased Emergency Reconstruction, JFS Construction Group and Venturi Technologies", "sailthru.image.full": "http://cdn.themiddlemarket.com/media/newspics/responseteam.jpeg"}, "article_summary": "Nautic Partners Backs Property Restorer Response Team 1, which Made Three DealsThe target purchased Emergency Reconstruction, JFS Construction Group and Venturi TechnologiesNautic Partners LLC has made an undisclosed investment and property restoration company Response Team 1.\nIn addition to Nautic\u2019s investment, Response team has purchased three restoration businesses: Emergency Reconstruction; JFS Construction Group; and Venturi Technologies.\nResponse team, headquartered in Wheeling, Illinois, offers commercial and residential restoration from water, fire or storm damage.\nRobert W. Baird & Co. advised Response Team.\nNautic, located in Providence, Rhode Island, typically makes equity investments of $25 million to $100 million."}