{"article_title": "How Medicare claim denials can be affecting your medical facility", "article_keywords": ["claim", "facility", "medical", "guidelines", "current", "properly", "medicare", "latest", "affecting", "health", "denials", "changes", "care"], "article_url": "http://www.businessreviewusa.com/finance/5041/How-Medicare-claim-denials-can-be-affecting-your-medical-facility", "article_text": "How Medicare claim denials can be affecting your medical facility\n\nHas your health care facility recently been plagued by an onslaught of Medicare claim denials? You aren't alone. It's a problem that has been happening more frequently, but what's the cause?\n\nOverall, the increase in claim denials is linked to health care facilities submitting claims that followed outdated guidelines. Here is some insight into what may be causing your facility's increase in denials and how to correct the situation.\n\nTrack changes in claim requirements\n\nYou can't properly avoid Medicare claim denials if you aren't informed of the latest changes in claim guidelines and rules.\n\nRELATED TOPIC: Health insurance industry begins consolidating after latest Supreme Court ruling on Obamacare\n\nAssign someone in your facility with the duty of staying current on the latest Medicare changes and ensure that any changes that affect your claim submission process are filtered down to relevant affected employees.\n\nAsk for current information\n\nA proactive measure you can take to reduce the number of Medicare claim denials in your health care facility is asking each patient to present an up-to-date Medicare card.\n\nBy asking for current Medicare information, you can verify that it matches the copy in your records and, most importantly, that you have the current information needed to submit a valid Medicare claim.\n\nIf patients aren't happy with the change of being asked to present their Medicare information at each visit, explaining that it's a new policy to avoid claim denials should help.\n\nUnderstand provider issues\n\nAccording to the article \u201cA basic guide to reducing Medicare claim denials,\u201d many facilities are currently receiving claim denials because a \u201creferring provider cannot order or refer.\u201d\n\nThis denial is most typically linked to a 2014 change in the rules from the Centers for Medicare and Medicaid Services.\n\nRELATED TOPIC: Is your venture capital on the digital health bandwagon?\n\nThis rule change now means that Medicare will deny certain types of supplies and equipment if the ordering or referring physician isn't identified properly or isn't enrolled in certain Medicare systems.\n\nFollow up fast\n\nA common practice in health care facilities is to allow a stack of claim denials to build so that employees can deal with them at one time in bulk. However, this could be hurting your facility.\n\nInstead of letting the denials pile up, set a new standard of dealing with them immediately.\n\nBy dealing with a denial right away, you won't forget the details associated with it and your revenue will be less affected in the long term because denials will be resolved sooner.\n\nInform your staff\n\nCommunication is key when trying to reduce the number of Medicare claim denials that come back to your health care facility.\n\nStaff members who submit claims must remain informed on changes in Medicare guidelines and rules. They must also have the training needed to properly submit claims.\n\nRELATED TOPIC: How health companies can improve business by integrating a smarter cold chain\n\nIf your investigation into why denials are happening shows that staff members haven't been properly trained or informed on guidelines changes, make the necessary policy changes to correct the situation.\n\nDon't let an uptick in Medicare claim denials affect your health care facility's revenue.\n\nInstead, investigate the sources of the problems, take swift action to correct the troubles and set a new standard for keeping current with Medicare claim guidelines.\n\nAbout the author: Shayla Ebsen is a freelance writer and editor with more than 10 years of professional writing experience both in the corporate and freelance settings.\n\nLet's connect! Like us on Facebook and follow us on Twitter!\n\nClick here to read the latest edition of Business Review USA", "article_metadata": {"keywords": "Medicare", "og": {"image": "http://www.businessreviewusa.com/public/uploads/large/large_dc607f1f_fcdb_f32d_8493_606165a05dad.jpg", "description": "Don't let an uptick in Medicare claim denials affect your health care facility's revenue.", "title": "How Medicare claim denials can be affecting your medical facility"}, "description": "Don't let an uptick in Medicare claim denials affect your health care facility's revenue.", "viewport": "width=device-width, initial-scale=1"}, "article_summary": "How Medicare claim denials can be affecting your medical facilityHas your health care facility recently been plagued by an onslaught of Medicare claim denials?\nTrack changes in claim requirementsYou can't properly avoid Medicare claim denials if you aren't informed of the latest changes in claim guidelines and rules.\nInform your staffCommunication is key when trying to reduce the number of Medicare claim denials that come back to your health care facility.\nUnderstand provider issuesAccording to the article \u201cA basic guide to reducing Medicare claim denials,\u201d many facilities are currently receiving claim denials because a \u201creferring provider cannot order or refer.\u201dThis denial is most typically linked to a 2014 change in the rules from the Centers for Medicare and Medicaid Services.\nDon't let an uptick in Medicare claim denials affect your health care facility's revenue."}