{"article_title": "Former Club for Growth Prez Endorses Rubio", "article_keywords": ["chocola", "marco", "club", "endorses", "cruz", "standard", "senate", "rubio", "growth", "prez", "president", "nonprofit"], "article_url": "http://www.weeklystandard.com/former-club-for-growth-prez-endorses-rubio/article/2000425", "article_text": "\"While leading the Club For Growth, Chris Chocola went against the Republican establishment by backing Marco Rubio for Senate in 2009,\" Conant said. \"Chris saw firsthand how Marco stood up to the Washington establishment then, has been impressed with how he's done it in the Senate, and knows Marco will continue to do so as president.\"\n\nThe Club for Growth, a conservative non-profit with a focus on economic issues like taxes, trade, and government spending, has long allied itself with Rubio. In 2010 the Club's political action committee endorsed him in his Senate race in Florida, back when Chocola was president of the non-profit organization. And current Club president David McIntosh has praised Rubio, along with Texas senator Ted Cruz, for being \"gold standard\" presidential candidates . The Club's PAC has bundled for Rubio, Cruz, Rand Paul, Jeb Bush, and Scott Walker in the GOP primary.\n\n\"Marco is committed to expanding jobs and opportunity for all Americans, and he has successfully chipped away at Obamacare and consistently fought back against burdensome regulations that are crippling businesses from hiring more workers and increasing wages,\" said Chocola. \"Under Marco's leadership, all American families will know that their best days lie ahead.\"\n\nThe Weekly Standard http://assets.weeklystandard.com.s3.amazonaws.com/tws15/images/logo-large.png\n\nThe Weekly Standard\n\n2016\n\nWashington, DC\n\nPolitics\n\nhttp://www.weeklystandard.com/former-club-for-growth-prez-endorses-rubio/article/2000425\n\n2016-01-05T16:01\n\n2016-01-05T16:01\n\nFormer Club for Growth Prez Endorses Rubio\n\nThe former president of an influential conservative organization is endorsing Marco Rubio for president, THE WEEKLY STANDARD has learned. Chris Chocola, the former Indiana congressman who was president of the Club for Growth from 2009 to 2014, tells TWS the Florida senator is a strong fiscal conservative and living testament to the American Dream. Marco is committed to expanding jobs and opportunity for all Americans, and he has successfully chipped away at Obamacare and consistently fought back against burdensome regulations that are crippling businesses from hiring more workers and increasing wages, said Chocola. Under Marco's leadership, all American families will know that their best days lie ahead. The Club for Growth, a conservative non-profit with a focus on economic issues like taxes, trade, and government spending, has long allied itself with Rubio. In 2010 the Club's political action committee endorsed him in his Senate race in Florida, back when Chocola was president of the non-profit organization. And current Club president David McIntosh has praised Rubio, along with Texas senator Ted Cruz, for being gold standard presidential candidates. The Club's PAC has bundled for Rubio, Cruz, Rand Paul, Jeb Bush, and Scott Walker in the GOP primary.\n\nMichael Warren\n\nhttp://cdn.weeklystandard.biz/cache/280x280-5717657e4ca283056550078afd28dbff.jpg", "article_metadata": {"news_keywords": "Michael Warren", "og": {"site_name": "Weekly Standard", "description": "The former president of an influential conservative organization is endorsing Marco Rubio for president, THE WEEKLY STANDARD has learned. Chris Chocola, the former Indiana congressman who was president of the Club for Growth from 2009 to 2014, tells TWS the Florida senator is a strong fiscal conservative and living testament to the American Dream.\nMarco is committed to expanding jobs and opportunity for all Americans, and he has successfully chipped away at Obamacare and consistently fought back against burdensome regulations that are crippling businesses from hiring more workers and increasing wages, said Chocola. Under Marco's leadership, all American families will know that their best days lie ahead.\nThe Club for Growth, a conservative non-profit with a focus on economic issues like taxes, trade, and government spending, has long allied itself with Rubio. In 2010 the Club's political action committee endorsed him in his Senate race in Florida, back when Chocola was president of the non-profit organization. And current Club president David McIntosh has praised Rubio, along with Texas senator Ted Cruz, for being gold standard presidential candidates. The Club's PAC has bundled for Rubio, Cruz, Rand Paul, Jeb Bush, and Scott Walker in the GOP primary.", "title": "Former Club for Growth Prez Endorses Rubio", "url": "http://www.weeklystandard.com/former-club-for-growth-prez-endorses-rubio/article/2000425", "image": "http://cdn.weeklystandard.biz/cache/r960-5717657e4ca283056550078afd28dbff.jpg", "type": "article"}, "twitter": {"description": "The former president of an influential conservative organization is endorsing Marco Rubio for president, THE WEEKLY STANDARD has learned. Chris Chocola, the former Indiana congressman who was president of the Club for Growth from 2009 to 2014, tells TWS the Florida senator is a strong fiscal conservative and living testament to the American Dream.\nMarco is committed to expanding jobs and opportunity for all Americans, and he has successfully chipped away at Obamacare and consistently fought back against burdensome regulations that are crippling businesses from hiring more workers and increasing wages, said Chocola. Under Marco's leadership, all American families will know that their best days lie ahead.\nThe Club for Growth, a conservative non-profit with a focus on economic issues like taxes, trade, and government spending, has long allied itself with Rubio. In 2010 the Club's political action committee endorsed him in his Senate race in Florida, back when Chocola was president of the non-profit organization. And current Club president David McIntosh has praised Rubio, along with Texas senator Ted Cruz, for being gold standard presidential candidates. The Club's PAC has bundled for Rubio, Cruz, Rand Paul, Jeb Bush, and Scott Walker in the GOP primary.", "creator": "@MichaelRWarren", "image": "http://cdn.weeklystandard.biz/cache/r960-5717657e4ca283056550078afd28dbff.jpg", "title": "Former Club for Growth Prez Endorses Rubio", "site": "@weeklystandard", "widgets": {"csp": "on"}, "card": "summary"}, "fb": {"admins": 1285945407}, "google-site-verification": "QxcYUvYDy42iu46zPMF2vwdQlMXsJP74MqOgujGnpaQ", "keywords": "Michael Warren", "article": {"author": "MICHAEL WARREN", "published_time": "2016-01-05 16:01", "title": "Former Club for Growth Prez Endorses Rubio"}, "viewport": "width=device-width,user-scalable=0"}, "article_summary": "The Weekly Standard http://assets.weeklystandard.com.s3.amazonaws.com/tws15/images/logo-large.pngThe Weekly Standard2016Washington, DCPoliticshttp://www.weeklystandard.com/former-club-for-growth-prez-endorses-rubio/article/20004252016-01-05T16:012016-01-05T16:01Former Club for Growth Prez Endorses RubioThe former president of an influential conservative organization is endorsing Marco Rubio for president, THE WEEKLY STANDARD has learned.\n\"While leading the Club For Growth, Chris Chocola went against the Republican establishment by backing Marco Rubio for Senate in 2009,\" Conant said.\nThe Club's PAC has bundled for Rubio, Cruz, Rand Paul, Jeb Bush, and Scott Walker in the GOP primary.\nAnd current Club president David McIntosh has praised Rubio, along with Texas senator Ted Cruz, for being \"gold standard\" presidential candidates .\nAnd current Club president David McIntosh has praised Rubio, along with Texas senator Ted Cruz, for being gold standard presidential candidates."}