{"article_title": "'Sleepy Hollow' Season 2 Spoilers: Evil Coin Making Townspeople Act Out Violent Fantasies, 'One Tree Hill' Actor Matt Barr Guest-Starring [VIDEO] : The Eye : Fashion & Style", "article_keywords": ["style", "henry", "root", "receive", "spoilers", "secret", "tree", "matt", "season", "hollow", "nick", "violent", "video", "townspeople", "making", "coin", "judas", "sleepy"], "article_url": "http://www.fashionnstyle.com/articles/26935/20141005/sleepy-hollow-season-2-spoilers-evil-coin-making-townspeople-act-out-violent-fantasies-one-tree-hill-actor-matt-barr-guest-starring-video.htm", "article_text": "The Eye\n\n'Sleepy Hollow' Season 2 Spoilers: Evil Coin Making Townspeople Act Out Violent Fantasies, 'One Tree Hill' Actor Matt Barr Guest-Starring [VIDEO]\n\nSIGN UP TO RECEIVE THE LATEST NEWS FROM FASHION&STYLE\n\n(Photo : Fox) They're after the 'Root of All Evil'.\n\nOn tomorrow night's episode of \"Sleepy Hollow\", titled 'Root of all Evil', some of the town's \"usually benevolent\" residents pull what seem to be emotional and psychological one-eighties. After a violent bank robbery, Ichabod (Tom Mison) realizes the Judas Coin, a \"centuries old piece of mystical currency with the power to bring the previously dormant but decidedly deadly urges of its bearer to the fore,\" is to blame.\n\n\n\nHe and Abbie (Nicole Beharie) deduce that Henry Parish (John Noble) is at fault, but aren't sure what his end game is. That's where Nick Hawley (Matt Barr), a \"highly capable local adventurer and purveyor of rare and mystical artifacts\" comes in.\n\n\n\nIchabod is weary of Nick at first, but they put aside their differences and discover that the next target of the Henry and the Judas Coin is someone close to the Witnesses, \"one whose darkest thoughts \u2014 if left unchecked \u2014 could have deadly consequences for the pair.\"\n\n\n\nCould Henry be headed for Captain Irving (Orlando Jones) at the psych hospital?\n\n\n\nRELATED: San Diego Comic-Con 2014 'Sleepy Hollow' Panel Announces New Characters, Katrina's Powers, and 'Twistory'\n\nWhile Ichabod and Abbie are investigating the Judas Coin, Jenny (Lyndie Greenwood), just released from jail, discovers a surprising secret about the new Sheriff, Leena Reyes (Sakina Jaffrey) \u2014 a secret that has to do with the Mills sisters.\n\n\n\nKatrina (Katia Winter), meanwhile, plots to \"drive a wedge\" between the two Horesmen holding her captive, hoping she can distract them long enough to escape.\n\n\n\nSounds exciting! Are you looking forward to the new episode? If not, the below clip might get you pumped up!\n\n\n\n\n\n\n\nSIGN UP TO RECEIVE THE LATEST NEWS FROM FASHION&STYLE\n\n\u00a9 2015 Fashion & Style.com All rights reserved. Do not reproduce without permission.", "article_metadata": {"Description": "When a bank robbery turns violent, Ichabod and Abbie run to the rescue.", "Copyright": "2014 Fashion&Style", "Author": "Fashion&Style", "og": {"site_name": "Fashion & Style", "description": "When a bank robbery turns violent, Ichabod and Abbie run to the rescue.", "title": "'Sleepy Hollow' Season 2 Spoilers: Evil Coin Making Townspeople Act Out Violent Fantasies, 'One Tree Hill' Actor Matt Barr Guest-Starring [VIDEO]", "url": "http://www.fashionnstyle.com/articles/26935/20141005/sleepy-hollow-season-2-spoilers-evil-coin-making-townspeople-act-out-violent-fantasies-one-tree-hill-actor-matt-barr-guest-starring-video.htm", "image": "http://images.fashionnstyle.com/data/images/full/43076/sleepy-hollow-ichabod-abbie-tom-mison-nicole-beharie.jpg", "type": "article"}, "twitter": {"domain": "fashionnstyle.com", "description": "When a bank robbery turns violent, Ichabod and Abbie run to the rescue.", "title": "'Sleepy Hollow' Season 2 Spoilers: Evil Coin Making Townspeople Act Out Violent Fantasies, 'One Tree Hill' Actor Matt Barr Guest-Starring [VIDEO]", "url": "http://www.fashionnstyle.com/articles/26935/20141005/sleepy-hollow-season-2-spoilers-evil-coin-making-townspeople-act-out-violent-fantasies-one-tree-hill-actor-matt-barr-guest-starring-video.htm", "image": "http://images.fashionnstyle.com/data/images/full/43076/sleepy-hollow-ichabod-abbie-tom-mison-nicole-beharie.jpg", "creator": "@FNStylecom", "site": "@FNStylecom", "card": "summary_large_image"}, "syndication-source": "http://www.fashionnstyle.com/articles/26935/20141005/sleepy-hollow-season-2-spoilers-evil-coin-making-townspeople-act-out-violent-fantasies-one-tree-hill-actor-matt-barr-guest-starring-video.htm", "robots": "index, follow", "Title": "Fashion&Style offers online coverage of latest fashion news, hottest trends and celebrity style from around the world, unveiling fashion and style from street corners to runways and red carpets.", "Googlebot-news": "index, follow", "Keywords": "Fashion&Style", "article": {"published_time": "2014-10-05"}, "news_keywords": "sleepy hollow, sleepy hollow season 2, spoilers, root of all evil, judas coin, matt barr", "viewport": "width=device-width", "Subject": "fashionnstyle.com"}, "article_summary": "On tomorrow night's episode of \"Sleepy Hollow\", titled 'Root of all Evil', some of the town's \"usually benevolent\" residents pull what seem to be emotional and psychological one-eighties.\nThe Eye'Sleepy Hollow' Season 2 Spoilers: Evil Coin Making Townspeople Act Out Violent Fantasies, 'One Tree Hill' Actor Matt Barr Guest-Starring [VIDEO]SIGN UP TO RECEIVE THE LATEST NEWS FROM FASHION&STYLE(Photo : Fox) They're after the 'Root of All Evil'.\nThat's where Nick Hawley (Matt Barr), a \"highly capable local adventurer and purveyor of rare and mystical artifacts\" comes in.\nHe and Abbie (Nicole Beharie) deduce that Henry Parish (John Noble) is at fault, but aren't sure what his end game is.\nSIGN UP TO RECEIVE THE LATEST NEWS FROM FASHION&STYLE\u00a9 2015 Fashion & Style.com All rights reserved."}