{"article_title": "James J. DiNicolantonio", "article_keywords": ["heart", "institute", "james", "j", "mid", "research", "lukes", "dinicolantonio", "scientist", "saint", "cardiovascular"], "article_url": "http://www.usnews.com/topics/author/james-j-dinicolantonio", "article_text": "James J. DiNicolantonio Contributor\n\nJames J. DiNicolantonio, PharmD, is a cardiovascular research scientist at Saint Luke\u2019s Mid America Heart Institute. Dr. DiNicolantonio is currently completing his third-year as a cardiovascular research scientist at Saint Luke\u2019s Mid America Heart Institute, Kansas City, Missouri. Dr. DiNicolantonio\u2019s research interests focus on cardiovascular health and disease, including topics such as diabetes, obesity, hypertension, insulin resistance, lipids, antithrombotics, anticoagulants, as well as nutrition (with particular focus on refined sugars and salt) and nutritional supplements. He is the author or co-author of more than 150 medical publications, encompassing opinion pieces, review articles and systematic reviews and meta-analyses.", "article_metadata": {"description": "US News is a recognized leader in college, grad school, hospital, mutual fund, and car rankings.  Track elected officials, research health conditions, and find news you can use in politics, business, health, and education.", "zone": "James J. DiNicolantonio", "og": {"image": "http://www.usnews.com/cmsmedia/36/24/93376e87484e921ea552ecf7c663/151117-butterstick-stock.jpg"}, "site": "topics", "keywords": "James J. DiNicolantonio", "viewport": "width=device-width, initial-scale=1"}, "article_summary": "James J. DiNicolantonio ContributorJames J. DiNicolantonio, PharmD, is a cardiovascular research scientist at Saint Luke\u2019s Mid America Heart Institute.\nDr. DiNicolantonio is currently completing his third-year as a cardiovascular research scientist at Saint Luke\u2019s Mid America Heart Institute, Kansas City, Missouri.\nHe is the author or co-author of more than 150 medical publications, encompassing opinion pieces, review articles and systematic reviews and meta-analyses.\nDr. DiNicolantonio\u2019s research interests focus on cardiovascular health and disease, including topics such as diabetes, obesity, hypertension, insulin resistance, lipids, antithrombotics, anticoagulants, as well as nutrition (with particular focus on refined sugars and salt) and nutritional supplements."}