{"article_title": "GOP DEBATE DAY! \u2013 \u2018TRUMP, SANDERS: Are they killing the market?\u2019 \u2013 PHILIPPE\u2019s blistering email -- MADELEINE\u2019s mea culpa", "article_keywords": ["sanders", "mea", "trump", "philippes", "gop", "madeleines", "debate", "ht", "killing", "rubio", "playbook", "president", "sc", "et", "times", "email", "market", "roundtable"], "article_url": "http://www.politico.com/playbook/2016/02/gop-debate-day-trump-sanders-feb-13-212694", "article_text": "GOP DEBATE DAY! \u2013 \u2018TRUMP, SANDERS: Are they killing the market?\u2019 \u2013 PHILIPPE\u2019s blistering email -- MADELEINE\u2019s mea culpa\n\nBy Mike Allen (@mikeallen; mallen@politico.com) and Daniel Lippman (@dlippman; dlippman@politico.com)\n\nSIREN -- \u201cGOP mega-donors frozen in frustration: Big money stops flowing as donors question its effectiveness, worry about Trump,\u201d by Ken Vogel: \u201cMany of the donors are urging the deep-pocketed groups they\u2019ve already funded [including Koch network] to begin spending against Trump, even as some recognize the potential for such spending to backfire, and are increasingly questioning the efficacy of big-money advertising campaigns more generally.\u201d http://politi.co/1ThDyzu\n\nStory Continued Below\n\n--Club for Growth action ad hits Trump -- Titled \u201cThere\u2019s Nothing Conservative about Donald Trump\u201d: \u201cThere\u2019s nothing conservative about proposing the largest tax hike in history ... supporting socialized single-payer health care ... abusing eminent domain for personal gain ... four bankruptcies ... giving money to the Clintons.\u201d http://bit.ly/20sTdLF\n\n--WashPost A1, top of col. 1, \u201cRamping up financial firepower for Clinton,\u201d by Matea Gold, Tom Hamburger and Paul Kane: \u201cPriorities USA Action ... unleashed a $5 million infusion of spending on her behalf, upending plans to hold its fire until the general election. ... [The DNC] announced that it had rolled back restrictions introduced by presidential candidate Barack Obama in 2008 that banned donations from federal lobbyists and political action committees. ...\n\n\u201c[Both moves] could backfire. ... Sanders ... issued a news release ... \u2018Clinton Wall Street-Funded Super PAC Enters Democratic Primary Against Sanders.\u2019\u201d http://wapo.st/1ocONgi\n\n--Drudge banner: \u201cDNC DIRTY: RULE CHANGE BOOSTS CLINTON CA$H.\u201d\n\n**SUBSCRIBE to Playbook: http://politi.co/1M75UbX\n\nGood Saturday morning \u2013 Valentine\u2019s Day is tomorrow. Today is NBA All-Star Saturday. DASHBOARD: 7 days to S.C. GOP primary and Nevada Democratic caucuses (Feb. 20) ... 10 days to Nevada GOP caucuses (Feb. 23) ... 14 days to S.C. Democratic primary (Feb. 27).\n\nBLOCK THAT METAPHOR! Email from Team Marco, with subject line, \u201cFighting tooth and nail\u201d: \u201cThey say politics is a contact sport, but Marco had made it this far in the campaign without any physical injuries ... until this week, when he chipped his tooth while eating a frozen Twix bar. ... [T]he media may have bitten off more than they can chew here: Marco\u2019s been to the dentist and he\u2019s ready to sink his teeth back into the policy questions voters care about.\u201d\n\nTOP TWEETS: @murphymike: \u201cSource I trust sends these SC tracking numbers from a non-Jeb campaign; Trump 34, Cruz 17, Jeb 12, Rubio 10. Kasich in single digits\u201d ... @jonathanalter: \u201cHillary is right. Bernie trashed Obama\u2019s policies routinely to me and other reporters, especially in 2011-2013 period\u201d ...@JuddLegum: \u201cIf you could force Donald Trump to read one book, what would it be?\u201d\n\nSHOTS FIRED -- @realDonaldTrump: \u201cIf @TedCruz doesn\u2019t clean up his act, stop cheating, & doing negative ads, I have standing to sue him for not being a natural born citizen.\u201d\n\nDRIVING TONIGHT: GOP Presidential Debate on CBS from 9 to 11 p.m., from the Peace Center in Greenville, S.C., with six candidates: Trump, Cruz, Rubio, Bush, Carson and Kasich. John Dickerson is principal moderator, joined by two panelists: CBS News Chief White House Correspondent Major Garrett and The Wall Street Journal\u2019s Kimberley Strassel.\n\n--\u201cCruz and Trump poised for the ugliest debate yet: These rivals are itching for a fight as South Carolina settles into a two-man race,\u201d by Katie Glueck and Ben Schreckinger: \u201cAccording to the Real Clear Politics average, Trump is running a solid first in South Carolina with 37 percent, followed by Cruz at 20 percent. (Marco Rubio sits a distant third at 14 percent.)\u201d http://politi.co/20RLQmo\n\n--JOHN DICKERSON PROFILE on cover of N.Y. Times Business Day, \u201cMolded by News Legends, Honing His Skills at CBS\u201d: \u201cThough much younger [now 47], he shared Mr. Schieffer\u2019s calm and cool demeanor (\u2018There was this quality of . . . call it, avuncular,\u2019 said David Rhodes, the president of CBS News) ...\n\n\u201c[W]hen CBS\u2019s Washington bureau chief, Christopher Isham, tried to recruit him to be a part-time analyst about eight years ago, Mr. Dickerson, then working at Slate, flatly told him no. \u2018He liked new media, but I think he was a little scared that television was not a sincere or deep medium,\u2019 said Walter Isaacson, Mr. Dickerson\u2019s former editor at Time. \u2018He was worried about television being trivializing.\u2019\u201d http://nyti.ms/1ThKAnT\n\n--\u201cCBSN (http://www.cbsnews.com/live) will offer a ... stream ... with ... real-time Google Trends data and a curated Twitter stream. ... Nancy Cordes will anchor the pre-debate show beginning at 6:00 PM ... live from the Peace Center and ... post-debate coverage at 11:00 PM.\u201d\n\n--IF YOU\u2019RE IN S.C.: Across the street from the debate site, \u201cFrank Underwood is opening his campaign office. Members of the media can stop by and see Frank\u2019s replica Oval office and get BBQ from Freddy\u2019s BBQ.\u201d Pic http://bit.ly/1PsywMJ\n\nMADELEINE ALBRIGHT on N.Y. Times Op-Ed page, \u201cMy Undiplomatic Moment: I should know better than to tell a group of women to go to hell\u201d: \u201c[L]ast Saturday, in the excitement of a campaign event for Hillary Clinton in New Hampshire, ... I delivered a line I have uttered a thousand times to applause, nodding heads and laughter: \u2018There\u2019s a special place in hell for women who don\u2019t help each other.\u2019 It is a phrase I first used almost 25 years ago, when I was the United States ambassador to the United Nations and worked closely with the six other female U.N. ambassadors. But this time, to my surprise, it went viral. ...\n\n\u201cI understand that I came across as condemning those who disagree with my political preferences. If heaven were open only to those who agreed on politics, I imagine it would be largely unoccupied.\u201d http://nyti.ms/1TYxuLC\n\nTHE CONVERSATION \u2013 Barron\u2019s cover, \u201cTRUMP, SANDERS: Are they killing the market? The rise of these two extreme candidates has correlated closely with the decline in stocks the past eight months,\u201d by Barrons.com Executive Editor John Kimelman: \u201cTrump ... could ... punish China and other trading partners with tariffs to level the playing field. ... And that\u2019s when he isn\u2019t trying to deport millions of undocumented immigrants\u2014a view that most Republicans view as highly impractical and likely to cause tremendous civil strife. ...\n\n\u201cIf ... Sanders ... were to win, ... the U.S. would have a professed democratic socialist at the helm, with a long list of ambitious but expensive goals, such as single-payer national health care, free tuition at public colleges, and a major federal bridge- and highway-construction effort. ...\n\n\u201cEd Yardeni, president of Yardeni Research and a longtime market commentator, [says] that when investors are in a bearish mood, \u2018they keep adding to their worry list. ... [A] nonestablishment figure in the West Wing might not be such a bad thing in the long run ... [I]nvestors ... have long been comfortable with political gridlock.\u201d http://bit.ly/1WiY9BD\n\n--\u201cInvestors Have Lost $1.78 Trillion so far this Year\u201d http://for.tn/1LlrQfA\n\n** A message from BP: Our refineries use robotic ultrasound technology \u2013 so they can detect and repair corrosion before it ever becomes a problem. Check out our Inspection Robots and latest safety technologies: on.bp.com/technology **\n\nTOP TALKER \u2013 \u201cPhilippe Reines rips Beltway media, Erik Wemple Blog for \u2018hypocrisy,\u2019\u201d by WashPost\u2019s Erik Wemple, who posts this email from Philippe: \u201cHi Erik ... The media on media violence triggered by the ongoing release of my inbox from the four years I served in the Administration has led me to emerge from my self-imposed hibernation (for one night only). ... [Y]ou can\u2019t throw a dart at the White House Correspondents Dinner without hitting someone who has been involved in quote approval, ground rule negotiation, source obfuscation \u2014 and every other routine thing that goes on every day ...\n\n\u201cWhile it will take until late 2018 or even 2019 for all of my 80,000+ email to be out there, I have a well informed source who already knows what\u2019s in my email: Me. I wrote them. I read them. And right or wrong, this is the norm. It\u2019s the norm in every newsroom \u2014 including your own \u2014 and every communications shop in the city. So anyone shocked by the gambling going on in the casino is being disingenuous at best. And they are setting themselves up for a fall when their email is outed. ... Best, Philippe.\u201d http://wapo.st/1TYwUxJ\n\nPETER HAMBY in the news -- NYT A13, \u201cCapturing the Campaign In 10-Second Increments: Snapchat places a big bet as it enters the news business, by Nick Corasaniti in Bedford, N.H.: \u201cHamby, a former CNN reporter, was the first splashy hire. He brought on Katy Byron, a former CNBC producer and two-time Peabody Award winner, as his managing editor. They hired from CBS, ABC, cable networks and colleges for a team of roughly six journalists. ... [T]hey are already finding an audience, with more than one million viewers on every political story that they have produced.\u201d http://nyti.ms/1RwSI2F\n\nMOOD MUSIC -- MICHAEL GRUNWALD, \u201cClinton Backs Into a New Corner: If she thinks America is such a mess, why wouldn\u2019t we want something different?\u201d: \u201c[O]nly one quarter of Americans believe the country is on the right track. Still, it was striking that after a record 71 months of employment growth that have created 14 million new jobs, at a time when gasoline is cheap and health care inflation is at the lowest level in half a century and the federal deficit has dropped by more than two thirds, the party in power was essentially embracing the Republican view of America as a dumpster fire.\u201d http://politi.co/1Wi1fWw\n\n--\u201cGOP Oppo Firm Gearing Up For A Possible Sanders Nomination,\u201d by BuzzFeed\u2019s Andrew Kaczynski: \u201cAmerica Rising sent a batch of routine [FOIA] requests this week asking for correspondence between Sanders\u2019 Senate office and federal government departments.\u201d http://bzfd.it/1QwUIDb\n\nWHAT S.C. IS READING \u2013 The (Columbia) State banner, \u201cTrump targeted ahead of SC Republican debate: Opponents question GOP front-runner\u2019s conservative credibility,\u201d by Andrew Shain in Greenville: \u201cDonald Trump better buckle up. ... Some conservative groups ... are asking voters to avoid Trump when they go to the S.C. polls Feb. 20. The pro-life advocacy group Susan B. Anthony List ... said Trump cannot be trusted.\u201d http://bit.ly/1QdDock\n\n--The (Columbia) State front page, above fold, \u201cClinton in SC touts plan for poor, rural communities,\u201d by Jamie Self in Denmark: \u201cInvoking the names of President Barack Obama and U.S. Rep. Jim Clyburn, Clinton pitched pitch herself as a better candidate than Sanders, a Vermont independent who has not been to South Carolina since the Martin Luther King weekend. \u2018(Sanders) does not support, the way I do, building on the progress that the president has made, and that includes building on the Affordable Care Act.\u2019\u201d http://bit.ly/1ThDsYN\n\nWORTH THE CLICK -- \u201cWatch The Funniest Ad Of The 2016 Campaign,\u201d by HuffPost\u2019s Christina Willkie: \u201cOn Friday, the Cruz campaign ... releas[ed] a spoof of the iconic printer beating scene from the 1990s cult classic movie \u2018Office Space.\u2019 Originally set to the Geto Boys\u2019 \u2018Damn It Feels Good to be a Gangsta,\u2019 the Cruz version of the scene borrows the music and changes the lyrics to \u2018Damn it feels good to be a Clinton.\u2019\u201d http://huff.to/1Ps4itf ... The original 90-sec. scene http://bit.ly/1PsgBWt ... Trailer http://bit.ly/1TXz14I\n\n--@TheGetoBoys: \u201cWe don\u2019t support @tedcruz or his super lame ad using our music.\u201d\n\nNEW CONSERVATIVE SOLUTIONS PAC ad, \u201cDifferent,\u201d has its stern narrator say: \u201cTed Cruz voted to undermine our National Defense and weaken our ability to track terrorists. Marco Rubio is different. He knows how to keep us safe.\u201d http://bit.ly/1oblT06\n\nTHE NEW GILDED AGE \u2013 N.Y. Times A1, above fold, \u201cDisparity in Life Spans of the Rich and the Poor Is Growing,\u201d by Sabrina Tavernise: \u201cLooking at the extreme ends of the income spectrum, economists at the Brookings Institution found that for men born in 1920, there was a six-year difference in life expectancy between the top 10 percent of earners and the bottom 10 percent. For men born in 1950, that difference had more than doubled, to 14 years. For women, the gap grew to 13 years, from 4.7 years.\u201d http://nyti.ms/1KL7tNK\n\nPOLITICAL EMAIL SUBJECT LINE DU JOUR \u2013 From Joe Biden: \u201cI want you to get your Official Membership Card, Daniel\u201d.\n\nCLICKERS -- \u201cThe nation\u2019s cartoonists on the week in politics,\u201d edited by Matt Wuerker \u2013 12 keepers http://politi.co/1RwOWGw\n\nA NEW \u201cSNOWFALL\u201d: \u201cThe Waypoint -- A visual journey through Lesbos, the gateway to Europe\u201d -- WashPost http://wapo.st/20QusP0\n\nGREAT WEEKEND READS, curated by Daniel Lippman, filing from NYC, where he\u2019s seeing \u201cHamilton\u201d tonight:\n\n--\u201cWe Are Hopelessly Hooked,\u201d by Jacob Weisberg in the N.Y. Review of Books: \u201cOnce out of bed, we check our phones 221 times a day\u2014an average of every 4.3 minutes ... What does it mean to shift overnight from a society in which people walk down the street looking around to one in which people walk down the street looking at machines?\u201d http://bit.ly/1TgAdka\n\n--\u201cHow America Is Putting Itself Back Together,\u201d by James Fallows on the cover of March\u2019s Atlantic: \u201cMost people in the U.S. believe their country is going to hell. But they\u2019re wrong. What a three-year journey by single-engine plane reveals about reinvention and renewal.\u201d http://theatln.tc/1Xof2Mm ... See the cover. http://bit.ly/1objORU\n\n--\u201cA Country Breaking Down,\u201d by Elizabeth Drew in the N.Y. Review of Books: \u201cThe near-total failure of our political institutions to invest for the future ... has left us with hopelessly clogged traffic, at risk of being on a bridge that collapses, or on a train that flies off defective rails, or with rusted pipes carrying our drinking water.\u201d http://bit.ly/1oaVFdX\n\n--\u201cCan This Man Save U.S. Soccer?\u201d by Amanda Ripley in the March issue of The Atlantic: \u201cHow one teacher is attempting to train a generation of globally competitive players--starting with their coaches.\u201d http://theatln.tc/1PHWMIG\n\n--\u201cAmerican Pharoah\u2019s Second Life as a $200-K-A-Night Stud,\u201d by Monte Reel in Bloomberg Businessweek: \u201cThe world\u2019s fastest horse could earn more in the shed than he made on the track.\u201d http://bloom.bg/1SmgWxD\n\n--\u201cCould You Stomach the Horrors of \u2018Halftime\u2019 in Ancient Rome?\u201d by Cristin O\u2019Keefe Aptowicz in LiveScience.com: \u201cWith a flourish, trapdoors in the floor of the arena were opened, and lions, bears, wild boars and leopards rushed into the arena. The starved animals bounded toward the terrified criminals, who attempted to leap away from the beasts\u2019 snapping jaws.\u201d http://bit.ly/241nMg4\n\n--\u201cThe Killing of Warren Weinstein,\u201d by Daniel Bergner in tomorrow\u2019s N.Y. Times Magazine: \u201cAfter the American aid worker was abducted in Pakistan, his family undertook a delicate negotiation in hopes of securing his release. But then they got word that he had died \u2014 in a United States drone strike.\u201d http://nyti.ms/1R0ax8g\n\n--\u201cWhy anti-intellectualism is the real snobbery,\u201d by Steven Poole in The Guardian, reviewing \u201cPretentiousness: Why It Matters\u201d by Dan Fox: \u201cCalling something pretentious is lazy, vacuous and smug \u2013 after all, it\u2019s good at times for our ambition to outstrip our abilities. Those who invoke bluff \u2018common sense\u2019 are the actual snobs.\u201d http://bit.ly/1Lln5T9 ... Pre-order -- $15.95 on Amazon http://amzn.to/1Wi9S3x (h/t ALDaily.com)\n\nFIRST LOOK \u2013 \u201cCitizens for Responsible Energy Solutions Unveils New TV Ad\u201d: \u201cwill air in South Carolina and Washington ... during [tonight\u2019s] GOP debate. It highlights Governor Nikki Haley\u2019s leadership on renewable energy.\u201d http://bit.ly/1TXkXs5\n\nROMNEY ALUMNI -- Sarah Pompei, most recently at HP who was deputy comms. director on Romney 2012, is starting with Lyft on Tuesday on the Public Affairs team under David Mack. She\u2019ll be the Senior Public Affairs Manager working with the Government Relations team to bring Lyft to new markets around the country.\n\n#GrammysSoWhite? -- L.A. Times Calendar front, #OscarsSoWhite, Grammys style: With Taylor Swift nominated for seven awards [in Monday\u2019s show], the music industry could be facing a backlash over diversity,\u201d by Mikael Wood: Swift is nominated for seven prizes, including ... album of the year for \u20181989,\u2019 ... widely tipped as the favorite in that category, which ... includes ... \u2018To Pimp a Butterfly,\u2019 the searing, proudly African American masterpiece by the Los Angeles rapper Kendrick Lamar ... If she ... beats Lamar[,] she risks being seen as a happy beneficiary (or perhaps even an agent) of show-biz prejudice.\u201d http://lat.ms/1XpvoEB\n\nHOLLYWOODLAND -- \u201cDr. Dre Filming Apple\u2019s First Scripted Television Series,\u201d by The Hollywood Reporter\u2019s Michael O\u2019Connell and Lesley Goldberg: \u201cBeats co-founder and rap legend Dr. Dre ... is starring in and executive producing his own six-episode vehicle, dubbed Vital Signs, and the production is being bankrolled by Apple. The series likely will be distributed via Apple Music.\u201d http://bit.ly/1SmlvIf\n\nDEADLINE MONDAY \u2013 \u201cEditor & Publisher wants to recognize the next generation of newspaper publishing leaders [35 and younger] ... Please help us by nominating a newspaper up-and-comer (or yourself) for our \u2018Publishing Leaders \u2014 25 Under 35\u2019 feature article that will appear in E&P's April issue. ... Candidates may be publishers, editors, advertising executives, circulation managers or other newspaper leaders.\u201d http://bit.ly/241sQkA\n\nOBAMA\u2019S WEEK AHEAD: \u201cOn Saturday and Sunday, the President will remain in the Palm Springs, California area and has no public events scheduled. ... On Monday, and Tuesday, the President will host a summit with leaders from the Association of Southeast Asian Nations at Sunnylands in Rancho Mirage, CA to continue important conversations about the Asia-Pacific region. Following the conclusion of the summit, the President will return to Washington ...\n\n\u201cOn Thursday, the President will welcome the Chicago Blackhawks ... to honor the team on their 2015 Stanley Cup victory. ... Afterward, President and the First Lady will host a reception celebrating Black History Month in the East Room. On Friday, the President will meet with Democratic Governors at the White House. On Sunday, the President will deliver remarks at the National Governors Association Dinner and Reception at the White House.\u201d\n\nBIRTHWEEK (was yesterday): ABC alum Yunji de Nies, now an anchor/reporter for KITV in Hawaii\n\nBIRTHDAYS: Chip Smith, managing director and CEO of Glover Park Group (h/ts Michael, Carter, Joe, Joel) ... Sen. Richard Blumenthal (D-Conn.) ... Missouri Gov. Jay Nixon \u2026 Jerry Springer ... Politico\u2019s Chris Conway ... Politico New York\u2019s Production Editor Peter Lettre ... Alex Burgos of Rubio Senate office \u2026 Bloomberg\u2019s Stacie Sherman ... Raven Reeder, chief of staff to DC Rep. Eleanor Holmes Norton (h/t Kiara Pesante) ... Lila Nieves-Lee of the House Foreign Affairs Committee (h/t HFAC & DCYRs) ... Danielle Baussan, CAP\u2019s managing director of energy policy, currently on maternity leave with #2 (h/t DJW) \u2026 Brian Szmytke, a Republican political operative from Michigan now, on the Nevada staff of Rubio campaign ... Mae Stevens, an environment LA in the U.S. Senate ... Lauren Hammond, Sen. John Thune\u2019s Senate Commerce Committee press secretary (h/t Fred Hill) ... Jill Barclay of Harbinger Outreach and a RNC and Romney alum (h/t Ryan Williams) ... Les Francis, former exec. director of DNC and DCCC (h/t Jon Haber) ...\n\n... Camille Johnston of Siemens (h/t Jo) ... Politico alum Sunny Mehta, now an associate at Clyde Group ... Stephen Bauer \u2026 Diane Ward ... George Kundanis \u2026 Simone White \u2026 Jeff Stein ... Mark Cohen, senior speechwriter for Treasury Secretary Lew \u2026 J.R. Claeys, Kansas state representative ... Unjin Lee ... Mary Tiffany Cownie, director of the Iowa Dept. of Cultural Affairs and a Bush 43 WH alum ... Bill McCarren, executive director of National Press Club (h/t Andrea) ... Ryan Cunningham ... WSJ autos reporter Mike Spector is 35 ... Maruffe S. Oliveira ... Jeanne Mancini, president of the March for Life (h/t Kevin McVicker) ... U.S. Air Force Maj. Gen. Charles E. \u201cChuck\u201d Yeager (ret.) is 93 ... Bo Svenson is 75 ... Stockard Channing is 72 ... Jerry Springer is 72 ... Peter Gabriel is 66 ... actress Katie Volding is 27 ... Michael Joseph Jackson Jr. (also known as Prince Michael Jackson I) is 19 (h/ts AP)\n\nTHE SHOWS, from @MattMackowiak, filing from Greenville, S.C.:\n\n--NBC\u2019s \u201cMeet the Press\u201d: Donald Trump (live from Florida); Marco Rubio; John Kasich; roundtable: Chris Cillizza, Ron Fournier, Gwen Ifill, Kathleen Parker and Al Sharpton\n\n--ABC\u2019s \u201cThis Week\u201d: John Kasich; Marco Rubio; Bernie Sanders; roundtable: Matt Bai, LZ Granderson, Bill Kristol and Ana Navarro\n\n--CBS\u2019s \u201cFace the Nation\u201d: Donald Trump; Marco Rubio; Bernie Sanders; roundtable: Jamelle Bouie, Peggy Noonan, Dan Balz and Kimberley Strassel; new results from the CBS News 2016 Battleground Tracker Poll with Anthony Salvanto (airing live from Greenville, SC)\n\n--\u201cFox News Sunday\u201d: Marco Rubio; Bernie Sanders; roundtable: George Will, David Gregory, Kristen Soltis Anderson and Juan Williams\n\n--CNN\u2019s \u201cState of the Union\u201d (9am ET / 12pm ET): Jeb Bush; Marco Rubio; roundtable: Donna Brazile, Hugh Hewitt, Kellyanne Conway and Bill Press (substitute anchor: CNN\u2019s Dana Bash)\n\n--CNN\u2019s \u201cInside Politics\u201d with John King (SUN 8am ET): Roundtable: Julie Pace, Ryan Lizza, Jackie Kucinich and Manu Raju\n\n--Fox News\u2019 \u201cSunday Morning Futures\u201d (10am ET / 9am CT): Paul Ryan; Marine Corps University\u2019s Dr. Sebastian Gorka; roundtable: Mary Kissel, Ed Rollins and Judith Miller\n\n--Fox News\u2019 \u201cMediaBuzz\u201d (11am ET / 10am CT): Heidi Przybyla; Juleanna Glover; Simon Rosenberg; Trish Regan; Mary Katharine Ham\n\n--CNN\u2019s \u201cReliable Sources\u201d: (SUN 11am ET): Bob Schieffer; David Zurawik; Ryan Grim; Kathy Kiely and Dennis Kneale; James Fallows and Douglas Brinkley\n\n--CNN\u2019s \u201cFareed Zakaria GPS\u201d: (SUN 10am ET / 1pm ET): Michael Chertoff and Peter Bergen; Rana Foroohar and Martin Wolf; Harry Belafonte; Alec Ross\n\n--Univision\u2019s \u201cAl Punto\u201d (SUN 10am ET / 1pm PT) Special live episode of Pope Francis\u2019 arrival in Mexico City\n\n--C-SPAN: \u201cThe Communicators\u201d (SAT 6:30pm ET): FCC Commissioner Mignon Clyburn (D), questioned by WSJ\u2019s John McKinnon ...\u201cNewsmakers\u201d (SUN 10am ET): Johnny Isakson, questioned by Politico\u2019s Connor O\u2019Brien and Military Times\u2019 Leo Shane ... \u201cQ&A\u201d (SUN 8pm & 11pm ET): Robert Gates\n\n--MSNBC\u2019s \u201cPoliticsNation with Rev. Al Sharpton\u201d: (SUN 8-9am ET): Bernie Sanders; Hillary Clinton\n\n--MSNBC\u2019s \u201cThe Place for Politics\u201d: (SUN 10am-12pm ET): Former SC GOP chairman Katon Dawson; MSNBC contributor Robert Traynham; the University of Maryland\u2019s Janelle Wong; The New York Daily News\u2019 Sarah Ryley; The Nation Magazine\u2019s Ari Berman; NAACP North Carolina president Rev. Dr. William Barber; Vanderbilt University\u2019s Jonathan Metzl; MSNBC\u2019s Trymaine Lee; St. Louis 21st Ward Alderman Antonio French; trans activist Cherno Biko; the University of Pennsylvania\u2019s Salamishah Tillet (MSNBC\u2019s Joy Reid hosts live from South Carolina)\n\n--MSNBC\u2019s \u201cThe Place for Politics\u201d: (SUN noon 2pm ET): Charleston Post & Courier\u2019s Gavin Jackson; Gregory Meeks; NYT\u2019s Jeremy Peters; Michael Steele; Larry Sabato (MSNBC\u2019s Alex Witt hosts)\n\n--PBS\u2019s \u201cTo the Contrary\u201d with Bonnie Erb\u00e9: Smith College\u2019s Riche Barnes; Roundtable: Exceptional Leadership Institute for Women founder Avis Jones DeWeever, Eleanor Holmes Norton, conservative commentator Dana White and Independent Women\u2019s Forum senior fellow and Generation Opportunity national spokeswoman Patrice Lee\n\n--WUSA 9 \u201cCapital Download\u201d with Derek McGinty and Susan Page: (SUN 8:30am ET): Jim Clyburn; roundtable: Dana Milbank and Margaret Talev; Center for Public Integrity\u2019s Dave Levinthal\n\n--SiriusXM's \u201cNo Labels Radio\u201d (SUN 6am ET & 9pm ET): Special best-of broadcast featuring host Jon Huntsman discussing the prospects of a 3rd party candidate with No Labels vice chair Charlie Black, Roll Call\u2019s Melinda Henneberger and former Clinton adviser and The Stagwell Group founder Mark Penn. Interviews with The Goldwater Institute\u2019s Clint Bolick on immigration reform and Alan Simpson on the 2016 election. Available for download at http://www.nolabels.org\n\n--Sinclair\u2019s \u201cFull Measure\u201d with Sharyl Attkisson (SUN 9:30am ET on WJLA and airing on Sinclair stations nationwide): Correspondent Scott Thuman visits Paris three months after the terror attacks. Roundtable: Jim Messina and Karl Rove; report on President Obama\u2019s last budget; segment on how the Navy once camouflaged ships.\n\n** A message from BP: Safety is never being satisfied \u2013 and always working to be better. That\u2019s why at BP, we\u2019re working every day to improve our training, our technology, our culture. See real examples of our progress: on.bp.com/safety **\n\nSUBSCRIBE to the Playbook family: POLITICO Playbook http://politi.co/1M75UbX ... New York Playbook http://politi.co/1ON8bqW ...Florida Playbook http://politi.co/1JDm23W ... New Jersey Playbook http://politi.co/1HLKltF ... Massachusetts Playbook http://politi.co/1Nhtq5v ...Illinois Playbook http://politi.co/1N7u5sb ... California Playbook http://politi.co/1N8zdJU ... Brussels Playbook http://politi.co/1FZeLcw", "article_metadata": {"og": {"site_name": "POLITICO", "description": "Cruz and Trump poised for the ugliest debate yet", "title": "GOP DEBATE DAY! \u2013 \u2018TRUMP, SANDERS: Are they killing the market?\u2019 \u2013 PHILIPPE\u2019s blistering email -- MADELEINE\u2019s mea culpa", "url": "http://www.politico.com/playbook/2016/02/gop-debate-day-trump-sanders-feb-13-212694", "image": "http://static.politico.com/97/de/e15842c94e928ce8b561e20745a0/whitelogoondots.jpeg", "fb_appid": 114037015331397, "type": "website"}, "twitter": {"site": "@politico", "card": "summary_large_image", "creator": "@politico"}, "description": "Cruz and Trump poised for the ugliest debate yet", "viewport": "width=device-width, initial-scale=1"}, "article_summary": "If heaven were open only to those who agreed on politics, I imagine it would be largely unoccupied.\u201d http://nyti.ms/1TYxuLCTHE CONVERSATION \u2013 Barron\u2019s cover, \u201cTRUMP, SANDERS: Are they killing the market?\nSee real examples of our progress: on.bp.com/safety **SUBSCRIBE to the Playbook family: POLITICO Playbook http://politi.co/1M75UbX ... New York Playbook http://politi.co/1ON8bqW ...Florida Playbook http://politi.co/1JDm23W ... New Jersey Playbook http://politi.co/1HLKltF ... Massachusetts Playbook http://politi.co/1Nhtq5v ...Illinois Playbook http://politi.co/1N7u5sb ... California Playbook http://politi.co/1N8zdJU ... Brussels Playbook http://politi.co/1FZeLcw\nRoundtable: Jim Messina and Karl Rove; report on President Obama\u2019s last budget; segment on how the Navy once camouflaged ships.\nSome conservative groups ... are asking voters to avoid Trump when they go to the S.C. polls Feb. 20.\nThat\u2019s why at BP, we\u2019re working every day to improve our training, our technology, our culture."}