{"article_title": "Obamacare Exchange Confirms: 'We Are Required to Respond to Certain Requests from Law Enforcement'", "article_keywords": ["respond", "enforcement", "marketplace", "confirms", "privacy", "exchange", "certain", "required", "obamacare", "mhc", "insurance", "information", "policy", "requests", "law", "maryland", "weekly"], "article_url": "http://www.weeklystandard.com/obamacare-exchange-confirms-we-are-required-to-respond-to-certain-requests-from-law-enforcement/article/762495", "article_text": "The regulations cited by Ms. Charlow, while stating that sharing personally identifiable information is proscribed for reasons \"that are not permitted or required by law,\" do not specifically address what types of law enforcement and/or audit activities might qualify for an exception, nor do the regulations detail who is authorized to make the determination for what qualifies for an exception.\n\nThe Maryland Health Connection Privacy Policy has been developed in compliance with federal regulations codified at 45 C.F.R. \u00a7 155.260 and 45 C.F.R. \u00a7 155.280 to ensure consumer protections and operations of the insurance marketplace. Like all state agencies, we are required to respond to certain requests from law enforcement.\n\nA follow up email sent to the MHC a day after the story ran was answered by the MHC with the promise of a response the following day, but none was forthcoming. A third email sent on Friday, October 11, was finally answered late that evening by communications manager Betsy Charlow.\n\nAn email had been sent to the MHC on October 3 requesting clarification of the policy, and included these inquires: Does that include both federal and state authorities? What type of information from the application might be of interest to law enforcement and/or state/federal auditors? However, no response was received before the story was published.\n\nOn October 8, THE WEEKLY STANDARD reported that the privacy policy of the Maryland Health Connection (MHC), the state's Obamacare insurance marketplace, included a statement that the marketplace \"may share information provided in your application with the appropriate authorities for law enforcement and audit activities.\"\n\nOn October 8, THE WEEKLY STANDARD reported that the privacy policy of the Maryland Health Connection (MHC), the state's Obamacare insurance marketplace, included a statement that the marketplace \"may share information provided in your application with the appropriate authorities for law enforcement and audit activities.\"\n\nThe Weekly Standard http://assets.weeklystandard.com.s3.amazonaws.com/tws15/images/logo-large.png\n\nThe Weekly Standard\n\n2013\n\nWashington, DC\n\nPolitics\n\nhttp://www.weeklystandard.com/obamacare-exchange-confirms-we-are-required-to-respond-to-certain-requests-from-law-enforcement/article/762495\n\n2013-10-14T14:12\n\n2013-10-14T14:15\n\nObamacare Exchange Confirms: 'We Are Required to Respond to Certain Requests from Law Enforcement'\n\nOn October 8, THE WEEKLY STANDARD reported that the privacy policy of the Maryland Health Connection (MHC), the state's Obamacare insurance marketplace, included a statement that the marketplace may share information provided in your application with the appropriate authorities for law enforcement and audit activities. An email had been sent to the MHC on October 3 requesting clarification of the policy, and included these inquires: Does that include both federal and state authorities? What type of information from the application might be of interest to law enforcement and/or state/federal auditors? However, no response was received before the story was published.\n\nBarack Obama, Health Care, insurance, Maryland, Obamacare, privacy, Jeryl Bier\n\nhttp://cdn.weeklystandard.biz/cache/280x280-.jpg", "article_metadata": {"news_keywords": "Barack Obama,Health Care,insurance,Maryland,Obamacare,privacy,Jeryl Bier", "og": {"url": "http://www.weeklystandard.com/obamacare-exchange-confirms-we-are-required-to-respond-to-certain-requests-from-law-enforcement/article/762495", "type": "article", "site_name": "Weekly Standard", "description": "On October 8, THE WEEKLY STANDARD&nbsp;reported&nbsp;that the&nbsp;privacy policy&nbsp;of the Maryland Health Connection (MHC), the state's Obamacare insurance marketplace, included a statement that the marketplace may share information provided in your application with the appropriate authorities for law enforcement and audit activities.\nAn email had been sent to the MHC on October 3 requesting clarification of the policy, and included these inquires:&nbsp;Does that include both federal and state authorities? &nbsp;What type of information from the application might be of interest to law enforcement and/or state/federal auditors? &nbsp;However, no response was&nbsp;received before the story was published.", "title": "Obamacare Exchange Confirms: 'We Are Required to Respond to Certain Requests from Law Enforcement'"}, "twitter": {"widgets": {"csp": "on"}, "site": "@weeklystandard", "description": "On October 8, THE WEEKLY STANDARD&nbsp;reported&nbsp;that the&nbsp;privacy policy&nbsp;of the Maryland Health Connection (MHC), the state's Obamacare insurance marketplace, included a statement that the marketplace may share information provided in your application with the appropriate authorities for law enforcement and audit activities.\nAn email had been sent to the MHC on October 3 requesting clarification of the policy, and included these inquires:&nbsp;Does that include both federal and state authorities? &nbsp;What type of information from the application might be of interest to law enforcement and/or state/federal auditors? &nbsp;However, no response was&nbsp;received before the story was published.", "card": "summary", "title": "Obamacare Exchange Confirms: 'We Are Required to Respond to Certain Requests from Law Enforcement'"}, "fb": {"admins": 1285945407}, "google-site-verification": "QxcYUvYDy42iu46zPMF2vwdQlMXsJP74MqOgujGnpaQ", "keywords": "Barack Obama,Health Care,insurance,Maryland,Obamacare,privacy,Jeryl Bier", "article": {"author": "Jeryl Bier", "published_time": "2013-10-14 14:12", "title": "Obamacare Exchange Confirms: 'We Are Required to Respond to Certain Requests from Law Enforcement'"}, "viewport": "width=device-width,user-scalable=0"}, "_id": "\"57477af46914bd0286fd89ad\"", "article_summary": "Like all state agencies, we are required to respond to certain requests from law enforcement.\nWhat type of information from the application might be of interest to law enforcement and/or state/federal auditors?\nThe Maryland Health Connection Privacy Policy has been developed in compliance with federal regulations codified at 45 C.F.R.\nBarack Obama, Health Care, insurance, Maryland, Obamacare, privacy, Jeryl Bierhttp://cdn.weeklystandard.biz/cache/280x280-.jpg\n\u00a7 155.280 to ensure consumer protections and operations of the insurance marketplace."}