{"article_title": "Coeur d'Alene Press: Business", "article_keywords": ["firm", "consulting", "simon", "benefits", "dalene", "business", "coeur", "provide", "sears", "manager", "health", "press", "law", "engineers"], "article_url": "http://cdapress.com/news/business/article_0677f193-f0f6-5e2c-a021-3814ee06f1f9.html", "article_text": "Helbling Benefits Consulting adds Sears, Simon\n\nHelbling Benefits Consulting announced the addition of two new employees: Josh Sears and Brandon Simon.\n\n\u2022 Josh Sears has joined the firm as general counsel and benefits consultant. Sears has practiced law in Idaho mostly in the areas of ERISA, employee benefits, COBRA, HIPAA and the Affordable Care Act. He previously worked in-house for a third party health insurance payor and ran his own law firm specializing in employee benefits and general corporate matters. Sears will provide in-house counsel for the firm and consult with clients in the areas of compliance, ERISA, employment law and much more. He will also provide benefits consulting and brokering for large employer-sponsored group health plans in Idaho.\n\n\u2022 Brandon Simon has joined the firm as a benefits consultant. Prior to joining HBC, Simon worked as the district sales manager for Blue Cross of Idaho. Simon has 17 years of experience in the health care industry and will provide benefits consulting and brokering for large employer-sponsored group health plans in Idaho.\n\nWeymouth elected to T-O Engineers Board of Directors\n\nBen Weymouth, professional engineer, has been elected secretary of the T-O Engineers Board of Directors. Weymouth is T-O Engineers\u2019 Coeur d\u2019Alene office manager and a seasoned project manager with more than 18 years of experience and a wide range of expertise. He works closely with his clients to guide them through complex agency requirements, and often applies his past agency experience to untangle complex entitlement and permitting issues. He works on land developments, sewer and water projects, roadway improvements, airport landside development and maintenance, and utility company system improvements and expansions. His clients include public agencies, private and public utility companies, Native American tribes and developers.\n\nFor more information about T-O Engineers, visit www.to-engineers.com.\n\nIf you have a new, relocated or expanded business, or announcement of events, promotions or awards, The Press wants to let our readers know. The service is free and items run Tuesday through Saturday. To get the word on the street about your movers and shakers, email City Editor Maureen Dolan at mdolan@cdapress.com.", "article_metadata": {"description": "Helbling Benefits Consulting adds Sears, Simon", "og": {"site_name": "Coeur d'Alene Press", "description": "Helbling Benefits Consulting adds Sears, Simon", "title": "Movers and shakers", "url": "http://cdapress.com/news/business/article_0677f193-f0f6-5e2c-a021-3814ee06f1f9.html", "image": "http://cdapress.com/app/CDAPress_200x200.jpg", "type": "article"}, "twitter": {"card": "summary"}, "fb": {"app_id": 145597345537708}, "keywords": "business", "news_keywords": "business"}, "article_summary": "Helbling Benefits Consulting adds Sears, SimonHelbling Benefits Consulting announced the addition of two new employees: Josh Sears and Brandon Simon.\nHe will also provide benefits consulting and brokering for large employer-sponsored group health plans in Idaho.\nWeymouth is T-O Engineers\u2019 Coeur d\u2019Alene office manager and a seasoned project manager with more than 18 years of experience and a wide range of expertise.\nIf you have a new, relocated or expanded business, or announcement of events, promotions or awards, The Press wants to let our readers know.\nSimon has 17 years of experience in the health care industry and will provide benefits consulting and brokering for large employer-sponsored group health plans in Idaho."}