{"article_title": "Harry Reid Denies All Obamacare 'Horror Stories'; 'All Are Untrue'", "article_keywords": ["denies", "untrue", "brothers", "horror", "republicans", "obamacare", "paid", "theyre", "reid", "harry", "america", "tales", "told"], "article_url": "http://www.weeklystandard.com/harry-reid-denies-all-obamacare-horror-stories-all-are-untrue/article/783449", "article_text": "\"Mr. President, these two brothers are trying to buy America. They not only funnel money through their Americans for Prosperity, they funnel money into all kinds of organizations to do the same thing that they're doing. They're trying to buy America. I don't believe america is for sale. We'll see, Mr. President.\"\n\n\"We heard about the evils of Obamacare, about the lives it's ruining in Republicans' stump speeches and in ads paid for by oil magnates, the Koch brothers. But in those tales, turned out to be just that: tales, stories made up from whole cloth, lies distorted by the Republicans to grab headlines or make political advertisements.\n\n\"The leukemia patient whose insurance policy was canceled [and] could die without her medication, Mr. President, that's an ad being paid for by two billionaire brothers. It's absolutely false. Or the woman whose insurance policy went up $700 a month--ads paid for around America by the multibillionaire Koch brothers, and the ad is false.\n\n\"Despite all that good news, there's plenty of horror stories being told. All of them are untrue, but they're being told all over America,\" said Reid.\n\n\"Despite all that good news, there's plenty of horror stories being told. All of them are untrue, but they're being told all over America,\" said Reid.\n\nThe Weekly Standard http://assets.weeklystandard.com.s3.amazonaws.com/tws15/images/logo-large.png\n\nThe Weekly Standard\n\n2014\n\nWashington, DC\n\nPolitics\n\nhttp://www.weeklystandard.com/harry-reid-denies-all-obamacare-horror-stories-all-are-untrue/article/783449\n\n2014-02-26T10:21\n\n2014-02-26T09:25\n\nHarry Reid Denies All Obamacare 'Horror Stories'; 'All Are Untrue'\n\nHarry Reid spoke about the Obamacare horror stories on the Senate floor this morning. He said that all are untrue. Despite all that good news, there's plenty of horror stories being told. All of them are untrue, but they're being told all over America, said Reid. The leukemia patient whose insurance policy was canceled [and] could die without her medication, Mr. President, that's an ad being paid for by two billionaire brothers. It's absolutely false. Or the woman whose insurance policy went up $700 a month--ads paid for around America by the multibillionaire Koch brothers, and the ad is false. We heard about the evils of Obamacare, about the lives it's ruining in Republicans' stump speeches and in ads paid for by oil magnates, the Koch brothers. But in those tales, turned out to be just that: tales, stories made up from whole cloth, lies distorted by the Republicans to grab headlines or make political advertisements.\n\nDaniel Halper, Harry Reid, Obamacare, Senate\n\nhttp://cdn.weeklystandard.biz/cache/280x280-.jpg", "article_metadata": {"news_keywords": "Daniel Halper,Harry Reid,Obamacare,Senate", "og": {"url": "http://www.weeklystandard.com/harry-reid-denies-all-obamacare-horror-stories-all-are-untrue/article/783449", "type": "article", "site_name": "Weekly Standard", "description": "Harry Reid spoke about the Obamacare horror stories on the Senate floor this morning. He said that all are untrue.\n\nDespite all that good news, there's plenty of horror stories being told. All of them are untrue, but they're being told all over America, said Reid.&nbsp;\nThe leukemia patient whose insurance policy was canceled [and] could die without her medication, Mr. President, that's an ad being paid for by two billionaire brothers. It's absolutely false. Or the woman whose insurance policy went up $700 a month--ads paid for around America by the multibillionaire Koch brothers, and the ad is false.\nWe heard about the evils of Obamacare, about the lives it's ruining in Republicans' stump speeches and in ads paid for by oil magnates, the Koch brothers. But in those tales, turned out to be just that: tales, stories made up from whole cloth, lies distorted by the Republicans to grab headlines or make political advertisements.", "title": "Harry Reid Denies All Obamacare 'Horror Stories'; 'All Are Untrue'"}, "twitter": {"description": "Harry Reid spoke about the Obamacare horror stories on the Senate floor this morning. He said that all are untrue.\n\nDespite all that good news, there's plenty of horror stories being told. All of them are untrue, but they're being told all over America, said Reid.&nbsp;\nThe leukemia patient whose insurance policy was canceled [and] could die without her medication, Mr. President, that's an ad being paid for by two billionaire brothers. It's absolutely false. Or the woman whose insurance policy went up $700 a month--ads paid for around America by the multibillionaire Koch brothers, and the ad is false.\nWe heard about the evils of Obamacare, about the lives it's ruining in Republicans' stump speeches and in ads paid for by oil magnates, the Koch brothers. But in those tales, turned out to be just that: tales, stories made up from whole cloth, lies distorted by the Republicans to grab headlines or make political advertisements.", "creator": "@danielhalper", "title": "Harry Reid Denies All Obamacare 'Horror Stories'; 'All Are Untrue'", "site": "@weeklystandard", "widgets": {"csp": "on"}, "card": "summary"}, "fb": {"admins": 1285945407}, "google-site-verification": "QxcYUvYDy42iu46zPMF2vwdQlMXsJP74MqOgujGnpaQ", "keywords": "Daniel Halper,Harry Reid,Obamacare,Senate", "article": {"author": "Daniel Halper", "published_time": "2014-02-26 10:21", "title": "Harry Reid Denies All Obamacare 'Horror Stories'; 'All Are Untrue'"}, "viewport": "width=device-width,user-scalable=0"}, "_id": "\"57477af46914bd0286fe2a6b\"", "article_summary": "The Weekly Standard http://assets.weeklystandard.com.s3.amazonaws.com/tws15/images/logo-large.pngThe Weekly Standard2014Washington, DCPoliticshttp://www.weeklystandard.com/harry-reid-denies-all-obamacare-horror-stories-all-are-untrue/article/7834492014-02-26T10:212014-02-26T09:25Harry Reid Denies All Obamacare 'Horror Stories'; 'All Are Untrue'Harry Reid spoke about the Obamacare horror stories on the Senate floor this morning.\nAll of them are untrue, but they're being told all over America, said Reid.\nAll of them are untrue, but they're being told all over America,\" said Reid.\nDaniel Halper, Harry Reid, Obamacare, Senatehttp://cdn.weeklystandard.biz/cache/280x280-.jpg\nWe heard about the evils of Obamacare, about the lives it's ruining in Republicans' stump speeches and in ads paid for by oil magnates, the Koch brothers."}