{"article_title": "Skylar Diggins SPARKS Dating Frenzy With Kiss During ESPYs [INSTAGRAM PICS] 'Believe Me' BFF Nicki Minaj Jealous?", "article_keywords": ["diggins", "rumors", "instagram", "sparks", "espys", "drake", "pics", "minaj", "skylar", "nicki", "frenzy", "kiss", "latest", "jealous", "dating", "posted"], "article_url": "http://www.fashionnstyle.com/articles/22754/20140720/drake-new-girlfriend-rumors-2014-skylar-diggins-sparks-dating-frenzy-kiss-espys-instagram-pics-believe-me-bff-nicki-minaj-jealous.htm", "article_text": "The Eye\n\nDrake New Girlfriend Rumors 2014: Skylar Diggins SPARKS Dating Frenzy With Kiss During ESPYs [INSTAGRAM PICS] 'Believe Me' BFF Nicki Minaj Jealous?\n\nSIGN UP TO RECEIVE THE LATEST NEWS FROM FASHION&STYLE\n\n(Photo : Kevin Winter/Getty Images) ESPYs host Drake with WNBA player Skylar Diggins onstage during the 2014 ESPYS at Nokia Theatre L.A. Live on July 16, 2014 in Los Angeles, California.\n\nDrake and Skylar Diggins had no problem showing some PDA during the 2014 ESPYs as new dating rumors continue to flourish.\n\n\n\nThe 27-year-old rapper tried to get as cozy as possible to the 23-year-old WNBA star while hosting the ESPYs on ESPN on Wednesday night.\n\n\n\n\n\n\n\n\n\n\n\n\n\n\n\nIt\u2019s no secret that Drake is completely smitten with Diggins, who already has a steady boyfriend.\n\n\n\nDrake tried to woo Diggins by reading a poem titled \u201cCan I Dig In?\u201d She basically shot him down, called him crazy and made a deal that if she kissed him one time he would leave her alone once and for all.\n\n\n\n\n\n\n\n\n\n\n\n\n\n\n\nSo that\u2019s exactly what happened. She gave him a kiss right on the forehead.\n\n\n\n\n\n\n\n\n\n\n\n\n\n\n\n\n\n\n\nDrake is known for posting pictures of Diggins on his Instagram.\n\n\n\n\n\nRumors went ballistic when Drake a posted a picture on his Instagram of him wearing a yellow shirt with Diggins' basketball number and her name on the back.\n\n\n\n\n\n\n\n\"Feeling truly blessed today. Been down and I'm grateful to be on my feet in this wonderful weather with wonderful people,\" Drake captioned the photo.\n\n\n\nAccording to Beauty World News, fans thought that Drake was trying to break up Diggins and her longtime boyfriend Daniel Smith. But Drake's friend, OB O'Brien, said it wasn't true at all.\n\n\n\nBack in May, Drake posted photos of Diggins on his Instagram, fueling dating rumors back then as well.\n\n\n\n\n\n\n\n\n\n\n\nDiggins and Drake would definitely make a cute couple, but it\u2019s too bad Diggins already has someone.\n\n\n\nYoung Money fans though think Drake and his bestie Nicki Minaj should give a shot at dating though.\n\n\n\nDrake posted some photos of him and the 31-year-old rapper performing together on his Instagram back in June.\n\n\n\n\n\n\n\n\n\n\n\n\n\n\n\nAnd it looks like Minaj knows Drake very well, so well that she knows what kind of woman he likes.\n\n\"I think what works with Drake is if you act like you don't like him,\" said Minaj on U.K.'s Capital Xtra in the Morning show on Tuesday, June 23.\n\n\n\nRead the latest Drake news HERE.\n\n\n\nSIGN UP TO RECEIVE THE LATEST NEWS FROM FASHION&STYLE\n\n\u00a9 2015 Fashion & Style.com All rights reserved. Do not reproduce without permission.", "article_metadata": {"Description": "Drake and Skylar Diggins had no problem showing some PDA during the 2014 ESPYs as new dating rumors continue to flourish.", "Copyright": "2014 Fashion&Style", "Author": "Fashion&Style", "og": {"site_name": "Fashion & Style", "description": "Drake and Skylar Diggins had no problem showing some PDA during the 2014 ESPYs as new dating rumors continue to flourish.", "title": "Drake New Girlfriend Rumors 2014: Skylar Diggins SPARKS Dating Frenzy With Kiss During ESPYs [INSTAGRAM PICS] 'Believe Me' BFF Nicki Minaj Jealous?", "url": "http://www.fashionnstyle.com/articles/22754/20140720/drake-new-girlfriend-rumors-2014-skylar-diggins-sparks-dating-frenzy-kiss-espys-instagram-pics-believe-me-bff-nicki-minaj-jealous.htm", "image": "http://images.fashionnstyle.com/data/images/full/36007/drake-and-skylar-diggins.jpg", "type": "article"}, "twitter": {"domain": "fashionnstyle.com", "description": "Drake and Skylar Diggins had no problem showing some PDA during the 2014 ESPYs as new dating rumors continue to flourish.", "creator": "@FNStylecom", "url": "http://www.fashionnstyle.com/articles/22754/20140720/drake-new-girlfriend-rumors-2014-skylar-diggins-sparks-dating-frenzy-kiss-espys-instagram-pics-believe-me-bff-nicki-minaj-jealous.htm", "image": "http://images.fashionnstyle.com/data/images/full/36007/drake-and-skylar-diggins.jpg", "title": "Drake New Girlfriend Rumors 2014: Skylar Diggins SPARKS Dating Frenzy With Kiss During ESPYs [INSTAGRAM PICS] 'Believe Me' BFF Nicki Minaj Jealous?", "site": "@FNStylecom", "card": "summary_large_image"}, "syndication-source": "http://www.fashionnstyle.com/articles/22754/20140720/drake-new-girlfriend-rumors-2014-skylar-diggins-sparks-dating-frenzy-kiss-espys-instagram-pics-believe-me-bff-nicki-minaj-jealous.htm", "robots": "index, follow", "Keywords": "Fashion&Style", "Googlebot-news": "index, follow", "Title": "Fashion&Style offers online coverage of latest fashion news, hottest trends and celebrity style from around the world, unveiling fashion and style from street corners to runways and red carpets.", "article": {"published_time": "2014-07-20"}, "Subject": "fashionnstyle.com", "viewport": "width=device-width", "news_keywords": "drake, rihanna, girlfriend, rumors, nicki minaj, 2014, skylar diggins, espys, host, net worth, trophies, age, interview, music, album, dating, rumors, wnba, instagram, twitter, break up, take care, daniel smith, new song"}, "_id": "\"57477af46914bd0286fe2728\"", "article_summary": "The EyeDrake New Girlfriend Rumors 2014: Skylar Diggins SPARKS Dating Frenzy With Kiss During ESPYs [INSTAGRAM PICS] 'Believe Me' BFF Nicki Minaj Jealous?\nDrake and Skylar Diggins had no problem showing some PDA during the 2014 ESPYs as new dating rumors continue to flourish.\nBack in May, Drake posted photos of Diggins on his Instagram, fueling dating rumors back then as well.\nDrake posted some photos of him and the 31-year-old rapper performing together on his Instagram back in June.\nRead the latest Drake news HERE."}